,ticker,date,time,headline,neg,neu,pos,compound
0,CX,2021-03-26,04:27PM,CEMEX and Construrama Empower Female Leadership in the Construction Industry,0.0,1.0,0.0,0.0
1,CX,2021-03-25,10:35AM,Can Cemex Break Out of its Long Base Pattern?,0.0,1.0,0.0,0.0
2,CX,2021-03-04,02:58PM,10 Best Mexican Stocks To Buy Now,0.0,0.588,0.412,0.6369
3,CX,2021-02-23,01:50PM,5 stocks to buy for the 1950s-style infrastructure supercycle: Morgan Stanley,0.0,1.0,0.0,0.0
4,CX,2021-02-17,09:59AM,"Brandes Investment Cuts Cemex, Baidu, FedEx",0.306,0.694,0.0,-0.296
5,CX,2021-02-12,11:50AM,Should Value Investors Buy Cemex (CX) Stock?,0.0,0.714,0.286,0.34
6,CX,2021-02-12,11:40AM,CX or VMC: Which Is the Better Value Stock Right Now?,0.0,0.629,0.371,0.6486
7,CX,2021-02-11,09:01PM,Cemex (CX) Q4 2020 Earnings Call Transcript,0.0,1.0,0.0,0.0
8,CX,2021-02-11,09:36AM,Recap: Cemex Q4 Earnings,0.0,1.0,0.0,0.0
9,CX,2021-02-11,08:15AM,Cemex SAB de CV to Host Earnings Call,0.0,1.0,0.0,0.0
10,CX,2021-02-11,07:31AM,UPDATE 2-Higher sales in Mexico and U.S. propel Cemex to $70 million profit,0.0,0.805,0.195,0.4404
11,CX,2021-02-11,06:51AM,"Cemex posts $70 mln Q4 profit with higher sales in U.S., Mexico",0.0,0.791,0.209,0.4404
12,CX,2021-02-10,10:30AM,Earnings Preview: Cemex,0.0,1.0,0.0,0.0
13,CX,2021-02-04,07:30AM,"CEMEX Committed to Participate in LEILAC 2 Project, Which Aims to Decarbonize Cement Production",0.0,0.851,0.149,0.2732
14,CX,2021-02-02,05:30PM,CEMEX Strengthens Supply Chain to Support U.S. Operations in Their Efforts to Address Cement Shortage,0.102,0.609,0.289,0.5719
15,CX,2021-02-01,04:50PM,CEMEX Announces Sale of Certain Assets in Southeastern France,0.0,0.648,0.352,0.4215
16,CX,2021-01-27,11:50AM,Should Value Investors Buy Cemex (CX) Stock?,0.0,0.714,0.286,0.34
17,CX,2021-01-27,11:40AM,CX or VMC: Which Is the Better Value Stock Right Now?,0.0,0.629,0.371,0.6486
18,CX,2021-01-05,08:20AM,11 Easiest Countries to Adopt a Baby,0.0,0.471,0.529,0.5423
19,CX,2020-12-15,06:06PM,Is CX A Good Stock To Buy Now?,0.0,0.674,0.326,0.4404
20,CX,2020-12-02,02:10PM,15 Tallest Completed Buildings in the World,0.0,1.0,0.0,0.0
21,CX,2020-11-19,12:54PM,"Charles Brandes' Firm Buys FEMSA, Trims Largest Holding Cemex",0.0,1.0,0.0,0.0
22,CX,2020-11-17,12:38PM,15 Largest Cement Companies in the World,0.0,1.0,0.0,0.0
23,CX,2020-10-29,12:32AM,Cemex (CX) Q3 2020 Earnings Call Transcript,0.0,1.0,0.0,0.0
24,CX,2020-10-28,06:57AM,Mexico's CEMEX posts $1.5 billion third-quarter loss,0.277,0.723,0.0,-0.3182
25,CX,2020-10-26,08:30AM,CEMEX to Offer Vertua® Net-Zero CO2 Concrete Worldwide,0.0,1.0,0.0,0.0
26,CX,2020-10-25,09:23AM,"Psyched: Cybin Raises CA$45M, Numinus Harvests Legal Mushrooms, Toadstool Enters Psychedelic Space",0.0,0.88,0.12,0.128
27,CX,2020-10-14,04:26PM,Latin American borrowers dial up sustainability efforts,0.0,1.0,0.0,0.0
28,CX,2020-09-24,06:00AM,CEMEXs Operations in Europe Announce a CO2 Reduction Target of at Least 55% By 2030,0.0,1.0,0.0,0.0
29,CX,2020-09-16,04:25PM,Morgan Stanley Bets on These 3 Stocks; Sees Over 40% Upside,0.0,1.0,0.0,0.0
30,CX,2020-08-13,05:13PM,Brandes Investment Seeing Profits on 2nd-Quarter Buys,0.0,0.674,0.326,0.4404
31,CX,2020-08-05,11:13AM,3 Stocks With Low Price-Sales Ratios,0.344,0.656,0.0,-0.2732
32,CX,2020-07-27,11:31PM,Cemex (CX) Q2 2020 Earnings Call Transcript,0.0,1.0,0.0,0.0
33,CX,2020-07-27,04:20PM,Why CEMEX Stock Rose 11% on July 27,0.0,1.0,0.0,0.0
34,CX,2020-07-27,07:20AM,Cemex: Q2 Earnings Insights,0.0,1.0,0.0,0.0
35,CX,2020-07-27,04:01AM,"Earnings Scheduled For July 27, 2020",0.0,1.0,0.0,0.0
36,CX,2020-07-05,03:42PM,Here is What Hedge Funds Think About Cemex SAB de CV (CX),0.0,1.0,0.0,0.0
37,CX,2020-06-18,11:29AM,Rebuilding America paves the way for potential gains in these construction and engineering stocks,0.0,0.844,0.156,0.34
38,CX,2020-06-17,01:37PM,Last-Mile Startup GoFor Raises C$9.8 million As Builders Shift To E-Commerce,0.0,1.0,0.0,0.0
39,CX,2020-06-16,03:31PM,"Why U.S. Steel, Cemex, and U.S. Concrete Stocks Popped 12% and More Today",0.0,1.0,0.0,0.0
40,CX,2020-06-16,08:27AM,Construction stocks surge after Bloomberg report of Trump preparing $1 trillion infrastructure plan,0.0,1.0,0.0,0.0
41,CX,2020-06-02,01:05PM,Shares of Cemex Rise on Financial Update,0.0,0.732,0.268,0.296
42,CX,2020-05-01,04:01PM,"CEMEX, S.A.B. de C.V. (CX) Q1 2020 Earnings Call Transcript",0.0,1.0,0.0,0.0
43,CX,2020-04-24,07:30AM,CEMEX Implements 50 New Hygiene and Safety Protocols to Address COVID-19,0.0,0.781,0.219,0.4215
44,CX,2020-04-06,11:26PM,CEMEX Resumes Operations in Mexico,0.0,1.0,0.0,0.0
45,CX,2020-04-06,08:28AM,Cemex resumes Mexico operations after brief pause due to coronavirus,0.0,1.0,0.0,0.0
46,CX,2020-04-06,06:50AM,CEMEX Complies With All Measures Established by the Mexican Government to Contain the COVID-19,0.0,1.0,0.0,0.0
47,CX,2020-03-26,07:00PM,CEMEX Continues Addressing Climate Change and Fostering Innovation,0.0,0.729,0.271,0.3818
48,CX,2020-03-26,03:43PM,Were Hedge Funds Right About Warming Up To Cemex SAB de CV (CX)?,0.0,0.882,0.118,0.1531
49,CX,2020-03-25,07:00PM,CEMEX Announces Organizational Changes,0.0,1.0,0.0,0.0
50,CX,2020-03-17,11:50AM,Is Cemex (CX) a Great Value Stock Right Now?,0.0,0.48,0.52,0.7579
51,CX,2020-03-06,04:57PM,CEMEX Finalizes Divestment of Cement Plant in Kentucky and Related Assets in the U.S.,0.0,0.884,0.116,0.1779
52,CX,2020-02-28,11:50AM,Are Investors Undervaluing Cemex (CX) Right Now?,0.0,1.0,0.0,0.0
53,CX,2020-02-21,08:49AM,Why CEMEX (CX) Could Be a Top Value Stock Pick,0.0,0.625,0.375,0.4939
54,CX,2020-02-19,04:45PM,CEMEX Announces Ambitious Strategy to Address Climate Change,0.0,0.693,0.307,0.4767
55,CX,2020-02-13,08:19AM,Moving Average Crossover Alert: CEMEX,0.0,0.645,0.355,0.296
56,CX,2020-02-12,11:50AM,Is Cemex (CX) a Great Value Stock Right Now?,0.0,0.48,0.52,0.7579
57,CX,2020-02-12,06:15AM,CEMEX Reports Fourth Quarter and Full-Year 2019 Results,0.0,1.0,0.0,0.0
58,CX,2020-02-06,10:35AM,7 Stocks To Buy Under $5,0.0,1.0,0.0,0.0
59,CX,2020-01-08,02:00AM,CEMEX Announces Divestment of Certain Assets in the UK,0.0,0.648,0.352,0.4215
60,CX,2019-12-19,10:40PM,Hedge Funds Are Dumping Cemex SAB de CV (CX),0.223,0.777,0.0,-0.3182
61,CX,2019-12-17,06:15AM,CEMEX Announces New Conversion Rate for Convertible Notes Due 2020,0.0,1.0,0.0,0.0
62,CX,2019-12-06,03:07PM,Brandes Investments' Top 5 Buys in the 3rd Quarter,0.0,0.795,0.205,0.2023
63,CX,2019-11-26,11:21AM,A Trio of Low Price-Book Stocks Expected to Outperform,0.231,0.769,0.0,-0.2732
64,CX,2019-11-26,06:00AM,CEMEX Announces Divestment of Kentucky Cement Plant and Related Assets in the U.S.,0.0,0.876,0.124,0.1779
65,CX,2019-11-20,10:12AM,Nafta Rewrite Runs Into Trouble as Mexican Reform Comes Up Short,0.213,0.787,0.0,-0.4019
66,CX,2019-11-19,06:52PM,Mexico's Cemex strikes deal to enter Chinese market,0.263,0.737,0.0,-0.3612
67,CX,2019-11-12,09:16PM,CEMEX Announces Pricing of U.S.$1.0 Billion of Senior Secured Notes,0.0,0.769,0.231,0.4019
68,CX,2019-10-27,01:57PM,Hedge Funds Arent Crazy About Cemex SAB de CV (CX) Anymore,0.0,0.831,0.169,0.2584
69,CX,2019-10-24,08:39AM,"UPDATE 3-Weak Mexico construction crimps Cemex's sales, shares dive",0.0,0.784,0.216,0.296
70,CX,2019-10-24,07:36AM,Mexico's Cemex reports 11% jump in net income amid lower financial costs,0.167,0.833,0.0,-0.296
71,CX,2019-10-24,06:15AM,CEMEX Reports Third Quarter 2019 Results,0.0,1.0,0.0,0.0
72,CX,2019-10-04,02:04PM,7 International Growth Stocks for Your Shortlist,0.0,0.658,0.342,0.3818
73,CX,2019-09-26,03:24PM,Forbes Recognizes CEMEX as One of the Worlds Best Regarded Companies,0.0,0.704,0.296,0.6369
74,CX,2019-09-12,05:30PM,CEMEX Ventures Invests In GoFor to Improve Delivery of Building Materials,0.0,0.775,0.225,0.4404
75,CX,2019-08-29,04:50PM,Why Cemex Stock Popped 10% Today,0.0,1.0,0.0,0.0
76,CX,2019-08-20,09:23AM,Mexico's Cemex starts program to buy back up to $500 mln in shares,0.0,0.845,0.155,0.296
77,CX,2019-08-07,11:29AM,CEMEX USA supplies concrete for $1.8 billion luxury project,0.0,1.0,0.0,0.0
78,CX,2019-08-06,04:30PM,CEMEX Announces Organizational Changes,0.0,1.0,0.0,0.0
79,CX,2019-08-02,03:02PM,3 Infrastructure Stocks to Ground Your Trading,0.0,1.0,0.0,0.0
80,CX,2019-07-25,10:37AM,Mexico's Cemex reduces 2019 guidance for volumes of cement and concrete,0.0,1.0,0.0,0.0
81,CX,2019-07-25,09:28AM,"UPDATE 4-Mexico's Cemex quarterly sales dip, sending shares lower",0.193,0.614,0.193,0.0
82,CX,2019-07-25,07:01AM,UPDATE 2-Mexico's Cemex quarterly sales dip on lower volumes in key markets,0.167,0.833,0.0,-0.296
83,CX,2019-07-25,06:28AM,Mexico's Cemex quarterly sales fall 3% on lower volumes,0.216,0.784,0.0,-0.296
84,CX,2019-07-25,06:15AM,CEMEX Reports Second Quarter 2019 Results,0.0,1.0,0.0,0.0
85,CX,2019-07-22,10:54AM,Bedrock of development: South Florida quarry produces 8M tons of crushed stone (Photos),0.189,0.811,0.0,-0.4215
86,CX,2019-07-18,05:30PM,CEMEX Ventures Presents the 10 Most Promising Construction Startups Of 2019,0.0,0.77,0.23,0.4576
87,CX,2019-07-09,05:46PM,Leaders Provide Insights to Optimize Construction Industry,0.0,0.652,0.348,0.4939
88,CX,2019-06-25,10:17AM,Is Cemex SAB de CV (CX) A Good Stock To Buy?,0.0,0.756,0.244,0.4404
89,CX,2019-06-25,09:14AM,Why Your Next Dollar Should Go To Mexican Stocks,0.0,1.0,0.0,0.0
90,CX,2019-06-19,05:00PM,BMV Recognizes CEMEX as Top Sustainability Performer for Fourth Consecutive Year,0.0,0.847,0.153,0.2023
91,CX,2019-06-03,12:18PM,7 Stocks to Sell Impacted by the Mexican Tariffs,0.0,1.0,0.0,0.0
92,CX,2019-05-31,08:42AM,9 US-Traded Mexico-Based Stocks To Keep An Eye On,0.0,1.0,0.0,0.0
93,CX,2019-05-30,12:16PM,CEMEX Completes Deployment Of CEMEX Go With Customers Worldwide,0.0,1.0,0.0,0.0
94,CX,2019-05-30,06:15AM,CEMEX Completes Deployment of CEMEX Go with Customers Worldwide,0.0,1.0,0.0,0.0
95,CX,2019-05-27,05:30PM,CEMEX Strengthens Its Commitment to the UN Sustainable Development Goals,0.0,0.588,0.412,0.6808
96,CX,2019-05-16,05:30PM,CEMEX Ventures Invests in Energy Vault to Support Rapid Deployment of Energy Storage Technology Using Concrete Blocks,0.087,0.596,0.317,0.6124
97,CX,2019-05-13,05:30PM,CEMEX Signs Final Agreement to Divest Aggregates and Ready-Mix Assets in Germany,0.0,0.671,0.329,0.5994
98,CX,2019-05-13,04:51PM,Brandes Investments' Top 5 Position Boosts in 1st Quarter,0.0,0.594,0.406,0.4767
99,CX,2019-04-26,02:47AM,"CEMEX, S.A.B. de C.V. (CX) Q1 2019 Earnings Call Transcript",0.0,1.0,0.0,0.0
