,ticker,date,time,headline,neg,neu,pos,compound
0,DUK,2021-04-14,07:42AM,3 Dividend Stocks Ideal for Retirees,0.0,0.541,0.459,0.5267
1,DUK,2021-04-13,12:50PM,Utilities Prep for Conversion to Clean Energy: 3 Stocks in View,0.0,0.625,0.375,0.5859
2,DUK,2021-04-13,12:10PM,Why Duke Energy (DUK) Could Beat Earnings Estimates Again,0.0,0.792,0.208,0.2732
3,DUK,2021-04-13,08:29AM,How much can you save driving a new EV? Duke Energy helps you crunch the numbers.,0.0,0.603,0.397,0.7845
4,DUK,2021-04-13,06:06AM,3 High-Yield Dividend Stocks That'll Help You Crush Inflation,0.155,0.583,0.262,0.2732
5,DUK,2021-04-12,09:40AM,Duke Energy to announce first-quarter 2021 financial results on May 10,0.0,0.826,0.174,0.2732
6,DUK,2021-04-08,11:56AM,"Duke Energy awards $653,000 in education-related grants in Florida",0.0,0.462,0.538,0.7184
7,DUK,2021-04-08,08:30AM,"Duke Energy, Wells Fargo, NextEra Energy Resources join forces on major solar expansion in North Carolina",0.0,0.588,0.412,0.7506
8,DUK,2021-04-07,03:40PM,How President Biden Helped Send Duke Energy Stock Up 12.8% in March,0.0,0.84,0.16,0.2732
9,DUK,2021-04-06,03:22PM,"Duke Energy awards $90,000 in Marketing Partnership Program grants to 18 Indiana economic development groups",0.0,0.632,0.368,0.7184
10,DUK,2021-04-06,11:04AM,"Duke Energy to provide $500,000 in grants for North Carolina small business revitalization",0.0,0.733,0.267,0.4588
11,DUK,2021-04-05,12:30PM,"Ready to dig? During National Safe Digging Month, Duke Energy reminds customers to call 811 first",0.0,0.634,0.366,0.7579
12,DUK,2021-04-01,12:38PM,Piedmont Natural Gas requires contractors to adopt new safe digging program; reports fewer damages to its underground facilities,0.121,0.583,0.296,0.4939
13,DUK,2021-03-31,07:31PM,Duke Energy responds to North Carolina Utilities Commission's decision on Duke Energy Carolinas' 2019 rate request,0.0,0.769,0.231,0.4939
14,DUK,2021-03-31,11:36AM,"Duke Energy awards $375,000 in grants to South Carolina tutoring programs, education initiatives impacted by pandemic",0.0,0.65,0.35,0.7184
15,DUK,2021-03-30,03:35PM,Duke Energy Says It Cant Reach Carbon-Cutting Targets Without Nuclear,0.096,0.716,0.188,0.2561
16,DUK,2021-03-30,09:00AM,Duke Energy announces key leadership appointments,0.0,0.704,0.296,0.2732
17,DUK,2021-03-29,03:45PM,Is DUK Stock A Buy or Sell?,0.0,1.0,0.0,0.0
18,DUK,2021-03-29,01:11PM,"Duke Energy Corporation -- Moody's downgrades Duke Energy to Baa2, Duke Carolinas to A2, and confirms Duke Progress at A2, outlooks stable",0.0,0.662,0.338,0.802
19,DUK,2021-03-29,10:00AM,Duke Energy's (DUK) Arm Files Rate Adjustment in North Carolina,0.0,1.0,0.0,0.0
20,DUK,2021-03-26,12:07PM,"North Carolina Capital Facilities Fin. Agy. -- Moody's downgrades Duke Energy to Baa2, Duke Carolinas to A2, and confirms Duke Progress at A2, outlooks stable",0.0,0.756,0.244,0.7269
21,DUK,2021-03-25,03:19PM,"Duke Energy commits $300,000 to support internship programs for minority college students",0.0,0.604,0.396,0.5994
22,DUK,2021-03-24,10:49AM,Duke Energy announces final payments to Contingent Value Obligation holders,0.0,0.64,0.36,0.5423
23,DUK,2021-03-23,02:37AM,Capital Allocation Trends At Duke Energy (NYSE:DUK) Aren't Ideal,0.234,0.589,0.177,-0.1719
24,DUK,2021-03-22,01:56PM,Piedmont Natural Gas files rate adjustment in North Carolina for capital investments to better serve customers,0.0,0.722,0.278,0.6597
25,DUK,2021-03-19,12:00PM,Public Service Commission of South Carolina to hold public hearing on Duke Energy's Solar Choice metering proposal,0.0,1.0,0.0,0.0
26,DUK,2021-03-17,03:50PM,Duke Energy's (DUK) 350-MW Windpower Project Becomes Operational,0.0,1.0,0.0,0.0
27,DUK,2021-03-17,03:44PM,"Duke Energy Foundation awards more than $311,000 in grants to support K-12 education initiatives in 15 Indiana counties",0.0,0.591,0.409,0.8271
28,DUK,2021-03-17,04:00AM,"'Mad Money' Lightning Round: Duke Energy, MP Materials",0.283,0.531,0.186,-0.2732
29,DUK,2021-03-16,12:14PM,Duke Energy's (DUK) Florida Arm Announces 2 New Solar Sites,0.0,1.0,0.0,0.0
30,DUK,2021-03-16,10:44AM,Duke Energy Renewables announces commercial operation of its largest windpower project - 350-MW Frontier II in Oklahoma,0.0,0.877,0.123,0.2732
31,DUK,2021-03-15,12:45PM,Piedmont Natural Gas seeks to help North Carolina customers offset their carbon footprint through new green energy program,0.0,0.673,0.327,0.743
32,DUK,2021-03-15,11:46AM,Duke Energy Florida announces 2 additional solar sites,0.0,0.741,0.259,0.2732
33,DUK,2021-03-14,04:23PM,3 Utility Stocks for Income Investors,0.0,1.0,0.0,0.0
34,DUK,2021-03-12,08:53AM,CMS Energy's (CMS) Arm Signs 140MW Solar PPA in Michigan,0.0,1.0,0.0,0.0
35,DUK,2021-03-12,07:12AM,3 Dividend Stocks That Pay You Better Than Coca-Cola Does,0.124,0.619,0.257,0.3612
36,DUK,2021-03-07,05:51AM,5 High-Yield Dividend Stocks to Buy for a Biden Bull Market,0.0,1.0,0.0,0.0
37,DUK,2021-03-04,11:21AM,CERAWEEK-U.S. utilities to keep gas in power mix for years in green transition,0.0,1.0,0.0,0.0
38,DUK,2021-03-04,10:03AM,U.S. utilities to keep gas in power mix for years in green transition,0.0,1.0,0.0,0.0
39,DUK,2021-03-03,08:10AM,3 Top Stocks to Recession-Proof Your Portfolio,0.0,0.735,0.265,0.2023
40,DUK,2021-03-02,11:55AM,Why Berkshire Hathaway Energy Is One of Warren Buffetts 4 Jewels,0.0,0.611,0.389,0.6249
41,DUK,2021-03-02,10:59AM,Duke Energy partners with five other utilities to push for more electric vehicle charging for customers,0.0,0.877,0.123,0.2732
42,DUK,2021-02-27,10:02AM,How to Find the Best Dividend Stocks,0.0,0.588,0.412,0.6369
43,DUK,2021-02-26,07:49PM,Utilities Offer Yield and a Way to Play Green Energy. And Their Stocks Are Cheap.,0.0,0.727,0.273,0.5423
44,DUK,2021-02-26,01:16PM,7 Stocks to Sell for March,0.0,1.0,0.0,0.0
45,DUK,2021-02-24,11:39AM,"Duke Energy provides $40,000 to aid Texans during recovery from historic winter weather events",0.0,0.861,0.139,0.2732
46,DUK,2021-02-24,08:59AM,"Duke Energy begins construction on 50-megawatt Cleveland County, N.C., solar project",0.0,0.826,0.174,0.2732
47,DUK,2021-02-23,09:00AM,Green Source Advantage offers more renewable energy options for South Carolina customers,0.0,0.695,0.305,0.5233
48,DUK,2021-02-21,02:36AM,Did You Participate In Any Of Duke Energy's (NYSE:DUK) Respectable 48% Return?,0.0,0.791,0.209,0.4404
49,DUK,2021-02-18,06:31PM,Duke Energy crews restore power in Carolinas as milder winter storm moves through region,0.0,0.736,0.264,0.5106
50,DUK,2021-02-17,01:44PM,Winter Storm to Dump Snow on New York and Icy Rain on Texas,0.178,0.822,0.0,-0.3818
51,DUK,2021-02-17,01:04PM,Duke Energy projects nearly 1 million power outages in Carolinas due to approaching winter storm; company ready to respond,0.0,0.777,0.223,0.5574
52,DUK,2021-02-16,07:02PM,"North Carolina Capital Facilities Fin. Agy. -- Moody's reviews Duke Energy, Duke Carolinas and Duke Progress for downgrade",0.0,0.766,0.234,0.5994
53,DUK,2021-02-16,02:36PM,Duke Energy solar generation flourishes for Florida,0.0,0.741,0.259,0.2732
54,DUK,2021-02-11,05:00PM,Duke Energy Corp (DUK) Q4 2020 Earnings Call Transcript,0.0,0.792,0.208,0.2732
55,DUK,2021-02-11,10:03AM,"Duke Energy (DUK) Q4 Earnings Beat, Revenues Decline Y/Y",0.0,0.792,0.208,0.2732
56,DUK,2021-02-11,09:48AM,Recap: Duke Energy Q4 Earnings,0.0,0.656,0.344,0.2732
57,DUK,2021-02-11,08:15AM,Duke Energy Corp. to Host Earnings Call,0.0,0.741,0.259,0.2732
58,DUK,2021-02-11,08:05AM,Duke Energy (DUK) Q4 Earnings Top Estimates,0.0,0.562,0.438,0.4404
59,DUK,2021-02-11,07:00AM,Duke Energy reports fourth-quarter and year-end 2020 financial results,0.0,0.792,0.208,0.2732
60,DUK,2021-02-10,12:48PM,"Colder weather, COVID quarantines and rising commodity prices contribute to higher natural gas bills",0.0,0.839,0.161,0.3612
61,DUK,2021-02-10,05:51AM,4 High-Yield Dividend Stocks You Can Safely Buy If the Market Crashes,0.0,0.758,0.242,0.4939
62,DUK,2021-02-08,09:49AM,Duke Energy (DUK) to Report Q4 Earnings: What's in the Cards?,0.0,0.826,0.174,0.2732
63,DUK,2021-02-07,10:50PM,"Twitter, General Motors, Uber, Walt Disney, and Other Stocks to Watch This Week",0.0,1.0,0.0,0.0
64,DUK,2021-02-04,04:13PM,Duke Energy names Melissa Seixas as Florida state president,0.0,0.792,0.208,0.2732
65,DUK,2021-02-03,12:19PM,10 Fastest-Growing Energy Sources in 2020,0.0,0.704,0.296,0.2732
66,DUK,2021-02-03,09:05AM,3 Utility Stocks With World-Class Dividends,0.0,1.0,0.0,0.0
67,DUK,2021-02-02,11:31AM,Is Duke Energy Stock a Buy?,0.0,0.656,0.344,0.2732
68,DUK,2021-02-01,01:10PM,Duke Energy named one of Fortune's 'World's Most Admired Companies' for fourth consecutive year,0.0,0.678,0.322,0.6901
69,DUK,2021-02-01,11:22AM,"New Duke Energy subsidiary, eTransEnergy, to help companies and cities transition commercial fleets to electric vehicles",0.0,0.745,0.255,0.5859
70,DUK,2021-01-29,12:19PM,Duke Energy promotes Karn as vice president for regulatory affairs and policy for Indiana,0.0,0.727,0.273,0.5423
71,DUK,2021-01-29,11:26AM,Duke Energy earns inclusive workplace recognition from Human Rights Campaign Foundation,0.0,0.826,0.174,0.2732
72,DUK,2021-01-28,05:33PM,"Duke Energy partners with GIC to secure minority investment in Duke Energy Indiana, increases long-term EPS growth rate",0.0,0.603,0.397,0.802
73,DUK,2021-01-26,06:17PM,Rio Paranapanema Energia S.A. -- Moody's assigns Ba1/Aaa.br ratings to Rio Paranapanema's new debentures; stable outlook,0.0,0.872,0.128,0.296
74,DUK,2021-01-25,07:00AM,"Duke Energy, Attorney General, Public Staff and Sierra Club reach agreement on N.C. coal ash costs",0.0,0.67,0.33,0.6597
75,DUK,2021-01-24,08:40AM,12 Best Utility Stocks To Buy Now,0.0,0.588,0.412,0.6369
76,DUK,2021-01-22,03:03AM,Are Duke Energy Corporation (NYSE:DUK) Investors Paying Above The Intrinsic Value?,0.0,0.667,0.333,0.5423
77,DUK,2021-01-21,08:31AM,"If you support green energy, you should buy utilities and oil stocks  heres why",0.0,0.714,0.286,0.5859
78,DUK,2021-01-20,11:55AM,Duke Energy (DUK) Continues Expansion in North Carolina,0.0,0.769,0.231,0.2732
79,DUK,2021-01-19,02:22PM,"Duke Energys CEO on the Path to Net Zero Carbon Emissions, and Why to Buy the Stock",0.0,1.0,0.0,0.0
80,DUK,2021-01-19,09:24AM,Duke Energy (DUK) Pushes for Clean Energy & Smarter Grid,0.0,0.336,0.664,0.836
81,DUK,2021-01-19,08:29AM,Record-breaking year in solar for Duke Energy customers in North Carolina,0.0,0.826,0.174,0.2732
82,DUK,2021-01-15,01:45PM,"Duke Energy Florida to invest in EV charging stations as part of clean energy plan, and raise rates",0.0,0.685,0.315,0.7096
83,DUK,2021-01-15,12:56PM,"Duke Energy Florida, key consumer groups reach sweeping agreement for building a smarter energy grid",0.0,0.439,0.561,0.8591
84,DUK,2021-01-14,10:45AM,Duke Energy establishes relationship with Optus Bank to support minority-owned businesses,0.0,0.652,0.348,0.5859
85,DUK,2021-01-14,02:54AM,3 Utilities Stocks Ready to Power Ahead,0.0,0.667,0.333,0.3612
86,DUK,2021-01-13,11:11AM,"Duke Energy, Firestone Walker Brewing complete one of the largest on-site solar arrays in craft beer industry",0.0,0.884,0.116,0.2732
87,DUK,2021-01-12,12:10PM,Will Duke Energy (DUK) Beat Estimates Again in Its Next Earnings Report?,0.0,0.84,0.16,0.2732
88,DUK,2021-01-08,09:44AM,Canadian Solar's (CSIQ) Subsidiary Sells 144MW Solar Project,0.0,1.0,0.0,0.0
89,DUK,2021-01-07,09:15AM,Duke Energy to announce fourth-quarter and year-end 2020 financial results on Feb. 11,0.0,0.851,0.149,0.2732
90,DUK,2021-01-07,08:37AM,Duke Energy Renewables acquires 144-MWac Pflugerville Solar project in Texas from Canadian Solar,0.0,0.851,0.149,0.2732
91,DUK,2021-01-04,01:33PM,Duke Energy announces dividend payments to shareholders,0.0,0.741,0.259,0.2732
92,DUK,2021-01-04,11:19AM,Duke Energy announces new head of Investor Relations,0.0,0.769,0.231,0.2732
93,DUK,2021-01-01,10:32AM,Barrons Best Income Investments for 2021,0.0,0.543,0.457,0.6369
94,DUK,2020-12-30,08:31AM,Utilities Sector Appears Set to Head Higher in 2021,0.0,1.0,0.0,0.0
95,DUK,2020-12-30,07:16AM,"If You're Retired, Consider Buying These 3 Stocks in 2021",0.0,1.0,0.0,0.0
96,DUK,2020-12-30,07:00AM,Todays Dirty Utilities May Be Tomorrows ESG Winners,0.242,0.5,0.258,0.0516
97,DUK,2020-12-26,02:23PM,15 Best Fictional Companies in the World,0.0,0.588,0.412,0.6369
98,DUK,2020-12-23,08:53AM,Could The Duke Energy Corporation (NYSE:DUK) Ownership Structure Tell Us Something Useful?,0.0,0.667,0.333,0.6124
99,DUK,2020-12-23,07:25AM,3 Stocks to Buy With Dividends Yielding More Than 4%,0.0,1.0,0.0,0.0
