,ticker,date,time,headline,neg,neu,pos,compound
0,ERIC,2021-04-14,07:00AM,ENCQOR 5G and Ericsson Deploy Standalone 5G Network to Drive Innovation and Edge Applications,0.0,0.833,0.167,0.3818
1,ERIC,2021-04-13,09:07AM,Ericsson (ERIC) Partners Firms to Bring 5G Standalone to Europe,0.0,1.0,0.0,0.0
2,ERIC,2021-04-12,05:28AM,Invitation to media and analyst briefing for Ericsson Q1 2021 report,0.0,1.0,0.0,0.0
3,ERIC,2021-04-12,05:17AM,Invitation to media and analyst briefing for Ericsson Q1 2021 report,0.0,1.0,0.0,0.0
4,ERIC,2021-04-12,05:15AM,Invitation to media and analyst briefing for Ericsson Q1 2021 report,0.0,1.0,0.0,0.0
5,ERIC,2021-04-08,01:30PM,Ericsson Is Setting Up Well as It Pushes Further Into 5G,0.0,0.826,0.174,0.2732
6,ERIC,2021-04-05,12:22PM,"Ericsson (ERIC) Targets Virtualized 5G RAN, Unveils Open Lab",0.0,1.0,0.0,0.0
7,ERIC,2021-04-02,11:50AM,Should Value Investors Buy Ericsson (ERIC) Stock?,0.0,0.714,0.286,0.34
8,ERIC,2021-04-02,11:30AM,Is Ericsson (ERIC) Stock Outpacing Its Computer and Technology Peers This Year?,0.0,1.0,0.0,0.0
9,ERIC,2021-04-01,04:31AM,UPDATE 1-KPN sues Sweden's Ericsson over telecom patents,0.0,1.0,0.0,0.0
10,ERIC,2021-03-31,03:27AM,Ericsson opens lab in Canada to test new 5G tech,0.0,1.0,0.0,0.0
11,ERIC,2021-03-30,09:18AM,Ericsson's Annual General Meeting 2021,0.0,1.0,0.0,0.0
12,ERIC,2021-03-30,08:11AM,Ericsson's Annual General Meeting 2021,0.0,1.0,0.0,0.0
13,ERIC,2021-03-30,08:08AM,Ericsson's Annual General Meeting 2021,0.0,1.0,0.0,0.0
14,ERIC,2021-03-29,08:33AM,"The Zacks Analyst Blog Highlights: Skyworks Solutions, Cambium Networks Corp, Ubiquiti, Aviat Networks and Ericsson",0.0,0.892,0.108,0.1779
15,ERIC,2021-03-26,11:52AM,P/E Ratio Insights for Ericsson,0.0,1.0,0.0,0.0
16,ERIC,2021-03-26,08:02AM,5G Emerges as a Hot Investment Theme in 2021: 5 Top Picks,0.0,0.833,0.167,0.2023
17,ERIC,2021-03-25,06:09PM,Ericsson Annual Report on Form 20-F filed with the SEC,0.0,1.0,0.0,0.0
18,ERIC,2021-03-25,05:01PM,Ericsson Annual Report on Form 20-F filed with the SEC,0.0,1.0,0.0,0.0
19,ERIC,2021-03-25,04:57PM,Ericsson Annual Report on Form 20-F filed with the SEC,0.0,1.0,0.0,0.0
20,ERIC,2021-03-25,08:36AM,"Williams-Sonoma, Freshpet, Intel, NETGEAR and Ericsson highlighted as Zacks Bull and Bear of the Day",0.0,1.0,0.0,0.0
21,ERIC,2021-03-24,09:24AM,Ericsson (ERIC) Modernizes Networks With New Programmability Tool,0.0,1.0,0.0,0.0
22,ERIC,2021-03-22,08:55AM,Here's Why Ericsson (ERIC) is a Promising Pick for Investors,0.0,0.748,0.252,0.4019
23,ERIC,2021-03-16,01:03PM,"Huawei To Charge 5G Royalties From Apple, Samsung: Bloomberg",0.0,1.0,0.0,0.0
24,ERIC,2021-03-16,09:02AM,Ericsson (ERIC) to Revamp Telenet's Network With 5G Rollout,0.0,1.0,0.0,0.0
25,ERIC,2021-03-15,03:33AM,Ericsson USA 5G Smart Factory recognized as 'Global Lighthouse' by the World Economic Forum,0.0,0.828,0.172,0.4019
26,ERIC,2021-03-15,03:28AM,Belgium prepares for 5G with new Ericsson-Telenet RAN partnership,0.0,1.0,0.0,0.0
27,ERIC,2021-03-11,06:33AM,Nokia Inks Patent License Deal With Samsung: Reuters,0.0,1.0,0.0,0.0
28,ERIC,2021-03-10,08:00AM,Mark Twain Communications Company selects Ericsson to upgrade network to 5G and deliver high-speed internet to Missouri,0.0,1.0,0.0,0.0
29,ERIC,2021-03-05,05:50PM,Ericsson (ERIC) Gains But Lags Market: What You Should Know,0.194,0.62,0.186,-0.0258
30,ERIC,2021-03-05,02:57AM,Ericsson Annual Report 2020 published,0.0,1.0,0.0,0.0
31,ERIC,2021-03-05,02:47AM,Ericsson Annual Report 2020 published,0.0,1.0,0.0,0.0
32,ERIC,2021-03-05,02:44AM,Ericsson Annual Report 2020 published,0.0,1.0,0.0,0.0
33,ERIC,2021-03-02,09:13AM,Ericsson (ERIC) Extends 5G Deal With Far EasTone in Taiwan,0.0,0.857,0.143,0.128
34,ERIC,2021-03-01,04:35AM,"Invitation to ""Ericsson shareholder dialogue 2021""",0.0,1.0,0.0,0.0
35,ERIC,2021-03-01,04:27AM,"Invitation to ""Ericsson shareholder dialogue 2021""",0.0,1.0,0.0,0.0
36,ERIC,2021-02-23,05:16AM,Ericsson named a Leader in the 2021 Gartner Magic Quadrant for 5G Network Infrastructure for Communications Service Providers report,0.0,1.0,0.0,0.0
37,ERIC,2021-02-23,05:12AM,Ericsson named a Leader in the 2021 Gartner Magic Quadrant for 5G Network Infrastructure for Communications Service Providers report,0.0,1.0,0.0,0.0
38,ERIC,2021-02-23,03:01AM,Notice of Ericsson's Annual General Meeting 2021,0.0,1.0,0.0,0.0
39,ERIC,2021-02-23,02:53AM,Notice of Ericsson's Annual General Meeting 2021,0.0,1.0,0.0,0.0
40,ERIC,2021-02-23,02:51AM,Notice of Ericsson's Annual General Meeting 2021,0.0,1.0,0.0,0.0
41,ERIC,2021-02-22,03:14AM,Ericsson to accelerate 5G mid-band rollouts with ultra-light Massive MIMO and RAN Compute solutions,0.0,0.884,0.116,0.1779
42,ERIC,2021-02-22,03:12AM,Ericsson to accelerate 5G mid-band rollouts with ultra-light Massive MIMO and RAN Compute solutions,0.0,0.884,0.116,0.1779
43,ERIC,2021-02-17,10:05AM,ITC To Investigate Patent Infringement Case By Ericsson Against Samsung: Reuters,0.237,0.763,0.0,-0.4767
44,ERIC,2021-02-16,07:02PM,U.S. ITC to investigate Ericsson complaint against Samsung over 5G wireless equipment,0.167,0.833,0.0,-0.296
45,ERIC,2021-02-15,07:00PM,Ericsson chief slams Europes non-functioning telecoms market,0.0,1.0,0.0,0.0
46,ERIC,2021-02-11,09:27AM,3 Top Tech Stocks Under $20 Per Share,0.0,0.556,0.444,0.4588
47,ERIC,2021-02-04,07:33PM,The 5G Revolution Could Send These 3 Stocks Higher,0.0,1.0,0.0,0.0
48,ERIC,2021-02-04,08:30AM,This 5G Stock Will Boost Its Dividend By 33%,0.0,0.748,0.252,0.4019
49,ERIC,2021-02-04,08:00AM,Ericsson Scraps Euro Bond Sale Plan With Little Explanation,0.0,1.0,0.0,0.0
50,ERIC,2021-02-01,12:24PM,Nokia Stock Gets an Upgrade Because Ericssons Earnings and 5G Performance Were So Good,0.0,0.803,0.197,0.4927
51,ERIC,2021-02-01,08:23AM,Nokia upped to buy after Ericsson results,0.0,1.0,0.0,0.0
52,ERIC,2021-01-29,11:17AM,Ericsson Crushed Earnings Expectations. It Has Become a Highly Profitable 5G Player.,0.187,0.6,0.213,0.101
53,ERIC,2021-01-29,10:01AM,Telefonaktiebolaget LM Ericsson (ERIC) Q4 2020 Earnings Call Transcript,0.0,1.0,0.0,0.0
54,ERIC,2021-01-29,09:39AM,Ericsson's (ERIC) Q4 Earnings Beat on Strong 5G Momentum,0.0,0.708,0.292,0.5106
55,ERIC,2021-01-29,07:05AM,Ericsson: Q4 Earnings Insights,0.0,1.0,0.0,0.0
56,ERIC,2021-01-29,04:19AM,Ericsson tops forecasts as 5G lifts off,0.0,0.645,0.355,0.5106
57,ERIC,2021-01-29,01:03AM,Ericsson Q4 core profit growth beats forecast on 5G boost,0.0,0.461,0.539,0.802
58,ERIC,2021-01-27,04:07PM,"How Nokia, Ericsson, and CEL-SCI Got Swept Up in the WallStreetBets Mania Today",0.0,1.0,0.0,0.0
59,ERIC,2021-01-27,08:20AM,Will Higher Revenues Aid Ericsson's (ERIC) Earnings in Q4?,0.0,1.0,0.0,0.0
60,ERIC,2021-01-26,09:20AM,Ericsson (ERIC) & Telia Launch Industrial Drone Service,0.0,1.0,0.0,0.0
61,ERIC,2021-01-26,03:16AM,Ericsson launches 5G RAN Slicing to spur 5G business growth,0.0,0.776,0.224,0.3818
62,ERIC,2021-01-18,08:25AM,Ericsson (ERIC) Boosts 5G Ecosystem in Taiwan With APT Alliance,0.0,0.796,0.204,0.3182
63,ERIC,2021-01-15,10:52AM,9 Hot Stocks to Buy Now to Profit off Chinese Markets,0.0,0.756,0.244,0.4404
64,ERIC,2021-01-15,08:56AM,"T-Mobile (TMUS) Partners Ericsson, Nokia to Expand 5G Footprint",0.0,0.777,0.223,0.3182
65,ERIC,2021-01-14,03:29AM,Invitation to media and analyst briefing for Ericsson Q4 and full year 2020 report,0.0,1.0,0.0,0.0
66,ERIC,2021-01-14,03:16AM,Invitation to media and analyst briefing for Ericsson Q4 and full year 2020 report,0.0,1.0,0.0,0.0
67,ERIC,2021-01-12,05:45PM,Ericsson (ERIC) Stock Sinks As Market Gains: What You Should Know,0.0,0.806,0.194,0.34
68,ERIC,2021-01-11,05:45PM,Ericsson (ERIC) Dips More Than Broader Markets: What You Should Know,0.0,1.0,0.0,0.0
69,ERIC,2021-01-09,09:25PM,10 Best Communication Equipment / 5G Stocks To Buy Now,0.0,0.656,0.344,0.6369
70,ERIC,2021-01-05,05:45PM,Ericsson (ERIC) Outpaces Stock Market Gains: What You Should Know,0.0,0.789,0.211,0.34
71,ERIC,2021-01-05,08:17AM,Ericsson (ERIC) Inks Five-Year 5G Deal With Ooredoo Group,0.0,1.0,0.0,0.0
72,ERIC,2020-12-29,05:45PM,Ericsson (ERIC) Gains As Market Dips: What You Should Know,0.0,0.789,0.211,0.34
73,ERIC,2020-12-21,05:45PM,Ericsson (ERIC) Dips More Than Broader Markets: What You Should Know,0.0,1.0,0.0,0.0
74,ERIC,2020-12-18,11:29AM,"The Zacks Analyst Blog Highlights: Qualcomm, T-Mobile US, Ericsson, Verizon and AT&T",0.0,1.0,0.0,0.0
75,ERIC,2020-12-14,05:45PM,Ericsson (ERIC) Gains As Market Dips: What You Should Know,0.0,0.789,0.211,0.34
76,ERIC,2020-12-11,09:28AM,"Without a Big 5G Win, the Clock Could Be Ticking on NOK Stock",0.218,0.782,0.0,-0.4717
77,ERIC,2020-12-11,08:35AM,Ericsson Shares Slump as It Starts Legal Fight With Samsung,0.195,0.526,0.278,0.0258
78,ERIC,2020-12-11,07:14AM,Ericsson (ERIC) Secures Deal to Deploy 5G Core for KDDI's Network,0.0,0.813,0.187,0.3182
79,ERIC,2020-12-07,05:45PM,Ericsson (ERIC) Gains As Market Dips: What You Should Know,0.0,0.789,0.211,0.34
80,ERIC,2020-12-07,05:50AM,Nokia says it's project leader on European 6G initiative,0.0,1.0,0.0,0.0
81,ERIC,2020-12-04,03:53PM,Nokia Needs a Win Now or Risks Serious Hemorrhaging,0.279,0.41,0.311,0.34
82,ERIC,2020-12-02,08:30AM,Ericsson (ERIC) Teams Up With WIND Hellas for 5G in Greece,0.0,1.0,0.0,0.0
83,ERIC,2020-12-01,04:45AM,Ericsson brings 5G to Greece with WIND Hellas,0.0,1.0,0.0,0.0
84,ERIC,2020-11-30,04:30PM,"Apple, TSM Named Top Stock Picks To Play 5G Wireless Growth Trend",0.0,0.57,0.43,0.7003
85,ERIC,2020-11-30,01:46PM,New drone technology uses data from mobile networks to chart flight paths. Here are the two companies behind it,0.0,1.0,0.0,0.0
86,ERIC,2020-11-30,12:54PM,Huaweis 5G telecom gear slapped with ban by U.K. government,0.286,0.714,0.0,-0.5574
87,ERIC,2020-11-30,04:07AM,Sweden's Ericsson sees 220 million 5G subscriptions by year end,0.0,1.0,0.0,0.0
88,ERIC,2020-11-30,04:00AM,Sweden's Ericsson sees 220 mln 5G subscriptions by year end,0.0,1.0,0.0,0.0
89,ERIC,2020-11-26,09:03AM,"Ericsson (ERIC), Chunghwa to Power Orsted Wind Farms' Network",0.0,1.0,0.0,0.0
90,ERIC,2020-11-25,12:46PM,There Are Good Reason to Feel Bullish About Ericsson Stock,0.0,0.756,0.244,0.4404
91,ERIC,2020-11-20,01:09PM,Invest in the 5G Boom by Buying Ericsson Stock,0.0,1.0,0.0,0.0
92,ERIC,2020-11-20,03:19AM,Correction of date for Ericsson's fourth quarter report 2020,0.0,1.0,0.0,0.0
93,ERIC,2020-11-20,03:09AM,Correction of date for Ericsson's fourth quarter report 2020,0.0,1.0,0.0,0.0
94,ERIC,2020-11-18,11:39AM,S&P upgrades Sweden's Ericsson to 'BBB-' with stable outlook,0.0,0.784,0.216,0.296
95,ERIC,2020-11-18,09:32AM,Ericsson (ERIC) Sees Global 5G Consumer Market at $31T by 2030,0.0,1.0,0.0,0.0
96,ERIC,2020-11-17,04:35AM,Ericsson estimates USD 31 trillion 5G consumer market by 2030,0.0,1.0,0.0,0.0
97,ERIC,2020-11-13,12:05PM,Nokia Stock Continues to Struggle to Rise Above $4,0.223,0.777,0.0,-0.3182
98,ERIC,2020-11-13,08:03AM,Nokia Stock Still Hobbled by 5G Ineptitude,0.0,1.0,0.0,0.0
99,ERIC,2020-11-10,09:19AM,Ericsson (ERIC) Ties Up With Telstra for Enterprise Edge Cloud,0.0,1.0,0.0,0.0
