,ticker,date,time,headline,neg,neu,pos,compound
0,ES,2021-04-08,03:55PM,New England Service Company To be Acquired by Aquarion Water Company,0.0,1.0,0.0,0.0
1,ES,2021-04-07,05:26PM,Eversource Energy names Joe Nolan as CEO,0.0,0.741,0.259,0.2732
2,ES,2021-04-07,04:45PM,"Eversource Energy Announces Leadership Changes Effective May 5, 2021",0.0,0.574,0.426,0.6369
3,ES,2021-04-06,11:30AM,"Eversource Again Recognized by Barrons as One of Americas ""Most Sustainable Companies""",0.0,1.0,0.0,0.0
4,ES,2021-03-25,03:27AM,Eversource Energy (NYSE:ES) May Have Issues Allocating Its Capital,0.0,0.792,0.208,0.2732
5,ES,2021-03-18,11:30AM,Eversource (ES) Down 0.5% Since Last Earnings Report: Can It Rebound?,0.0,1.0,0.0,0.0
6,ES,2021-02-23,01:29AM,A Look At The Intrinsic Value Of Eversource Energy (NYSE:ES),0.0,0.609,0.391,0.5423
7,ES,2021-02-20,07:34AM,3 Stocks to Buy Ahead of the Next Market Crash,0.252,0.748,0.0,-0.4019
8,ES,2021-02-17,06:00PM,Eversource Energy (ES) Q4 2020 Earnings Call Transcript,0.0,0.769,0.231,0.2732
9,ES,2021-02-16,04:30PM,Eversource Energy: Q4 Earnings Insights,0.0,0.656,0.344,0.2732
10,ES,2021-02-16,04:15PM,Eversource Energy Reports Full Year 2020 Results,0.0,0.741,0.259,0.2732
11,ES,2021-02-16,02:00AM,Global energy majors lead pivot to Eavors geothermal solution with USD$40 million investment,0.0,0.714,0.286,0.5267
12,ES,2021-02-10,12:31PM,Eversource Energy (ES) Earnings Expected to Grow: What to Know Ahead of Q4 Release,0.0,0.861,0.139,0.2732
13,ES,2021-02-10,10:00AM,Eversource Energy to Discuss 2020 Results,0.0,0.704,0.296,0.2732
14,ES,2021-02-09,04:15PM,Eversource Energy Declares Common Dividend,0.0,0.656,0.344,0.2732
15,ES,2021-01-27,11:55PM,Is Eversource Energy's (NYSE:ES) 8.4% ROE Strong Compared To Its Industry?,0.0,0.752,0.248,0.5106
16,ES,2021-01-20,07:00AM,"Hershey, Allstate, and 8 Other Beaten-Down Stocks With Rising Earnings Prospects",0.0,0.804,0.196,0.296
17,ES,2021-01-15,09:31AM,Looking Into Eversource Energy's Return On Capital Employed,0.0,1.0,0.0,0.0
18,ES,2020-12-29,01:12AM,Here's Why I Think Eversource Energy (NYSE:ES) Might Deserve Your Attention Today,0.0,0.826,0.174,0.2732
19,ES,2020-12-18,01:30AM,Where Do Hedge Funds Stand On Eversource Energy (ES)?,0.0,0.792,0.208,0.2732
20,ES,2020-12-03,11:30AM,Why Is Eversource (ES) Down 3.4% Since Last Earnings Report?,0.0,1.0,0.0,0.0
21,ES,2020-12-01,01:44AM,What Kind Of Shareholders Own Eversource Energy (NYSE:ES)?,0.0,0.769,0.231,0.2732
22,ES,2020-11-06,06:13PM,Eversource Energy Recommends Shareholders Reject the Below-Market Mini-Tender Offer by TRC Capital Corporation,0.162,0.599,0.24,0.0772
23,ES,2020-11-05,06:04AM,Earnings Update: Eversource Energy (NYSE:ES) Just Reported Its Third-Quarter Results And Analysts Are Updating Their Forecasts,0.0,0.877,0.123,0.2732
24,ES,2020-11-04,09:40AM,"Eversource (ES) Q3 Earnings Lag, Revenues Beat Estimates",0.255,0.745,0.0,-0.34
25,ES,2020-11-03,05:35PM,Eversource Energy (ES) Misses Q3 Earnings Estimates,0.211,0.556,0.233,0.0516
26,ES,2020-11-03,04:32PM,Recap: Eversource Energy Q3 Earnings,0.0,0.656,0.344,0.2732
27,ES,2020-11-03,04:15PM,Eversource Energy Reports Third Quarter Results,0.0,0.704,0.296,0.2732
28,ES,2020-11-02,10:15AM,Eversource Energy's Earnings: A Preview,0.0,1.0,0.0,0.0
29,ES,2020-10-29,08:37AM,Eversource (ES) to Report Q3 Earnings: What's in the Offing?,0.0,1.0,0.0,0.0
30,ES,2020-10-21,12:00PM,Top Utilities Stocks for November 2020,0.0,0.735,0.265,0.2023
31,ES,2020-10-20,09:04AM,What Does Eversource Energy's Debt Look Like?,0.25,0.5,0.25,0.0
32,ES,2020-10-20,07:37AM,Did You Participate In Any Of Eversource Energy's (NYSE:ES) Fantastic 104% Return ?,0.0,0.753,0.247,0.5574
33,ES,2020-10-19,01:00PM,Eversource Energy to Discuss Third Quarter Results,0.0,0.741,0.259,0.2732
34,ES,2020-10-01,05:50PM,Top Stocks for October 2020,0.0,0.69,0.31,0.2023
35,ES,2020-10-01,07:00AM,Edison Chouest Offshore Affiliate Executes Long-Term Charter Agreement With Ørsted And Eversource For Provision Of The First U.S. Jones Act Compliant Windfarm Service Operation Vessel,0.0,0.882,0.118,0.4939
36,ES,2020-09-28,11:34AM,Hedge Funds Keep Buying Eversource Energy (ES),0.0,0.741,0.259,0.2732
37,ES,2020-09-20,09:45AM,Is Eversource Energy (NYSE:ES) Likely To Turn Things Around?,0.0,0.792,0.208,0.2732
38,ES,2020-09-08,06:55PM,Analyst Report: Eversource Energy,0.0,0.588,0.412,0.2732
39,ES,2020-08-29,11:31AM,Eversource (ES) Down 6.4% Since Last Earnings Report: Can It Rebound?,0.0,1.0,0.0,0.0
40,ES,2020-08-25,11:28AM,Eversource (ES) to Ride on Solid Investments & Acquisitions,0.0,0.814,0.186,0.1531
41,ES,2020-08-24,09:34AM,"Benzinga's Top Upgrades, Downgrades For August 24, 2020",0.0,0.795,0.205,0.2023
42,ES,2020-08-18,01:11PM,How Much is Eversource Energy's (NYSE:ES) CEO Getting Paid?,0.0,1.0,0.0,0.0
43,ES,2020-08-12,12:26PM,New York Prepared for Another Sandy But Got Isaias Instead,0.0,0.826,0.174,0.2263
44,ES,2020-08-08,08:00AM,ConEd Calling in Hundreds More Workers to Restore N.Y. Power,0.0,0.785,0.215,0.3535
45,ES,2020-08-07,10:03AM,Amtrak Trains Delayed in Connecticut Because of Power Problems,0.397,0.603,0.0,-0.5574
46,ES,2020-08-04,06:30AM,Tech Companies Want You to Believe America Has a Skills Gap,0.0,0.874,0.126,0.0772
47,ES,2020-08-03,07:45AM,"Eversource (ES) Q2 Earnings In Line, Revenues Miss Estimates",0.167,0.833,0.0,-0.1531
48,ES,2020-07-30,09:00PM,Eversource Energy (ES) Q2 Earnings and Revenues Lag Estimates,0.209,0.609,0.183,-0.0772
49,ES,2020-07-30,04:15PM,Eversource Energy Reports Second Quarter Results,0.0,0.704,0.296,0.2732
50,ES,2020-07-30,12:09PM,"Utility Stock Q2 Earnings Roster for Jul 31: D, ES & More",0.0,1.0,0.0,0.0
51,ES,2020-07-29,11:51AM,Eversource (ES) to Report Q2 Earnings: What's in the Cards?,0.0,1.0,0.0,0.0
52,ES,2020-07-27,11:14AM,Eversource and National Grid Applaud ISO-New Englands Choice of the Ready Path Solution to Ensure Reliability When Mystic Generating Station Retires in 2024,0.0,0.646,0.354,0.8555
53,ES,2020-07-24,12:30PM,Eversource Energy (ES) Reports Next Week: Wall Street Expects Earnings Growth,0.0,0.657,0.343,0.5719
54,ES,2020-07-23,09:48AM,Aquarion Water Company of Connecticut -- Moody's announces completion of a periodic review of ratings of Aquarion Company,0.0,1.0,0.0,0.0
55,ES,2020-07-20,10:00AM,Eversource Energy to Discuss Second Quarter Results,0.0,0.741,0.259,0.2732
56,ES,2020-07-16,12:05PM,Cross-Sector: Market Data Highlights,0.0,1.0,0.0,0.0
57,ES,2020-07-12,12:30PM,Did Hedge Funds Make The Right Call On Eversource Energy (ES) ?,0.0,0.826,0.174,0.2732
58,ES,2020-07-11,10:41AM,Did Eversource Energy (NYSE:ES) Use Debt To Deliver Its ROE Of 7.1%?,0.171,0.685,0.144,-0.1027
59,ES,2020-06-30,09:00AM,ISO-NE Proposes to Advance Eversource and National Grid Ready Path Solution to Ensure Reliability When Mystic Generating Station Retires in 2024,0.0,0.709,0.291,0.7506
60,ES,2020-06-24,09:33AM,Coronavirus Dampens Utility Electric-Power Stock Outlook,0.0,1.0,0.0,0.0
61,ES,2020-06-16,09:03AM,"A budding recovery could run into trouble after the election, warns Goldman Sachs",0.291,0.709,0.0,-0.4767
62,ES,2020-06-15,09:54AM,4 Utility Stocks That are in Focus on Global Wind Day 2020,0.0,1.0,0.0,0.0
63,ES,2020-06-12,10:50AM,"Eversource Prices 6M Shares, to Fund Buyout With Proceeds",0.0,0.784,0.216,0.296
64,ES,2020-06-11,09:41AM,"Eversource Energy Prices Public Offering of 6,000,000 Common Shares",0.0,0.619,0.381,0.5106
65,ES,2020-06-11,07:26AM,"Eversource Energy Announces Public Offering of 6,000,000 Common Shares",0.0,0.619,0.381,0.5106
66,ES,2020-06-10,05:56PM,Hedge Funds Arent Done Buying Eversource Energy (ES),0.0,0.769,0.231,0.2732
67,ES,2020-06-05,11:31AM,Why Is Eversource (ES) Up 10.2% Since Last Earnings Report?,0.0,1.0,0.0,0.0
68,ES,2020-06-03,08:11AM,The Next Big Obstacle in Renewable Energy Is a Big Opportunity for Investors,0.152,0.549,0.299,0.34
69,ES,2020-06-01,05:25PM,Eversource Energy Trying To Close In On Key Technical Benchmark,0.0,0.811,0.189,0.2732
70,ES,2020-05-12,06:19PM,Edited Transcript of ES earnings conference call or presentation 7-May-20 1:00pm GMT,0.0,1.0,0.0,0.0
71,ES,2020-05-11,11:51AM,Gregory M. Jones Named to Eversource Board of Trustees,0.0,0.86,0.14,0.0772
72,ES,2020-05-08,12:46PM,Eversource Energy (NYSE:ES) First-Quarter Results Just Came Out: Here's What Analysts Are Forecasting For This Year,0.0,0.877,0.123,0.2732
73,ES,2020-05-08,10:44AM,"Eversource (ES) Q1 Earnings In Line, Revenues Miss Estimates",0.167,0.833,0.0,-0.1531
74,ES,2020-05-07,09:31PM,Eversource Energy (ES) Q1 2020 Earnings Call Transcript,0.0,0.769,0.231,0.2732
75,ES,2020-05-06,08:05PM,Eversource Energy (ES) Q1 Earnings Match Estimates,0.0,0.741,0.259,0.2732
76,ES,2020-05-06,04:10PM,Eversource Energy Reports First Quarter 2020 Results,0.0,0.741,0.259,0.2732
77,ES,2020-05-06,09:35AM,"Utility Stocks' Q1 Earnings Roster for May 7: ED, CNP & More",0.0,1.0,0.0,0.0
78,ES,2020-05-05,07:51PM,Were Hedge Funds Right About Eversource Energy (ES)?,0.0,0.769,0.231,0.2732
79,ES,2020-05-05,12:20PM,Eversource (ES) to Report Q1 Earnings: What's in the Offing?,0.0,1.0,0.0,0.0
80,ES,2020-04-30,10:00AM,Eversource Energy to Webcast First Quarter Results,0.0,0.741,0.259,0.2732
81,ES,2020-04-29,12:34PM,Eversource Energy (ES) Earnings Expected to Grow: Should You Buy?,0.0,0.811,0.189,0.2732
82,ES,2020-04-24,10:59AM,Here's Why You Should Add Portland General Electric (POR) Now,0.0,1.0,0.0,0.0
83,ES,2020-04-24,10:50AM,"3 Investing Facts About Required Minimum Distributions You Need to Know - April 24, 2020",0.0,1.0,0.0,0.0
84,ES,2020-04-22,08:35AM,Eversource Offers Ways to Celebrate Earth Day While Maintaining Social Distancing,0.0,0.73,0.27,0.5719
85,ES,2020-04-17,12:09PM,5 Utilities Outperforming the Market,0.0,1.0,0.0,0.0
86,ES,2020-04-17,10:26AM,Is Eversource Energy's (NYSE:ES) High P/E Ratio A Problem For Investors?,0.231,0.769,0.0,-0.4019
87,ES,2020-04-08,10:17AM,Eversource Foundation Donates More Than $2 Million to Support Communities During COVID-19 Pandemic,0.0,0.816,0.184,0.4019
88,ES,2020-04-07,06:20PM,These low-risk stocks have high potential in this volatile market,0.0,1.0,0.0,0.0
89,ES,2020-04-06,04:00PM,Eversource Energy Changes Its Annual Meeting of Shareholders to a Virtual Format,0.0,0.826,0.174,0.2732
90,ES,2020-04-02,11:43AM,This Trio of Good Performers May Be Overvalued,0.0,0.707,0.293,0.4404
91,ES,2020-03-27,10:27AM,Hedge Funds Have Never Been This Bullish On Eversource Energy (ES),0.0,0.826,0.174,0.2732
92,ES,2020-03-21,09:18AM,Did Eversource Energy's (NYSE:ES) Share Price Deserve to Gain 36%?,0.0,0.588,0.412,0.6808
93,ES,2020-03-20,11:30AM,Eversource (ES) Down 19.5% Since Last Earnings Report: Can It Rebound?,0.0,1.0,0.0,0.0
94,ES,2020-03-05,11:04AM,Eversource and National Grid Propose Innovative Solutions to Improve Reliability and Transition to a Clean Energy Future in Greater Boston,0.0,0.468,0.532,0.9153
95,ES,2020-03-04,07:31PM,"Financial Advisors Find Silver Lining In Gilead Sciences, Moderna Amid Coronavirus Worries",0.203,0.797,0.0,-0.4215
96,ES,2020-03-02,08:15AM,"The Zacks Analyst Blog Highlights: Medtronic, PetroChina Company, American Tower, Eversource Energy and Arista Networks",0.0,0.87,0.13,0.2732
97,ES,2020-02-27,05:33AM,Is It Worth Considering Eversource Energy (NYSE:ES) For Its Upcoming Dividend?,0.0,0.692,0.308,0.4588
98,ES,2020-02-26,08:57PM,NiSource Reports 2019 Results,0.0,1.0,0.0,0.0
99,ES,2020-02-26,07:42PM,Eversource to buy assets of Columbia Gas of Massachusetts,0.0,0.825,0.175,0.1779
