,ticker,date,time,headline,neg,neu,pos,compound
0,FEYE,2021-04-13,05:00AM,Annual FireEye Mandiant M-Trends Report Reveals Global Statistics and Insights From Hundreds of Diverse Intrusions,0.0,1.0,0.0,0.0
1,FEYE,2021-04-07,04:01PM,John Watters Rejoins FireEye Executive Team as President and Chief Operating Officer,0.0,1.0,0.0,0.0
2,FEYE,2021-04-07,07:00AM,"FireEye to Announce First Quarter 2021 Financial Results on April 27, 2021",0.0,1.0,0.0,0.0
3,FEYE,2021-04-05,10:17AM,Top 10 Stocks to Invest in For Beginner Investors,0.0,0.816,0.184,0.2023
4,FEYE,2021-03-31,05:00PM,Companies Must Quickly Report Hacks to U.S. Under Proposed Order,0.0,1.0,0.0,0.0
5,FEYE,2021-03-28,05:41AM,"What Kind Of Shareholders Own FireEye, Inc. (NASDAQ:FEYE)?",0.0,1.0,0.0,0.0
6,FEYE,2021-03-25,08:00AM,FireEye Recognized by Leading Independent Research Firm As a Strong Performer for Managed Detection & Response Service,0.0,0.809,0.191,0.5106
7,FEYE,2021-03-24,07:00AM,FireEye and FireEye CEO Recognized as Microsoft Security 20/20 Partner Awards Finalists for Top Managed Detection and Response Team and Security Industry Changemaker,0.0,0.664,0.336,0.8225
8,FEYE,2021-03-23,12:05PM,FireEye Named a Leader in External Threat Intelligence by Leading Independent Research Firm,0.206,0.606,0.188,-0.0772
9,FEYE,2021-03-16,08:00AM,Mandiant Introduces New Services to Counter Dynamic Insider Threats,0.226,0.565,0.21,-0.0516
10,FEYE,2021-03-10,05:53PM,Verkada Says It Notified FBI of Major Hack of Surveillance Data,0.0,1.0,0.0,0.0
11,FEYE,2021-03-10,04:00PM,FireEye Schedules Monthly Threat Briefings for Investors and Financial Analysts,0.274,0.726,0.0,-0.5267
12,FEYE,2021-03-09,05:00AM,"Chinas Microsoft Hack, Russias SolarWinds Attack Threaten to Overwhelm U.S.",0.514,0.486,0.0,-0.7506
13,FEYE,2021-03-08,03:01AM,Microsoft Attack Blamed on China Morphs Into Global Crisis,0.632,0.368,0.0,-0.8834
14,FEYE,2021-03-06,09:47AM,"Microsoft Server Flaws Raise Alarms at White House, DHS",0.208,0.792,0.0,-0.2732
15,FEYE,2021-03-05,05:10AM,FireEye Is Likely to Slip Still Lower in the Weeks Ahead,0.18,0.82,0.0,-0.296
16,FEYE,2021-03-04,11:30AM,Why Is FireEye (FEYE) Down 3.6% Since Last Earnings Report?,0.0,1.0,0.0,0.0
17,FEYE,2021-03-03,12:00PM,Why You Should Be Buying FireEye's Latest Dip,0.0,1.0,0.0,0.0
18,FEYE,2021-02-26,02:20PM,SolarWindss Security Practices Questioned by Lawmakers,0.179,0.513,0.308,0.25
19,FEYE,2021-02-26,08:41AM,New Strong Sell Stocks for February 26th,0.0,0.645,0.355,0.5106
20,FEYE,2021-02-23,06:39PM,"Senators, Tech Execs Recommend Hack Reporting Requirement",0.0,0.706,0.294,0.3612
21,FEYE,2021-02-23,04:41PM,"Russia assigned more than 1,000 expert engineers to execute SolarWinds hack, says Microsoft exec",0.0,1.0,0.0,0.0
22,FEYE,2021-02-23,02:07PM,"SolarWinds, Microsoft, FireEye, CrowdStrike To Testify In Senate In Russian Cyber Hack Case",0.0,1.0,0.0,0.0
23,FEYE,2021-02-23,12:03PM,"UPDATE 3-SolarWinds, Microsoft, FireEye, CrowdStrike defend actions in major hack -U.S. Senate hearing",0.0,1.0,0.0,0.0
24,FEYE,2021-02-23,10:40AM,"SolarWinds, Microsoft, FireEye, CrowdStrike defend actions in major hack - U.S. Senate hearing",0.0,1.0,0.0,0.0
25,FEYE,2021-02-23,10:35AM,"SolarWinds, Microsoft, FireEye, CrowdStrike executives face Senate grilling",0.0,1.0,0.0,0.0
26,FEYE,2021-02-23,07:00AM,FireEye to Host Threat Briefing and Mandiant Advantage Threat Intelligence Demonstration for Investors and Financial Analysts,0.28,0.453,0.267,-0.3182
27,FEYE,2021-02-23,06:00AM,SolarWinds Hack Grabs Senate Spotlight With CEO in the Hot Seat,0.0,1.0,0.0,0.0
28,FEYE,2021-02-16,09:00AM,Automating Threat Detection Desired for Security Analysts Battling Fear of Missing Incidents and Security Operations Center Inefficiency,0.392,0.36,0.248,-0.6124
29,FEYE,2021-02-11,08:00AM,FireEye Leaders Chris Carter and Kristi Houssiere Recognized as 2021 CRN Channel Chiefs,0.0,1.0,0.0,0.0
30,FEYE,2021-02-10,02:47PM,Tenable CEO on reducing cybersecurity risks amid work from home surge,0.174,0.826,0.0,-0.2732
31,FEYE,2021-02-09,07:00AM,FireEye Announces Participation in Upcoming Investor Conferences,0.0,1.0,0.0,0.0
32,FEYE,2021-02-08,09:02AM,"Zoom Video, FireEye, Ford, Magna and NIO highlighted as Zacks Bull and Bear of the Day",0.0,1.0,0.0,0.0
33,FEYE,2021-02-08,07:09AM,Bear Of The Day: FireEye (FEYE),0.0,1.0,0.0,0.0
34,FEYE,2021-02-04,04:43PM,Top 25 Fastest Growing Large Cities in the US,0.0,0.667,0.333,0.3612
35,FEYE,2021-02-04,04:39PM,BofA Upgrades FireEye On Execution Of Transformation Plan,0.0,1.0,0.0,0.0
36,FEYE,2021-02-04,11:32AM,FireEye (FEYE) Rebounds After Analyst Upgrade,0.0,1.0,0.0,0.0
37,FEYE,2021-02-04,08:00AM,FireEye Announces Bryan Palma Joins Company as EVP of FireEye Products,0.0,1.0,0.0,0.0
38,FEYE,2021-02-03,02:18PM,FireEye stock falls as analysts debate effects of massive SolarWinds hack,0.0,1.0,0.0,0.0
39,FEYE,2021-02-03,09:04AM,"FireEye (FEYE) Q4 Earnings & Revenues Top Estimates, Up Y/Y",0.0,0.816,0.184,0.2023
40,FEYE,2021-02-03,08:00AM,"FireEye Recognizes Carahsoft, NTT Communications, Sopra Steria, NTT Australia and rSolutions as Partners of the Year",0.0,1.0,0.0,0.0
41,FEYE,2021-02-03,01:01AM,FireEye (FEYE) Q4 2020 Earnings Call Transcript,0.0,1.0,0.0,0.0
42,FEYE,2021-02-02,05:55PM,FireEye (FEYE) Q4 Earnings and Revenues Beat Estimates,0.0,1.0,0.0,0.0
43,FEYE,2021-02-02,04:37PM,"FireEye reports record earnings, sees potential for first $1 billion sales year as massive hack puts spotlight on security",0.0,0.882,0.118,0.34
44,FEYE,2021-02-02,04:26PM,Recap: FireEye Q4 Earnings,0.0,1.0,0.0,0.0
45,FEYE,2021-02-02,04:01PM,FireEye Reports Financial Results for Fourth Quarter and Full Year 2020,0.0,1.0,0.0,0.0
46,FEYE,2021-02-02,02:45PM,"FireEye, Inc. to Host Earnings Call",0.0,1.0,0.0,0.0
47,FEYE,2021-02-01,10:09AM,FireEye's Earnings Outlook,0.0,1.0,0.0,0.0
48,FEYE,2021-02-01,08:09AM,What's in the Offing for FireEye's (FEYE) Q4 Earnings?,0.0,1.0,0.0,0.0
49,FEYE,2021-01-29,06:00AM,Suspected Russian Hackers Gained Edge Through Tech Firm Attacks,0.358,0.448,0.194,-0.296
50,FEYE,2021-01-27,02:25PM,Microsoft CEO Satya Nadella: There is a big crisis right now for cybersecurity,0.272,0.728,0.0,-0.6249
51,FEYE,2021-01-26,05:50PM,FireEye (FEYE) Dips More Than Broader Markets: What You Should Know,0.0,1.0,0.0,0.0
52,FEYE,2021-01-22,10:37AM,Unusual Options Activity Insight: FireEye,0.0,1.0,0.0,0.0
53,FEYE,2021-01-21,02:36PM,"Scott+Scott Attorneys at Law LLP Investigates FireEye, Inc.s Directors and Officers for Breach of Fiduciary Duties  FEYE",0.0,1.0,0.0,0.0
54,FEYE,2021-01-19,08:10PM,Suspected Russian Hackers Targeted Cyber Firm Malwarebytes,0.241,0.759,0.0,-0.2263
55,FEYE,2021-01-14,07:39AM,"Zacks Market Edge Highlights: CrowdStrike Holdings, Zscaler, FireEye, Qualys and McAfee",0.0,1.0,0.0,0.0
56,FEYE,2021-01-12,08:00AM,"NEW PONEMON RESEARCH: Growing Security Operation Center Challenges, Increasing Complexity and Rising Costs Drive Investments in XDR and Security Automation",0.0,0.672,0.328,0.7003
57,FEYE,2021-01-06,10:32AM,"Scott+Scott Attorneys at Law LLP Investigates FireEye, Inc.s Directors and Officers for Breach of Fiduciary Duties  FEYE",0.0,1.0,0.0,0.0
58,FEYE,2021-01-06,07:00AM,"FireEye to Announce Fourth Quarter and Fiscal Year 2020 Financial Results on February 2, 2021",0.0,1.0,0.0,0.0
59,FEYE,2021-01-05,03:55PM,"FBI, NSA say ongoing hacks at US federal agencies 'likely Russian in origin'",0.0,1.0,0.0,0.0
60,FEYE,2021-01-03,10:31AM,"Why CrowdStrike, FireEye, and Zscaler Surged as Much as 48.7% in December",0.0,1.0,0.0,0.0
61,FEYE,2020-12-31,07:47AM,3 Cybersecurity Stocks That May Give Double-Digit Returns in 2021,0.0,1.0,0.0,0.0
62,FEYE,2020-12-30,12:10AM,"SHAREHOLDER ALERT: Pomerantz Law Firm Investigates Claims On Behalf of Investors of FireEye, Inc. - FEYE",0.0,0.827,0.173,0.4466
63,FEYE,2020-12-28,02:04AM,Can You Imagine How FireEye's (NASDAQ:FEYE) Shareholders Feel About The 58% Share Price Increase?,0.0,0.727,0.273,0.5423
64,FEYE,2020-12-26,03:17PM,"SHAREHOLDER ALERT: Pomerantz Law Firm Investigates Claims On Behalf of Investors of FireEye, Inc. - FEYE",0.0,0.827,0.173,0.4466
65,FEYE,2020-12-24,06:35PM,Wall Street Seeks the Upside in an Historic Hack,0.0,1.0,0.0,0.0
66,FEYE,2020-12-24,04:00PM,Evolent Health and FireEye See Activist Action,0.0,1.0,0.0,0.0
67,FEYE,2020-12-24,11:59AM,SolarWinds Updates Advice on Malware as Profit-Taking Hits FireEye,0.0,1.0,0.0,0.0
68,FEYE,2020-12-24,11:41AM,"FuboTV, Vista Outdoor: Latest Upgrades and Downgrades",0.0,1.0,0.0,0.0
69,FEYE,2020-12-24,10:24AM,CyberArk (CYBR) Offers Free Breach Assessment for SolarWinds Customers,0.0,0.708,0.292,0.5106
70,FEYE,2020-12-24,08:39AM,FireEye (FEYE) in Focus: Stock Moves 7.3% Higher,0.0,1.0,0.0,0.0
71,FEYE,2020-12-24,07:47AM,Zscaler (ZS) Unveils Security Program to Assess Cyberattacks,0.0,0.745,0.255,0.34
72,FEYE,2020-12-23,09:35PM,"SHAREHOLDER ALERT: Pomerantz Law Firm Investigates Claims  On Behalf of Investors of FireEye, Inc. - FEYE",0.0,0.827,0.173,0.4466
73,FEYE,2020-12-23,02:35PM,Russia's Unprecedented Attack Boosts Cybersecurity Stocks,0.33,0.426,0.245,-0.2023
74,FEYE,2020-12-23,10:49AM,Unusual Options Activity Insight: FireEye,0.0,1.0,0.0,0.0
75,FEYE,2020-12-22,11:39AM,"Scott+Scott Attorneys at Law LLP Investigates FireEye, Inc.s Directors and Officers for Breach of Fiduciary Duties  FEYE",0.0,1.0,0.0,0.0
76,FEYE,2020-12-21,04:29PM,Wall Street Scrambles to Find Security Plays Amid Unfolding SolarWinds Hack,0.0,0.672,0.328,0.5267
77,FEYE,2020-12-21,04:06PM,"After the FireEye and SolarWinds breaches, whats your failsafe?",0.0,1.0,0.0,0.0
78,FEYE,2020-12-21,01:47PM,PreMarket Prep Stock Of The Day: FireEye,0.0,1.0,0.0,0.0
79,FEYE,2020-12-21,11:43AM,FireEye Continues Climb Despite Downgrade to Hold at Truist,0.0,1.0,0.0,0.0
80,FEYE,2020-12-21,08:44AM,3 Stocks to Watch as Cybersecurity Companies Rally on SolarWinds Hack,0.0,1.0,0.0,0.0
81,FEYE,2020-12-21,06:02AM,SolarWinds: How Russian hackers dealt the US its worst cyberspace defeat in a decade,0.392,0.608,0.0,-0.7964
82,FEYE,2020-12-20,11:22AM,"FireEye says about 50 companies, organizations 'genuinely impacted' by hack",0.0,1.0,0.0,0.0
83,FEYE,2020-12-19,06:12PM,INSIGHT-'Powerful tradecraft': how foreign cyber-spies compromised America,0.0,1.0,0.0,0.0
84,FEYE,2020-12-19,04:37PM,INSIGHT-'Powerful tradecraft': how foreign cyber-spies compromised America,0.0,1.0,0.0,0.0
85,FEYE,2020-12-19,03:59PM,"SHAREHOLDER ALERT: Pomerantz Law Firm Investigates Claims On Behalf of Investors of FireEye, Inc. - FEYE",0.0,0.827,0.173,0.4466
86,FEYE,2020-12-19,03:20PM,At Least 200 Victims Identified in Suspected Russian Hacking,0.375,0.625,0.0,-0.4939
87,FEYE,2020-12-19,02:46PM,Why Russia's massive cyberattack is especially insidious,0.0,1.0,0.0,0.0
88,FEYE,2020-12-18,06:48PM,Cisco Latest Victim of Russian Cyber-Attack Using SolarWinds,0.231,0.769,0.0,-0.2732
89,FEYE,2020-12-18,06:07PM,"FireEye, Crowdstrike enjoy record days as SolarWinds hack leads to soaring security stocks",0.0,0.663,0.337,0.6808
90,FEYE,2020-12-18,04:49PM,Why Cybersecurity Stocks Soared and SolarWinds Shares Crashed on Friday,0.0,0.804,0.196,0.296
91,FEYE,2020-12-18,04:17PM,"5 Top Stock Gainers for Friday: BioTelemetry, FireEye",0.0,0.769,0.231,0.2023
92,FEYE,2020-12-18,04:02PM,"FireEye, CrowdStrike, and Other Security Stocks Rally on SolarWinds Hack",0.0,0.789,0.211,0.34
93,FEYE,2020-12-18,01:36PM,Hackers Monthslong Head Start Hamstrings Probe of U.S. Breach,0.0,1.0,0.0,0.0
94,FEYE,2020-12-18,01:27PM,Why CrowdStrike Stock Rallied to All-Time Highs Today,0.0,1.0,0.0,0.0
95,FEYE,2020-12-18,10:36AM,New Revelations Suggest Russian Hack Of US Agencies 'Very Possibly The Worst Ever',0.267,0.733,0.0,-0.6557
96,FEYE,2020-12-18,10:15AM,Russia-Linked SolarWinds Hack Snags Widening List of Victims,0.247,0.753,0.0,-0.3182
97,FEYE,2020-12-16,11:58PM,"SHAREHOLDER ALERT: Pomerantz Law Firm Investigates Claims On Behalf of Investors of FireEye, Inc. - FEYE",0.0,0.827,0.173,0.4466
98,FEYE,2020-12-16,09:02PM,"Investor Alert: Kaplan Fox Investigates Potential Securities Fraud At FireEye, Inc.",0.235,0.494,0.272,-0.1027
99,FEYE,2020-12-16,09:07AM,Palo Alto Networks (PANW) Completes Expanse Buyout Deal,0.0,1.0,0.0,0.0
