,ticker,date,time,headline,neg,neu,pos,compound
0,GT,2021-04-12,05:13PM,"Goodyear Holds Virtual Annual Meeting, Elects Directors",0.0,1.0,0.0,0.0
1,GT,2021-04-01,03:07PM,Goodyear Europe B.V. -- Moody's assigns B2 rating to Goodyear's new senior unsecured guaranteed notes,0.157,0.843,0.0,-0.3818
2,GT,2021-04-01,07:45AM,Goodyear Announces Pricing Of $1 Billion Of Senior Notes,0.0,1.0,0.0,0.0
3,GT,2021-03-31,11:26AM,Goodyear Tire & Rubber Company (The) -- Moody's assigns B2 rating to Goodyear's new senior unsecured guaranteed notes,0.14,0.86,0.0,-0.3818
4,GT,2021-03-31,08:11AM,"UPDATE: Goodyear announces offering of $1 billion of high-yield bonds, amends credit agreement",0.0,0.655,0.345,0.7003
5,GT,2021-03-31,07:49AM,Goodyear Announces Offering Of Senior Notes,0.0,1.0,0.0,0.0
6,GT,2021-03-29,06:58PM,"COOPER TIRE INVESTOR ALERT BY THE FORMER ATTORNEY GENERAL OF LOUISIANA: Kahn Swick & Foti, LLC Investigates Adequacy of Price and Process in Proposed Sale of Cooper Tire & Rubber Company - CTB",0.0,0.908,0.092,0.4466
7,GT,2021-03-29,09:02AM,Goodyear Tire & Rubber's Debt Overview,0.385,0.615,0.0,-0.3612
8,GT,2021-03-25,07:21PM,"Cooper Tire & Rubber Company -- Moody's confirms Cooper Tire's Ba3 CFR, senior unsecured notes remain under review for downgrade",0.126,0.874,0.0,-0.3818
9,GT,2021-03-25,10:00AM,Goodyear Introduces The All-New EV-4M Port Handler Tire,0.0,1.0,0.0,0.0
10,GT,2021-03-24,07:22PM,"Goodyear Tire & Rubber Company (The) -- Moody's confirms Goodyear's ratings with senior unsecured guaranteed at B2, senior secured at Ba2 and CFR at B1; outlook to stable",0.083,0.762,0.156,0.3182
11,GT,2021-03-23,02:00PM,Students Deliver Mobility Solutions For The Fifth Annual Goodyear Innovation Challenge,0.0,0.588,0.412,0.5574
12,GT,2021-03-23,09:00AM,Goodyear Teams Up With Electric Mobility Pioneer UFODRIVE,0.0,1.0,0.0,0.0
13,GT,2021-03-22,09:00AM,Nearly 4 Million Tires Inspected In One Year Through Goodyear's Complete Tire Management Program,0.0,1.0,0.0,0.0
14,GT,2021-03-21,05:51AM,4 Value Stocks That Can Double in a Biden Bull Market,0.0,0.769,0.231,0.34
15,GT,2021-03-18,02:00PM,Goodyear Strengthens Commitment to Sustainable Procurement of Soybeans,0.0,0.517,0.483,0.6808
16,GT,2021-03-18,09:00AM,Goodyear And Voyomotive Collaborate On Tire Intelligence For Vehicle Efficiency,0.0,0.588,0.412,0.6808
17,GT,2021-03-17,08:42PM,"Goodyear (City of) AZ -- Moody's assigns Aa1 to the City of Goodyear, AZ's Series 2021 GOULT bonds and Aa2 to Series 2021 excise tax bonds; outlook stable",0.0,0.925,0.075,0.296
18,GT,2021-03-16,01:00PM,Goodyear And TNO To Demonstrate An Intelligent Brake System,0.0,0.727,0.273,0.4588
19,GT,2021-03-07,07:41AM,"Lifshitz Law Firm, P.C. Announces Investigation of MGLN, PRAH, PBCT and GT",0.0,0.795,0.205,0.4278
20,GT,2021-03-04,09:18AM,Gender pay gap creates second class citizenship for women': Lilly Ledbetter,0.112,0.72,0.168,0.1779
21,GT,2021-03-04,08:00AM,Goodyear Announces Leadership Changes,0.0,1.0,0.0,0.0
22,GT,2021-03-03,09:00AM,"Goodyear, EASE Logistics And The City Of Dublin, Ohio To Collaborate On Connected Mobility Pilot",0.0,0.812,0.188,0.4995
23,GT,2021-03-02,09:32AM,"Auto Stock Roundup: GT Announces CTB Buyout, OSK Wins USPS Contract and More",0.0,0.627,0.373,0.7603
24,GT,2021-03-01,11:02PM,"Lifshitz Law Firm, P.C. Announces Investigation of APEX, CTB, GT, FRTA, PAND, PRAH, ICLR, PBCT and MBT",0.0,0.85,0.15,0.4278
25,GT,2021-02-25,12:00PM,"Goodyear Names Chris Helsel SVP, Global Operations And Chief Technology Officer",0.0,1.0,0.0,0.0
26,GT,2021-02-24,10:45PM,"COOPER TIRE INVESTOR ALERT BY THE FORMER ATTORNEY GENERAL OF LOUISIANA: Kahn Swick & Foti, LLC Investigates Adequacy of Price and Process in Proposed Sale of Cooper Tire & Rubber Company - CTB",0.0,0.908,0.092,0.4466
27,GT,2021-02-23,03:48PM,Cooper Tire & Rubber Company -- Moody's places both Goodyear Tire and Cooper Tire ratings on review for downgrade following acquisition announcement,0.0,1.0,0.0,0.0
28,GT,2021-02-22,08:06PM,"SHAREHOLDER NOTICE: Brodsky & Smith, LLC Announces an Investigation of Cooper Tire & Rubber Company (NYSE:CTB)",0.0,1.0,0.0,0.0
29,GT,2021-02-22,06:00PM,"SHAREHOLDER ALERT: Rigrodsky Law, P.A. Announces Investigation of Cooper Tire & Rubber Company Buyout",0.0,0.804,0.196,0.4466
30,GT,2021-02-22,04:45PM,Goodyear Acquires Tiremaker Rival Cooper For $2.5B,0.0,1.0,0.0,0.0
31,GT,2021-02-22,04:30PM,Goodyear Agrees to Buy Cooper Tire for About $2.8 Billion,0.0,0.833,0.167,0.2023
32,GT,2021-02-22,04:27PM,Goodyear Stock Soars on Plan to Buy Cooper Tire. Will a Merger Fix It?,0.0,1.0,0.0,0.0
33,GT,2021-02-22,03:49PM,"COOPER ALERT: Bragar Eagel & Squire, P.C. Investigates Sale of CTB and Encourages Investors to Contact the Firm",0.0,0.72,0.28,0.7034
34,GT,2021-02-22,02:07PM,Why Goodyear Stock Is Sharply Higher Today,0.0,1.0,0.0,0.0
35,GT,2021-02-22,11:45AM,Why Shares Of Goodyear Tire & Rubber Are Up By More Than 15% Today?,0.0,0.845,0.155,0.296
36,GT,2021-02-22,11:27AM,Why Cooper Tire & Rubber Stock Soared Today,0.0,1.0,0.0,0.0
37,GT,2021-02-22,10:55AM,Goodyear to Buy Rival Cooper for $2.8 Billion,0.0,1.0,0.0,0.0
38,GT,2021-02-22,09:41AM,"Goodyear to buy Cooper Tire for $2.8 billion, nearly doubling China presence",0.0,1.0,0.0,0.0
39,GT,2021-02-22,08:56AM,(CTP): Johnson Fistel Investigates the Proposed Sale of Cooper Tire; Are Shareholders Getting a Fair Deal?,0.0,0.859,0.141,0.3182
40,GT,2021-02-22,07:31AM,"UPDATE 3-Goodyear to buy Cooper Tire for $2.8 bln, nearly doubling China presence",0.0,1.0,0.0,0.0
41,GT,2021-02-22,07:20AM,"Goodyear to buy Cooper Tire for $2.8 billion, nearly doubling China presence",0.0,1.0,0.0,0.0
42,GT,2021-02-22,07:13AM,Goodyear Tire to acquire Cooper Tire in deal with enterprise value of about $2.5 billion,0.0,0.854,0.146,0.34
43,GT,2021-02-22,07:00AM,"Goodyear to Acquire Cooper, Creating Stronger U.S.-Based Leader in Global Tire Industry",0.0,0.676,0.324,0.5859
44,GT,2021-02-19,04:45PM,Goodyear To Present During Wolfe Research Virtual Investor Conference,0.0,1.0,0.0,0.0
45,GT,2021-02-11,08:47AM,"Goodyear (GT) Q4 Earnings & Sales Top Estimates, Profit Up Y/Y",0.0,0.63,0.37,0.5719
46,GT,2021-02-10,08:25AM,What Does Goodyear Tire & Rubber's Debt Look Like?,0.227,0.545,0.227,0.0
47,GT,2021-02-09,02:00PM,Goodyear Tire & Rubber Co (GT) Q4 2020 Earnings Call Transcript,0.0,1.0,0.0,0.0
48,GT,2021-02-09,08:04AM,Goodyear Tire & Rubber: Q4 Earnings Insights,0.0,1.0,0.0,0.0
49,GT,2021-02-09,07:54AM,Goodyear shares jump 5% premarket after tire maker swings to profit and tops sales estimates,0.0,0.588,0.412,0.8126
50,GT,2021-02-09,07:45AM,"Goodyear Reports Fourth Quarter, Full-Year 2020 Results",0.0,1.0,0.0,0.0
51,GT,2021-02-09,06:45AM,Goodyear Tire & Rubber Co. to Host Earnings Call,0.0,1.0,0.0,0.0
52,GT,2021-02-08,10:15AM,Earnings Preview: Goodyear Tire & Rubber,0.0,1.0,0.0,0.0
53,GT,2021-02-05,04:25AM,The Goodyear Tire & Rubber Company's (NASDAQ:GT) Intrinsic Value Is Potentially 81% Above Its Share Price,0.0,0.739,0.261,0.5574
54,GT,2021-02-04,09:00AM,Goodyear Ventures Invests In Autonomous Trucking Company TuSimple,0.0,1.0,0.0,0.0
55,GT,2021-02-02,05:00PM,Goodyear To Announce Fourth Quarter And Full-Year 2020 Financial Results,0.0,1.0,0.0,0.0
56,GT,2021-01-27,01:00PM,Goodyear And ConMet To Offer Fleets The Commercial Tire Industry's First Combined Tire And Wheel Hub Analytics Solution,0.0,0.881,0.119,0.3182
57,GT,2021-01-27,09:00AM,Goodyear Ventures Invests in Autonomous Delivery Services Provider Starship Technologies,0.0,1.0,0.0,0.0
58,GT,2021-01-26,10:00AM,Goodyear Advances Tire Development With Second Dynamic Simulator,0.0,0.729,0.271,0.3818
59,GT,2021-01-12,11:10AM,4 Sector ETFs & Stocks to Bet on Q4 Earnings,0.0,1.0,0.0,0.0
60,GT,2020-12-29,09:00AM,Goodyear Continues To Support Local Children's Hospitals At 85th Goodyear Cotton Bowl Classic,0.0,0.816,0.184,0.4019
61,GT,2020-12-10,02:00PM,Goodyear And SafeAI Announce Tire Intelligence For Autonomous Heavy Equipment,0.0,0.744,0.256,0.4767
62,GT,2020-12-08,09:00AM,Goodyear Innovation Challenge Inspires Students To Build Future Mobility,0.0,0.469,0.531,0.7003
63,GT,2020-12-07,02:00PM,Goodyear's New Wrangler Workhorse Powerline Delivers Hardworking Dependability On And Off Road,0.0,1.0,0.0,0.0
64,GT,2020-12-07,02:00PM,"Goodyear Unveils Its Best Long-Haul Drive Tire for Fuel Efficiency, the Fuel Max LHD 2",0.0,0.642,0.358,0.7717
65,GT,2020-12-07,02:00PM,"Goodyear Responds To Regional-Haul Trucking Segment Growth With New Fuel Max RSD, Its Best Premium Super-Regional Drive Tire",0.0,0.702,0.298,0.7783
66,GT,2020-12-07,02:00PM,"Goodyear Launches Fleet Central, An Interactive Portal That Revolutionizes The Way Fleets Manage Their Tires",0.0,1.0,0.0,0.0
67,GT,2020-12-07,01:28AM,Goodyear Tire & Rubber's (NASDAQ:GT) Stock Price Has Reduced 66% In The Past Five Years,0.0,1.0,0.0,0.0
68,GT,2020-11-29,11:30AM,Goodyear (GT) Up 10.3% Since Last Earnings Report: Can It Continue?,0.0,1.0,0.0,0.0
69,GT,2020-11-24,10:01AM,"Goodyear, U.S. Marine Corps Reserve To Host 10th Annual Toys For Tots Events",0.0,1.0,0.0,0.0
70,GT,2020-11-23,09:00AM,Goodyear Expands Mobile Tire Installation Service To Make Tire Buying Easier In Greater Atlanta Area,0.0,0.642,0.358,0.6908
71,GT,2020-11-23,09:00AM,Goodyear Expands Mobile Tire Installation Service To Make Tire Buying Easier In Chicago Suburbs,0.0,0.741,0.259,0.4939
72,GT,2020-11-19,09:00AM,Ford Honors Goodyear At 22nd Annual World Excellence Awards,0.0,0.366,0.634,0.886
73,GT,2020-11-17,01:00PM,Goodyear And TuSimple Collaborate On Autonomous Vehicle Freight Operations,0.0,1.0,0.0,0.0
74,GT,2020-11-10,11:50AM,Are Investors Undervaluing Goodyear (GT) Right Now?,0.0,1.0,0.0,0.0
75,GT,2020-11-10,09:00AM,Goodyear Releases New WinterCommand Ultra Tire,0.0,1.0,0.0,0.0
76,GT,2020-11-03,07:38AM,"Goodyear (GT) Q3 Earnings Beat on EMEA Arm Strength, Down Y/Y",0.0,0.758,0.242,0.4939
77,GT,2020-11-02,02:00PM,Goodyear Launches New OTR Tire For Long Haul Fleets,0.0,1.0,0.0,0.0
78,GT,2020-10-30,05:01PM,Goodyear Tire & Rubber Co (GT) Q3 2020 Earnings Call Transcript,0.0,1.0,0.0,0.0
79,GT,2020-10-30,03:55PM,Why Goodyear Tire Dropped 13% After Topping Q3 Estimates,0.0,1.0,0.0,0.0
80,GT,2020-10-30,10:05AM,Goodyear (GT) Q3 Earnings and Revenues Top Estimates,0.0,0.795,0.205,0.2023
81,GT,2020-10-30,08:11AM,Recap: Goodyear Tire & Rubber Q3 Earnings,0.0,1.0,0.0,0.0
82,GT,2020-10-30,07:45AM,Goodyear Reports Third Quarter 2020 Results,0.0,1.0,0.0,0.0
83,GT,2020-10-30,07:30AM,Goodyear Tire & Rubber Co. to Host Earnings Call,0.0,1.0,0.0,0.0
84,GT,2020-10-29,10:08AM,Earnings Preview: Goodyear Tire & Rubber,0.0,1.0,0.0,0.0
85,GT,2020-10-28,09:30AM,Goodyear Adds Aviation Distributor KADEX Aero Supply,0.0,1.0,0.0,0.0
86,GT,2020-10-27,12:01PM,Why Goodyear Tire & Rubber Co (GT) Stock is a Compelling Investment Case,0.0,0.84,0.16,0.2263
87,GT,2020-10-23,06:51AM,3 Great Stocks Under $10,0.0,0.423,0.577,0.6249
88,GT,2020-10-20,05:45PM,Goodyear To Announce Third Quarter 2020 Financial Results,0.0,1.0,0.0,0.0
89,GT,2020-10-16,12:30PM,Analysts Estimate Goodyear (GT) to Report a Decline in Earnings: What to Look Out for,0.0,1.0,0.0,0.0
90,GT,2020-10-09,08:45AM,GT or CTB: Which Tire Stock is Better Placed at the Moment?,0.0,0.636,0.364,0.694
91,GT,2020-10-06,02:09AM,Hedge Funds Are Selling The Goodyear Tire & Rubber Company (GT),0.0,1.0,0.0,0.0
92,GT,2020-09-23,09:19AM,What Kind Of Shareholders Own The Goodyear Tire & Rubber Company (NASDAQ:GT)?,0.0,1.0,0.0,0.0
93,GT,2020-09-13,08:00PM,"Market Update: KR, NVDA, GT, AEE",0.0,0.638,0.362,0.4278
94,GT,2020-09-13,08:00PM,Analyst Report: Goodyear Tire & Rubber Co.,0.0,1.0,0.0,0.0
95,GT,2020-09-10,09:00AM,"Goodyear Increases Transparency, Progresses Toward Goals In Annual Corporate Responsibility Report",0.0,1.0,0.0,0.0
96,GT,2020-09-09,04:15PM,Goodyear To Present During Morgan Stanley Virtual Investor Conference,0.0,1.0,0.0,0.0
97,GT,2020-08-30,11:30AM,Why Is Goodyear (GT) Up 1.5% Since Last Earnings Report?,0.0,1.0,0.0,0.0
98,GT,2020-08-27,08:03AM,Goodyear Down 37% YTD: Can Growth Efforts Revive the Stock?,0.0,0.615,0.385,0.6124
99,GT,2020-08-20,10:58PM,"Facing Trump criticism, Goodyear says employees can wear clothes supporting police",0.196,0.608,0.196,0.0
