,ticker,date,time,headline,neg,neu,pos,compound
0,HBI,2021-04-13,10:01AM,HanesBrands Celebrates Earth Day with 12th Consecutive U.S. EPA Energy Star Award for Environmental Stewardship,0.0,0.563,0.437,0.8519
1,HBI,2021-04-13,08:00AM,Bell-Ringing Profit Is Coming From These 10 Companies,0.0,0.707,0.293,0.4404
2,HBI,2021-04-07,09:37AM,Champion® Athleticwear Launches Two New Collections in Support of the Brands Overall Sustainability Efforts,0.0,0.828,0.172,0.4019
3,HBI,2021-04-06,07:08AM,3 Top Dividend Stocks to Buy in April,0.0,0.769,0.231,0.2023
4,HBI,2021-03-30,04:19AM,Is There An Opportunity With Hanesbrands Inc.'s (NYSE:HBI) 30% Undervaluation?,0.0,0.763,0.237,0.4215
5,HBI,2021-03-26,11:40AM,"HBI Australia Acquisition Co. Pty Ltd -- Moody's announces completion of a periodic review of ratings of Hanesbrands, Inc.",0.0,1.0,0.0,0.0
6,HBI,2021-03-25,12:01AM,EXCLUSIVE: American Image Awards Reveal 2021 Honorees,0.0,0.319,0.681,0.8192
7,HBI,2021-03-24,09:00AM,Champion® Athleticwear Named the Official Sideline Apparel Partner of the Premier Lacrosse League,0.0,1.0,0.0,0.0
8,HBI,2021-03-23,05:55AM,"Got $1,400? 2 Value Stocks to Buy and Hold for the Long Term",0.0,0.821,0.179,0.34
9,HBI,2021-03-19,09:42AM,"Hanesbrands (HBI) Gains on Full Potential Plan, Online Strength",0.0,0.556,0.444,0.6808
10,HBI,2021-03-15,08:03AM,Hanes Helps Men Find Ball-ance with Launch of Comfort Flex Fit® Total Support Pouch Boxer Briefs,0.0,0.625,0.375,0.7783
11,HBI,2021-03-08,01:00PM,3 Top Value Stocks to Buy in March,0.0,0.543,0.457,0.4939
12,HBI,2021-03-05,08:01AM,"HanesBrands Names Tracy Preston General Counsel, Corporate Secretary and Chief Compliance Officer",0.0,1.0,0.0,0.0
13,HBI,2021-03-03,09:19AM,"HanesBrands Names Jane Newman Chief Design Officer, Global Innerwear",0.0,1.0,0.0,0.0
14,HBI,2021-03-02,06:45AM,2 Value Stocks That Could Easily Double,0.0,0.455,0.545,0.5859
15,HBI,2021-02-24,08:00AM,Champion® Athleticwear Announces a Multi-Year Collaboration with the G.O.A.T.,0.0,1.0,0.0,0.0
16,HBI,2021-02-23,08:33AM,HanesBrands Named One of the 2021 Worlds Most Ethical Companies,0.0,0.715,0.285,0.5563
17,HBI,2021-02-16,04:53AM,"Top S&P 500 Stocks This Past Week: Twitter, AES, Zebra Tech",0.0,0.847,0.153,0.2023
18,HBI,2021-02-14,07:10AM,2 Top Value Stocks to Buy Now,0.0,0.488,0.512,0.4939
19,HBI,2021-02-13,01:46AM,Dividend Investors: Don't Be Too Quick To Buy Hanesbrands Inc. (NYSE:HBI) For Its Upcoming Dividend,0.0,1.0,0.0,0.0
20,HBI,2021-02-10,08:26AM,How Does Hanesbrands Debt Look?,0.385,0.615,0.0,-0.3612
21,HBI,2021-02-10,08:23AM,HanesBrands Named Primary Licensee for Ohio State University Fan Apparel,0.0,0.796,0.204,0.3182
22,HBI,2021-02-10,07:08AM,Hanesbrands: Is its Full Potential Already Factored Into the Share Price?,0.0,0.82,0.18,0.296
23,HBI,2021-02-09,04:17PM,"Stocks Close Narrowly Mixed, As Leading Stocks Shine",0.0,1.0,0.0,0.0
24,HBI,2021-02-09,04:00PM,Hanesbrands Inc (HBI) Q4 2020 Earnings Call Transcript,0.0,1.0,0.0,0.0
25,HBI,2021-02-09,03:59PM,"Hanesbrands stock soars after plans to exit PPE & European business, focus on Champion brand",0.0,0.769,0.231,0.5994
26,HBI,2021-02-09,12:14PM,Why Hanesbrands Stock Is Soaring 22% Today,0.0,1.0,0.0,0.0
27,HBI,2021-02-09,12:00PM,"Hanesbrands to Focus on Champion, Young Consumers, and E-commerce",0.0,0.672,0.328,0.5994
28,HBI,2021-02-09,11:35AM,Upbeat Quarter Sends Hanesbrands Stock 22% Higher Despite Covid-Related Writeoff,0.0,1.0,0.0,0.0
29,HBI,2021-02-09,10:18AM,"Hanesbrands' (HBI) Q4 Earnings Beat Estimates, Sales Grow Y/Y",0.0,1.0,0.0,0.0
30,HBI,2021-02-09,09:59AM,"Dow Jones Today Threatens To Snap 6-Day Rally; Microsoft, Disney in Buy Ranges; Chegg Poised For Breakout",0.133,0.765,0.102,-0.1531
31,HBI,2021-02-09,08:36AM,HanesBrands Stock Rises Thanks to Earnings Beat,0.0,0.674,0.326,0.4404
32,HBI,2021-02-09,07:51AM,"5 Top Stock Gainers for Tuesday: Glu Mobile, Tilray",0.0,0.795,0.205,0.2023
33,HBI,2021-02-09,07:45AM,HanesBrands (HBI) Tops Q4 Earnings and Revenue Estimates,0.0,0.68,0.32,0.5106
34,HBI,2021-02-09,07:08AM,Recap: Hanesbrands Q4 Earnings,0.0,1.0,0.0,0.0
35,HBI,2021-02-09,06:46AM,Hanesbrands Jumps After Adjusted Earnings Top Expectations,0.0,0.769,0.231,0.2023
36,HBI,2021-02-09,06:30AM,HanesBrands Reports Solid Fourth-Quarter Results,0.0,0.714,0.286,0.1531
37,HBI,2021-02-08,10:26AM,Earnings Outlook for Hanesbrands,0.0,1.0,0.0,0.0
38,HBI,2021-02-04,05:00PM,4 Margin-Growing Stocks With High Insider Cluster Buys,0.0,1.0,0.0,0.0
39,HBI,2021-02-03,08:34AM,Hanesbrands (HBI) Queued for Q4 Earnings: Key Things to Note,0.0,1.0,0.0,0.0
40,HBI,2021-02-02,12:31PM,Earnings Preview: HanesBrands (HBI) Q4 Earnings Expected to Decline,0.0,1.0,0.0,0.0
41,HBI,2021-01-25,04:05PM,HanesBrands Sets Date for Fourth-Quarter 2020 Earnings Announcement and Investor Conference Call,0.0,1.0,0.0,0.0
42,HBI,2021-01-21,08:03AM,"HanesBrands Names Joe Cavaliere Group President, Global Innerwear",0.0,1.0,0.0,0.0
43,HBI,2021-01-14,08:52AM,"BJ's Wholesale Club, Hanesbrands, Boeing, Airbus and Leidos highlighted as Zacks Bull and Bear of the Day",0.0,1.0,0.0,0.0
44,HBI,2021-01-14,06:08AM,Bear of the Day: Hanesbrands (HBI),0.0,1.0,0.0,0.0
45,HBI,2021-01-13,01:36AM,Should You Be Impressed By Hanesbrands Inc.'s (NYSE:HBI) ROE?,0.0,0.721,0.279,0.4767
46,HBI,2021-01-08,06:45AM,5 Top Value Stocks to Buy Now,0.0,0.488,0.512,0.4939
47,HBI,2021-01-07,08:53AM,5 Textile - Apparel Stocks to Boost Your Portfolio Amid Industry Woes,0.213,0.588,0.199,-0.0516
48,HBI,2021-01-05,10:35AM,New Strong Sell Stocks for January 5th,0.0,0.645,0.355,0.5106
49,HBI,2021-01-05,07:01AM,HanesBrands Wins Infringement Case Against Six Defendants in China,0.225,0.507,0.268,0.1531
50,HBI,2020-12-31,08:00AM,These 2 Under-the-Radar Stocks Are Great Buys Right Now,0.0,0.631,0.369,0.6249
51,HBI,2020-12-30,09:00AM,3 Stocks for a Better Retirement,0.0,0.508,0.492,0.4404
52,HBI,2020-12-22,04:55PM,Is HBI A Good Stock To Buy According To Hedge Funds?,0.0,0.756,0.244,0.4404
53,HBI,2020-12-21,05:50PM,HanesBrands (HBI) Stock Moves -0.07%: What You Should Know,0.0,1.0,0.0,0.0
54,HBI,2020-12-18,09:00AM,HanesBrands Names Tanya Deans President of Hanes Australasia,0.0,1.0,0.0,0.0
55,HBI,2020-12-17,11:37AM,Insider Sells Hanesbrands Shares,0.0,0.577,0.423,0.296
56,HBI,2020-12-16,08:32AM,"Guess? (GES) Looks Solid on Online Business, Strategic Efforts",0.0,0.833,0.167,0.1531
57,HBI,2020-12-15,08:24AM,"Hanesbrands (HBI) Hurt by Weak Activewear Unit, Drab Margins",0.474,0.526,0.0,-0.743
58,HBI,2020-12-14,05:50PM,HanesBrands (HBI) Dips More Than Broader Markets: What You Should Know,0.0,1.0,0.0,0.0
59,HBI,2020-12-14,01:18AM,Is Now An Opportune Moment To Examine Hanesbrands Inc. (NYSE:HBI)?,0.0,0.769,0.231,0.4019
60,HBI,2020-12-09,04:02PM,HanesBrands Appoints Cheryl K. Beebe to Board of Directors,0.0,1.0,0.0,0.0
61,HBI,2020-12-09,08:19AM,3 Top Stocks to Buy in December,0.0,0.735,0.265,0.2023
62,HBI,2020-12-08,08:54AM,HanesBrands Recognized for Sustainability Leadership with First A List Score in CDP 2020 Climate Change Report,0.0,1.0,0.0,0.0
63,HBI,2020-12-05,11:32AM,HanesBrands (HBI) Up 5.7% Since Last Earnings Report: Can It Continue?,0.0,1.0,0.0,0.0
64,HBI,2020-12-02,10:50AM,Is Hanesbrands Stock a Buy?,0.0,1.0,0.0,0.0
65,HBI,2020-11-30,11:50AM,Insider Sells Hanesbrands Stock,0.0,1.0,0.0,0.0
66,HBI,2020-11-24,09:32AM,Hanes Donates Nearly 1.3 Million Face Masks and Pairs of Socks in 2020 to Support the Homeless During the COVID-19 Pandemic,0.0,0.881,0.119,0.4019
67,HBI,2020-11-20,08:15AM,"Drone Racing League Partners with BODYARMOR, Champion Athleticwear and RESPAWN as 2020 LIVE Racing Season Begins",0.0,0.794,0.206,0.5994
68,HBI,2020-11-19,10:15AM,3 Top Stocks Under $20,0.0,0.625,0.375,0.2023
69,HBI,2020-11-19,08:45AM,Hanes Hosiery Donates More Than a Quarter of a Million Face Masks to Support Arkansas Emergency Management,0.142,0.71,0.148,0.0258
70,HBI,2020-11-18,09:15AM,Market Takes a Well-Deserved Rest,0.0,1.0,0.0,0.0
71,HBI,2020-11-18,09:00AM,Champion® Athleticwear and Super Mario Bros. Level Up with Limited-Edition Anniversary Collection,0.0,0.738,0.262,0.5994
72,HBI,2020-11-16,02:06PM,3 Strong Buy Stocks Insiders Are Snapping Up,0.0,0.645,0.355,0.5106
73,HBI,2020-11-14,07:30AM,3 Potentially Explosive Stocks for a Vaccine-Driven Bull Market,0.0,1.0,0.0,0.0
74,HBI,2020-11-13,06:43AM,Independent Chairman Ronald Nelson Just Bought 32% More Shares In Hanesbrands Inc. (NYSE:HBI),0.0,0.828,0.172,0.3597
75,HBI,2020-11-12,02:06PM,Hanes Is Happy to Be the Official Smile of the 94th Annual Macys Thanksgiving Day Parade®,0.0,0.693,0.307,0.7351
76,HBI,2020-11-12,08:00AM,Greg Hall Joins HanesBrands as Chief Consumer Officer,0.0,1.0,0.0,0.0
77,HBI,2020-11-10,08:42AM,"Cramer Weighs In On Cloudflare, Palo Alto And More",0.0,1.0,0.0,0.0
78,HBI,2020-11-10,08:00AM,HanesBrands Announces Retirement of Joia M. Johnson,0.0,1.0,0.0,0.0
79,HBI,2020-11-06,11:50AM,Is HanesBrands (HBI) a Great Value Stock Right Now?,0.0,0.48,0.52,0.7579
80,HBI,2020-11-06,10:16AM,Ex-Dividend Date Insight: Hanesbrands,0.0,1.0,0.0,0.0
81,HBI,2020-11-06,04:21AM,Hanesbrands Sinks 19% On Weak 4Q Outlook,0.607,0.393,0.0,-0.8286
82,HBI,2020-11-05,09:31PM,Hanesbrands Inc (HBI) Q3 2020 Earnings Call Transcript,0.0,1.0,0.0,0.0
83,HBI,2020-11-05,03:25PM,Hanesbrands earnings beat expectations but weak guidance sinks stock,0.325,0.675,0.0,-0.5927
84,HBI,2020-11-05,02:49PM,Why Hanesbrands Stock Tumbled Today,0.0,1.0,0.0,0.0
85,HBI,2020-11-05,12:15PM,Masks Won't Save Hanesbrands' Holiday Quarter,0.55,0.45,0.0,-0.5975
86,HBI,2020-11-05,11:15AM,HanesBrands Drops After Earnings and Guidance,0.0,1.0,0.0,0.0
87,HBI,2020-11-05,11:14AM,HanesBrands Recovery Fails to Impress Wall Street,0.262,0.467,0.271,0.0258
88,HBI,2020-11-05,10:35AM,HanesBrands Proprietary Surgical Face Mask Receives Authorization by U.S. Food and Drug Administration,0.0,1.0,0.0,0.0
89,HBI,2020-11-05,09:39AM,Hanes Plummets as Champion Owner Announces a Business Review,0.0,0.642,0.358,0.5994
90,HBI,2020-11-05,09:36AM,Hanesbrands' (HBI) Q3 Earnings & Sales Surpass Estimates,0.0,1.0,0.0,0.0
91,HBI,2020-11-05,08:57AM,Hanesbrands: Q3 Earnings Insights,0.0,1.0,0.0,0.0
92,HBI,2020-11-05,08:25AM,HanesBrands (HBI) Q3 Earnings and Revenues Surpass Estimates,0.0,1.0,0.0,0.0
93,HBI,2020-11-05,06:30AM,HanesBrands Reports Third-Quarter 2020 Financial Results,0.0,1.0,0.0,0.0
94,HBI,2020-11-05,06:18AM,"Hanesbrands Drops on Expenses, No Sports, No College Sweatshirts",0.386,0.614,0.0,-0.5267
95,HBI,2020-11-04,10:30AM,"Insight Enterprises' (NSIT) Q3 Earnings Top Estimates, Up Y/Y",0.0,0.816,0.184,0.2023
96,HBI,2020-11-04,06:58AM,Here's What We Like About Hanesbrands' (NYSE:HBI) Upcoming Dividend,0.0,0.762,0.238,0.3612
97,HBI,2020-11-03,03:25PM,Tapestry Weaves Up A Rising Relative Strength Rating,0.0,0.652,0.348,0.4939
98,HBI,2020-11-03,10:33AM,Here's How Wolverine (WWW) is Poised Ahead of Q3 Earnings,0.0,0.818,0.182,0.25
99,HBI,2020-11-02,11:00AM,What's in the Offing for Hanesbrands' (HBI) Q3 Earnings?,0.0,1.0,0.0,0.0
