,ticker,date,time,headline,neg,neu,pos,compound
0,JNPR,2021-04-08,08:56AM,"Telecom Stock Roundup: VZ's Signal Repeaters Deployment, ERIC's Open Lab & More",0.0,1.0,0.0,0.0
1,JNPR,2021-04-07,08:36AM,Juniper (JNPR) to Power 21Vianet's (VNET) Data Center Expansion,0.0,1.0,0.0,0.0
2,JNPR,2021-04-06,11:00PM,Chinas Largest Carrier-Neutral Data Center Service Provider 21Vianet Selects Juniper Networks to Power Expanded Interconnected Data Center,0.0,1.0,0.0,0.0
3,JNPR,2021-03-31,07:06AM,"The Zacks Analyst Blog Highlights: Cisco Systems, Arista Networks, Juniper Networks and NETGEAR",0.0,1.0,0.0,0.0
4,JNPR,2021-03-30,09:04AM,4 Stocks Poised to Gain From Uptick in Campus Networking Spend,0.0,0.597,0.403,0.6597
5,JNPR,2021-03-23,09:09PM,"Ontario Teachers Acquires Mitratech From TA, HG Capital",0.0,1.0,0.0,0.0
6,JNPR,2021-03-23,04:08AM,"Juniper Networks, Inc. (NYSE:JNPR) Shares Could Be 38% Below Their Intrinsic Value Estimate",0.0,0.705,0.295,0.5574
7,JNPR,2021-03-22,05:30AM,Juniper Networks Announces Date of First Quarter Preliminary Financial Results Conference Call,0.0,1.0,0.0,0.0
8,JNPR,2021-03-15,08:30AM,"Juniper Networks Announces Dial-in Numbers and Webcast Information for March 16, 2021 Tech Talk",0.0,1.0,0.0,0.0
9,JNPR,2021-03-10,12:00PM,Juniper Networks Demonstrates Industry Leadership with Two MEF Proof of Concept Showcase Awards,0.0,0.8,0.2,0.4588
10,JNPR,2021-03-08,09:18AM,3 High-Yield Tech Stocks to Buy in March,0.0,1.0,0.0,0.0
11,JNPR,2021-03-03,08:30AM,Juniper Networks Announces Date and Webcast Information for Upcoming Tech Talk in March 2021,0.0,1.0,0.0,0.0
12,JNPR,2021-03-01,08:46AM,Better Buy: Arista Networks vs. Juniper Networks,0.0,0.674,0.326,0.4404
13,JNPR,2021-02-27,11:30AM,Juniper (JNPR) Down 10.8% Since Last Earnings Report: Can It Rebound?,0.0,1.0,0.0,0.0
14,JNPR,2021-02-26,09:15AM,Should Value Investors Pick Juniper Networks (JNPR) Stock?,0.0,0.745,0.255,0.34
15,JNPR,2021-02-25,10:15AM,Understanding Juniper Networks's Ex-Dividend Date,0.0,1.0,0.0,0.0
16,JNPR,2021-02-24,07:45AM,Juniper Networks Combines Mist AI with Session Smart SD-WAN and SRX Secure Branch Gateway for Optimal User Experiences from Client-to-Cloud,0.0,0.691,0.309,0.765
17,JNPR,2021-02-21,02:38AM,"Don't Buy Juniper Networks, Inc. (NYSE:JNPR) For Its Next Dividend Without Doing These Checks",0.0,1.0,0.0,0.0
18,JNPR,2021-02-19,03:19AM,"Does Juniper Networks, Inc.'s (NYSE:JNPR) Weak Fundamentals Mean That The Market Could Correct Its Share Price?",0.152,0.733,0.115,-0.1779
19,JNPR,2021-02-18,08:35AM,Juniper Networks Receives 'AA' Rating in CyberRatings.org Inaugural Enterprise Firewall Product Ratings,0.0,1.0,0.0,0.0
20,JNPR,2021-02-11,04:10AM,A Technical Strategy for Network Provider Juniper,0.0,1.0,0.0,0.0
21,JNPR,2021-02-09,08:30AM,Juniper Networks Announces Date and Webcast Information for Upcoming Investor Events,0.0,1.0,0.0,0.0
22,JNPR,2021-02-04,09:02AM,"Telecom Stock Roundup: Ericsson, Juniper Surpass Q4 Earnings Estimates & More",0.0,1.0,0.0,0.0
23,JNPR,2021-01-29,08:06AM,"Juniper (JNPR) Q4 Earnings Beat Estimates, Revenues Up Y/Y",0.0,1.0,0.0,0.0
24,JNPR,2021-01-29,06:00AM,Suspected Russian Hackers Gained Edge Through Tech Firm Attacks,0.358,0.448,0.194,-0.296
25,JNPR,2021-01-29,02:21AM,Junipers 4Q Sales Top Street Estimates; Shares Dip,0.349,0.361,0.289,-0.4278
26,JNPR,2021-01-29,12:01AM,Juniper Networks Inc (JNPR) Q4 2020 Earnings Call Transcript,0.0,1.0,0.0,0.0
27,JNPR,2021-01-28,06:03PM,Juniper Beat Earnings Expectations. Its Stock Is Sliding.,0.0,1.0,0.0,0.0
28,JNPR,2021-01-28,05:45PM,Juniper Networks (JNPR) Beats Q4 Earnings and Revenue Estimates,0.0,1.0,0.0,0.0
29,JNPR,2021-01-28,04:58PM,Juniper Networks: Q4 Earnings Insights,0.0,1.0,0.0,0.0
30,JNPR,2021-01-28,04:25PM,Juniper Networks shares dip 3% on flat sales,0.0,0.761,0.239,0.296
31,JNPR,2021-01-28,04:15PM,Juniper Networks Reports Preliminary Fourth Quarter and Fiscal Year 2020 Financial Results,0.0,1.0,0.0,0.0
32,JNPR,2021-01-27,05:00PM,Juniper Networks Announces Close of Apstra Acquisition,0.0,1.0,0.0,0.0
33,JNPR,2021-01-27,10:14AM,Earnings Preview for Juniper Networks,0.0,1.0,0.0,0.0
34,JNPR,2021-01-25,02:12PM,"Cisco and Arista Should Benefit From Improving IT Spending, Says Analyst",0.0,0.608,0.392,0.7003
35,JNPR,2021-01-25,07:53AM,Juniper (JNPR) to Report Q4 Earnings: What's in the Cards?,0.0,1.0,0.0,0.0
36,JNPR,2021-01-15,08:30AM,Juniper Networks Announces Date of Virtual Investor Day Event,0.0,1.0,0.0,0.0
37,JNPR,2021-01-14,01:35PM,"Buy Corning, Juniper, and Casa, but Sell HP, Analyst Says",0.0,1.0,0.0,0.0
38,JNPR,2021-01-13,03:00AM,Juniper Networks and Türk Telekom Create Joint Innovation Path for Accelerated Open RAN Development and Deployment,0.0,0.749,0.251,0.5719
39,JNPR,2021-01-09,09:25PM,10 Best Communication Equipment / 5G Stocks To Buy Now,0.0,0.656,0.344,0.6369
40,JNPR,2021-01-05,04:08AM,Juniper Networks (NYSE:JNPR) Seems To Use Debt Quite Sensibly,0.238,0.762,0.0,-0.3612
41,JNPR,2020-12-21,10:52AM,Is JNPR A Good Stock To Buy According To Hedge Funds?,0.0,0.756,0.244,0.4404
42,JNPR,2020-12-21,09:17AM,Juniper (JNPR) to Build JoongAng Group's AI-Driven Network,0.0,1.0,0.0,0.0
43,JNPR,2020-12-20,07:00PM,JoongAng Group Builds South Koreas First AI-Driven Enterprise Network by Juniper Networks,0.0,1.0,0.0,0.0
44,JNPR,2020-12-15,07:45AM,Juniper Networks 2021 Partner Program Brings Enhanced Rewards to Grow Partner-Led Business,0.0,0.78,0.22,0.4767
45,JNPR,2020-12-14,09:00AM,Juniper Networks Announces Date of Fourth Quarter and Fiscal Year 2020 Preliminary Financial Results Conference Call and Date of Virtual Investor Day Event,0.0,1.0,0.0,0.0
46,JNPR,2020-12-10,09:48AM,"Telecom Stock Roundup: Motorola Boosts Public Safety, Juniper Buys Apstra & More",0.0,0.638,0.362,0.6249
47,JNPR,2020-12-09,07:32PM,Juniper Networks Announces Expiration and Tender Results of Cash Tender Offer for Two Series of Senior Notes,0.0,1.0,0.0,0.0
48,JNPR,2020-12-09,07:25AM,FireEye Drops After Cybersecurity Company Says It Was Hacked,0.252,0.748,0.0,-0.4019
49,JNPR,2020-12-08,08:34AM,Juniper (JNPR) Buys Apstra to Boost Data Center Operations,0.0,0.748,0.252,0.4019
50,JNPR,2020-12-07,08:45AM,Juniper Networks Announces Intent to Acquire Apstra to Transform Data Center Operations with Leading Intent-Based Networking and Automated Closed Loop Assurance,0.0,0.893,0.107,0.34
51,JNPR,2020-12-06,03:34AM,Can Juniper Networks (NYSE:JNPR) Turn Things Around?,0.0,1.0,0.0,0.0
52,JNPR,2020-12-04,03:53PM,Nokia Needs a Win Now or Risks Serious Hemorrhaging,0.279,0.41,0.311,0.34
53,JNPR,2020-12-04,07:45AM,"Juniper Networks, Inc. -- Moody's assigns Baa2 rating to Juniper Networks' proposed debt issuance; outlook stable",0.134,0.749,0.118,-0.0772
54,JNPR,2020-12-03,08:43PM,Juniper Networks Announces Pricing of Senior Notes Offering,0.0,1.0,0.0,0.0
55,JNPR,2020-12-03,10:40AM,"Juniper Networks, Inc. -- Moody's assigns Baa2 rating to Juniper Networks' proposed debt issuance; outlook stable",0.134,0.749,0.118,-0.0772
56,JNPR,2020-12-03,08:48AM,Juniper Networks Announces Cash Tender Offer for Any and All 4.500% Senior Notes Due 2024 and 4.350% Senior Notes Due 2025,0.0,1.0,0.0,0.0
57,JNPR,2020-12-01,09:00PM,ThaiSri Insurance Selects Juniper Networks to Power Their AI-driven Network Enabling Its Digital-First Customer Experience Transformation,0.0,1.0,0.0,0.0
58,JNPR,2020-11-27,11:50AM,Ex-Dividend Date Insight: Juniper Networks,0.0,1.0,0.0,0.0
59,JNPR,2020-11-26,10:25AM,"Telecom Stock Roundup: AT&T Offers Business Update, Nokia-TELUS Deal Inked & More",0.0,1.0,0.0,0.0
60,JNPR,2020-11-24,11:25AM,"Juniper (JNPR), Zenlayer Partner to Revamp Datacenter Network",0.0,1.0,0.0,0.0
61,JNPR,2020-11-23,10:00PM,Edge Cloud Services Provider Zenlayer Selects Juniper Networks to Power a Better-Connected World,0.0,1.0,0.0,0.0
62,JNPR,2020-11-23,04:15PM,Juniper Networks Announces Date and Webcast Information for Upcoming Investor Conferences in December 2020,0.0,1.0,0.0,0.0
63,JNPR,2020-11-12,08:30AM,Juniper Networks Announces Date and Webcast Information for Upcoming Investor Conferences in November 2020,0.0,1.0,0.0,0.0
64,JNPR,2020-11-10,09:12AM,"Were Hedge Funds Right About Dumping Juniper Networks, Inc. (JNPR)?",0.204,0.796,0.0,-0.3182
65,JNPR,2020-11-09,12:25PM,Juniper Networks Named a Leader and Highest in Ability to Execute in Wired and Wireless LAN Access Infrastructure by Gartner,0.0,0.887,0.113,0.3182
66,JNPR,2020-11-09,09:28AM,What Type Of Returns Would Juniper Networks'(NYSE:JNPR) Shareholders Have Earned If They Purchased Their SharesFive Years Ago?,0.0,1.0,0.0,0.0
67,JNPR,2020-11-04,05:00PM,Alamanda College Selects AI-Driven Solutions by Juniper Networks to Power the Future of Learning,0.0,0.884,0.116,0.1779
68,JNPR,2020-11-04,07:45AM,Juniper Networks Announces Date for Global Partner Summit and Bold Vision for 2021,0.0,0.705,0.295,0.5574
69,JNPR,2020-10-30,11:30AM,How Juniper Networks Will Grow Again,0.0,1.0,0.0,0.0
70,JNPR,2020-10-30,09:34AM,Better Buy: Arista Networks vs. Juniper Networks,0.0,0.674,0.326,0.4404
71,JNPR,2020-10-28,07:40AM,"Juniper (JNPR) Q3 Earnings Miss Estimates, Revenues Beat",0.186,0.814,0.0,-0.1531
72,JNPR,2020-10-28,06:15AM,Spy agency ducks questions about 'back doors' in tech products,0.0,1.0,0.0,0.0
73,JNPR,2020-10-28,06:04AM,Spy agency ducks questions about 'back doors' in tech products,0.0,1.0,0.0,0.0
74,JNPR,2020-10-28,06:00AM,"INSIGHT-Spy agency ducks questions about ""back doors"" in tech products",0.0,1.0,0.0,0.0
75,JNPR,2020-10-27,10:01PM,Juniper Networks Inc (JNPR) Q3 2020 Earnings Call Transcript,0.0,1.0,0.0,0.0
76,JNPR,2020-10-27,05:45PM,Juniper Networks (JNPR) Q3 Earnings Lag Estimates,0.286,0.714,0.0,-0.34
77,JNPR,2020-10-27,04:34PM,Juniper Networks: Q3 Earnings Insights,0.0,1.0,0.0,0.0
78,JNPR,2020-10-27,04:15PM,Juniper Networks Reports Preliminary Third Quarter 2020 Financial Results,0.0,1.0,0.0,0.0
79,JNPR,2020-10-26,10:12AM,Earnings Outlook for Juniper Networks,0.0,1.0,0.0,0.0
80,JNPR,2020-10-22,09:03AM,What's in Store for Juniper (JNPR) This Earnings Season?,0.0,1.0,0.0,0.0
81,JNPR,2020-10-20,12:31PM,Analysts Estimate Juniper Networks (JNPR) to Report a Decline in Earnings: What to Look Out for,0.0,1.0,0.0,0.0
82,JNPR,2020-10-20,08:59AM,Juniper to Spur AI-Based Solutions With 128 Technology Buyout,0.0,0.825,0.175,0.1779
83,JNPR,2020-10-20,03:48AM,Juniper Snaps Up 128 Technology For $450M To Bolster AI-Portfolio,0.0,1.0,0.0,0.0
84,JNPR,2020-10-19,03:41PM,Juniper Networks acquires Boston-area AI SD-WAN startup 128 Technology for $450M,0.0,1.0,0.0,0.0
85,JNPR,2020-10-19,01:31PM,Juniper Will Buy Routing-Solutions Provider 128 for $450M,0.0,1.0,0.0,0.0
86,JNPR,2020-10-19,09:00AM,Juniper Networks Announces Intent to Acquire 128 Technology  Accelerating the Industry Transformation from Network-Centric SD-WANs to User-Centric AI-Driven WANs,0.0,1.0,0.0,0.0
87,JNPR,2020-10-15,09:08AM,Juniper Clinches Contract to Secure Telefonica's 5G Network,0.0,0.745,0.255,0.34
88,JNPR,2020-10-14,04:00AM,Telefónica Spain Selects Juniper Networks to Secure 5G Network,0.0,0.769,0.231,0.34
89,JNPR,2020-10-12,09:14AM,Why Juniper Networks' (NYSE:JNPR) CEO Pay Matters,0.187,0.667,0.147,-0.0772
90,JNPR,2020-10-08,09:16AM,Juniper Unveils Tripartite Enhancements for Secured Network,0.0,0.69,0.31,0.4019
91,JNPR,2020-10-07,07:45AM,Juniper Networks Answers Who and What is On the Network with Risk-Based Access Control Capabilities and New VPN Application,0.0,1.0,0.0,0.0
92,JNPR,2020-10-05,11:46AM,3 Dividend-Paying Tech Stocks to Buy in October,0.0,1.0,0.0,0.0
93,JNPR,2020-09-29,05:31PM,"Juniper Networks, Inc. -- Moody's announces completion of a periodic review of ratings of Juniper Networks, Inc.",0.0,1.0,0.0,0.0
94,JNPR,2020-09-29,10:54AM,Juniper To Buy Netrounds; Street Says Hold,0.0,1.0,0.0,0.0
95,JNPR,2020-09-29,08:28AM,Juniper Aims to Boost Network Services With Netrounds Buyout,0.0,0.748,0.252,0.4019
96,JNPR,2020-09-28,09:00AM,"Juniper Networks Announces Intent to Acquire Netrounds to Bring Assured Service Experience, Operational Simplicity to Service Providers",0.0,0.865,0.135,0.3612
97,JNPR,2020-09-23,04:17PM,"Microsoft, Facebook Data Center Upgrades Could Boost Arista Stock, Cisco",0.0,0.769,0.231,0.4019
98,JNPR,2020-09-17,04:15PM,Juniper Networks Announces Date of Third Quarter 2020 Preliminary Financial Results Conference Call and Webcast,0.0,1.0,0.0,0.0
99,JNPR,2020-09-17,02:50PM,"What Is Juniper Networks, Inc.'s (NYSE:JNPR) Share Price Doing?",0.0,0.784,0.216,0.296
