,ticker,date,time,headline,neg,neu,pos,compound
0,KEY,2021-04-13,12:30PM,KeyCorp (KEY) Reports Next Week: Wall Street Expects Earnings Growth,0.0,0.776,0.224,0.3818
1,KEY,2021-04-12,09:52AM,Here's Why You Should Hold KeyCorp (KEY) Stock Right Now,0.0,1.0,0.0,0.0
2,KEY,2021-03-30,09:02AM,KeyBank and Laurel Road Launch Digital Bank for Doctors,0.0,1.0,0.0,0.0
3,KEY,2021-03-30,07:00AM,Is a Rerating of Citizens Financial Group Coming?,0.0,1.0,0.0,0.0
4,KEY,2021-03-24,09:45AM,Should Value Investors Pick KeyCorp (KEY) Stock Right Now?,0.0,0.769,0.231,0.34
5,KEY,2021-03-23,06:14PM,4 S&P 500 Stocks That Have Soared Over the Past Year,0.0,1.0,0.0,0.0
6,KEY,2021-03-12,08:07AM,"KeyBank Announces $40B Investment In Communities Including Affordable Housing, Economic Inclusion, And Climate Change Funding Commitments",0.0,0.909,0.091,0.128
7,KEY,2021-03-12,07:07AM,3 Acquisitions That Could Shake Up the Regional Banking Space,0.175,0.825,0.0,-0.1779
8,KEY,2021-03-03,01:41PM,Piper Sandler Downgrades KeyCorp On Valuation After Big 2020 Run,0.0,1.0,0.0,0.0
9,KEY,2021-03-03,12:14PM,"KeyCorp (KEY) Boosts Digital Capabilities, Buys AQN Strategies",0.0,0.753,0.247,0.3182
10,KEY,2021-03-03,09:47AM,"Zacks.com featured highlights include: Take Two Interactive Software, Parker-Hannifin, Tapestry, KeyCorp and Interpublic Group of Companies",0.0,1.0,0.0,0.0
11,KEY,2021-03-02,04:05PM,Key Acquires AQN Strategies,0.0,1.0,0.0,0.0
12,KEY,2021-03-02,07:17AM,S&P 500 Sees Best Day Since June: Here're the Top 5 Gainers,0.0,0.6,0.4,0.7184
13,KEY,2021-03-01,12:15PM,Price Over Earnings Overview: KeyCorp,0.0,1.0,0.0,0.0
14,KEY,2021-02-25,01:12PM,KeyCorp To Present At The RBC Capital Markets Global Financial Institutions Conference,0.0,1.0,0.0,0.0
15,KEY,2021-02-23,08:47AM,Survey Reveals Young Americans Prefer A Hybrid Digital and Human Banking Experience,0.0,1.0,0.0,0.0
16,KEY,2021-02-11,09:15AM,"Key Family Wealth Named ""Best Multi-family Office $10B - $20B"" at the 2021 Private Asset Management Awards",0.0,0.482,0.518,0.9169
17,KEY,2021-02-10,05:46AM,"The Zacks Analyst Blog Highlights: East West Bancorp, Synovus Financial, KeyCorp, Comerica and Popular",0.0,0.823,0.177,0.4215
18,KEY,2021-02-05,12:10PM,"First Niagara Financial Group, Inc. -- Moody's announces completion of a periodic review of ratings of KeyCorp",0.0,1.0,0.0,0.0
19,KEY,2021-02-02,10:30AM,KeyCorp First Quarter 2021 Earnings Release Date And Conference Call,0.0,1.0,0.0,0.0
20,KEY,2021-01-29,05:47AM,"Zacks.com featured highlights include: Crown Holdings, Rockwell Automation, PerkinElmer, KeyCorp and ONEOK",0.0,1.0,0.0,0.0
21,KEY,2021-01-27,11:05AM,Traders Look to Regional Banks for Growth,0.0,0.698,0.302,0.3818
22,KEY,2021-01-25,04:35PM,"First Niagara Financial Group, Inc. -- Moody's affirms KeyCorp's ratings (long-term senior unsecured Baa1), outlook remains stable",0.131,0.758,0.111,-0.1027
23,KEY,2021-01-25,02:27AM,KeyCorp (NYSE:KEY) Has Compensated Shareholders With A Respectable 93% Return On Their Investment,0.0,0.791,0.209,0.4404
24,KEY,2021-01-22,01:36PM,This former Michigan State University basketball player started selling mortgages in his 20s now he's worth more than $11 billion,0.0,0.909,0.091,0.2263
25,KEY,2021-01-21,05:31PM,KeyCorp (KEY) Q4 2020 Earnings Call Transcript,0.0,1.0,0.0,0.0
26,KEY,2021-01-21,07:06AM,Recap: KeyCorp Q4 Earnings,0.0,1.0,0.0,0.0
27,KEY,2021-01-20,10:12AM,Earnings Preview: KeyCorp,0.0,1.0,0.0,0.0
28,KEY,2021-01-20,09:58AM,Is a Surprise Coming for KeyCorp (KEY) This Earnings Season?,0.0,0.792,0.208,0.2732
29,KEY,2021-01-19,09:52AM,"Muted Loan Growth, Low Rates to Hurt KeyCorp (KEY) Q4 Earnings",0.342,0.497,0.161,-0.4404
30,KEY,2021-01-15,07:55AM,State Street (STT) to Report Q4 Earnings: What's in Store?,0.0,1.0,0.0,0.0
31,KEY,2021-01-14,04:15PM,KeyCorp Declares Quarterly Cash Dividend On Common Shares And Preferred Stocks; Sets Annual Meeting Date,0.0,0.864,0.136,0.296
32,KEY,2021-01-13,08:47AM,Rachael Sampson Named Director of Key4Women,0.0,1.0,0.0,0.0
33,KEY,2021-01-06,03:34PM,Financial sector set for best day in 2 months as Georgia results spark bond-yield pop,0.0,0.663,0.337,0.7269
34,KEY,2020-12-21,05:02PM,Is KEY A Good Stock To Buy According To Hedge Funds?,0.0,0.756,0.244,0.4404
35,KEY,2020-12-20,04:50PM,Top Insider Buys Highlight for the Week of Dec. 18,0.0,0.656,0.344,0.4939
36,KEY,2020-12-10,05:11PM,KeyCorp Student Loan Trust 2006-A -- Moody's upgrades two securities issued by two KeyCorp student loan securitizations,0.0,0.68,0.32,0.6808
37,KEY,2020-11-25,01:07AM,"KeyCorp (NYSE:KEY) Is About To Go Ex-Dividend, And It Pays A 4.4% Yield",0.0,1.0,0.0,0.0
38,KEY,2020-11-24,05:31PM,KeyCorp To Present At The Goldman Sachs U.S. Financial Services Virtual Conference 2020,0.0,1.0,0.0,0.0
39,KEY,2020-11-19,04:44PM,KeyCorp Declares Quarterly Cash Dividend On Common Shares And Preferred Stocks,0.0,0.82,0.18,0.296
40,KEY,2020-11-19,09:00AM,KeyBank Names Eric Fiala Head of Corporate Responsibility,0.0,1.0,0.0,0.0
41,KEY,2020-11-12,09:34AM,Understanding KeyCorp's Unusual Options Activity,0.0,1.0,0.0,0.0
42,KEY,2020-11-12,08:47AM,Key4Women Survey Reveals Women Business Owners' Confidence Falling in 2020,0.124,0.62,0.256,0.4019
43,KEY,2020-11-12,08:30AM,KeyCorp Fourth Quarter 2020 Earnings Release Date And Conference Call,0.0,1.0,0.0,0.0
44,KEY,2020-11-03,11:18AM,Were These Hedge Funds Right About KeyCorp (KEY)?,0.0,1.0,0.0,0.0
45,KEY,2020-10-29,01:51PM,KeyCorp To Present At The BancAnalysts Of Boston Virtual Conference,0.0,1.0,0.0,0.0
46,KEY,2020-10-29,11:18AM,Who Has Been Buying KeyCorp (NYSE:KEY) Shares?,0.0,0.732,0.268,0.296
47,KEY,2020-10-21,10:31PM,KeyCorp (KEY) Q3 2020 Earnings Call Transcript,0.0,1.0,0.0,0.0
48,KEY,2020-10-21,08:59AM,KeyCorps Profit Rises As Credit Loss Provisions Drop 20%,0.295,0.336,0.369,0.2732
49,KEY,2020-10-21,08:01AM,"KeyCorp's (KEY) Q3 Earnings Beat, Revenues & Expenses Up Y/Y",0.0,1.0,0.0,0.0
50,KEY,2020-10-21,07:10AM,Recap: KeyCorp Q3 Earnings,0.0,1.0,0.0,0.0
51,KEY,2020-10-20,10:26AM,Earnings Preview: KeyCorp,0.0,1.0,0.0,0.0
52,KEY,2020-10-20,08:23AM,Is a Surprise Coming for KeyCorp (KEY) This Earnings Season?,0.0,0.792,0.208,0.2732
53,KEY,2020-10-19,08:23AM,"Low Rates, Weak Loan Demand to Hurt KeyCorp (KEY) Q3 Earnings",0.586,0.414,0.0,-0.836
54,KEY,2020-10-16,03:15PM,3 High-Yield Stocks at Rock-Bottom Prices,0.0,1.0,0.0,0.0
55,KEY,2020-10-15,07:44AM,5 Major Bank Stocks Set to Beat on Q3 Earnings Amid Low Rates,0.16,0.84,0.0,-0.2732
56,KEY,2020-10-08,11:59AM,KeyBank Rises to 7th Among Nation's Top Banks For SBA 7(a) Lending,0.0,0.859,0.141,0.2023
57,KEY,2020-10-02,11:47AM,KeyBank Rises as a Top Ten Franchise Financing Supplier In Entrepreneur Magazine Rankings,0.0,0.859,0.141,0.2023
58,KEY,2020-09-27,10:46AM,3 Stock Picks Trading Below Their Earnings Power Values,0.0,0.722,0.278,0.4019
59,KEY,2020-09-21,10:18AM,Analyzing KeyCorp's Unusual Options Activity,0.0,1.0,0.0,0.0
60,KEY,2020-09-17,10:25AM,"The Zacks Analyst Blog Highlights: Bank of America Corporation, JPMorgan Chase, Citigroup, KeyCorp and The PNC Financial Services",0.0,1.0,0.0,0.0
61,KEY,2020-09-17,10:05AM,"PNC Financial, KeyCorp Accelerate Branch Closures Amid Crisis",0.369,0.631,0.0,-0.6249
62,KEY,2020-09-16,05:06PM,Analyst Report: KeyCorp,0.0,1.0,0.0,0.0
63,KEY,2020-09-11,08:55AM,Key Private Bank Awarded Outstanding Achievement In Trusts From WealthManagement.com For The Second Consecutive Year,0.0,0.55,0.45,0.8689
64,KEY,2020-09-09,03:19PM,Hedge Funds Cashing Out Of KeyCorp (KEY),0.0,1.0,0.0,0.0
65,KEY,2020-08-28,03:30PM,5 Cheap Stocks to Buy With High Yield and Good Earnings Power,0.0,0.775,0.225,0.4404
66,KEY,2020-08-27,08:00AM,"Bill.com and KeyBank introduce Key CashFlowsm, a Streamlined Payments Solution for Small and Midsize Businesses",0.0,0.85,0.15,0.3182
67,KEY,2020-08-26,07:37AM,Is It Worth Considering KeyCorp (NYSE:KEY) For Its Upcoming Dividend?,0.0,0.826,0.174,0.2263
68,KEY,2020-08-21,10:02AM,KeyCorp Third Quarter 2020 Earnings Release Date And Conference Call,0.0,1.0,0.0,0.0
69,KEY,2020-08-14,07:30AM,KeyCorp To Present At The Barclays Global Financial Services Virtual Conference,0.0,1.0,0.0,0.0
70,KEY,2020-08-13,09:21AM,KeyBank Smart Checking(SM) Helps Americans Cut Costs,0.184,0.351,0.465,0.4939
71,KEY,2020-08-13,07:00AM,9 Large Regional Banks That Offer Steady Dividends  for Now,0.0,1.0,0.0,0.0
72,KEY,2020-08-11,09:00AM,KeyBanc Capital Markets Survey Reveals Growth Expectations Among Private Software Companies Cut In Half,0.126,0.719,0.156,0.128
73,KEY,2020-07-28,02:19PM,What Is The Ownership Structure Like For KeyCorp (NYSE:KEY)?,0.0,0.762,0.238,0.3612
74,KEY,2020-07-23,05:31AM,KeyCorp (KEY) Q2 2020 Earnings Call Transcript,0.0,1.0,0.0,0.0
75,KEY,2020-07-22,09:09AM,"KeyCorp (KEY) Q2 Earnings & Revenues Beat, Provisions Rise",0.0,1.0,0.0,0.0
76,KEY,2020-07-22,07:19AM,KeyCorp: Q2 Earnings Insights,0.0,1.0,0.0,0.0
77,KEY,2020-07-20,08:10AM,"High Fee Income, C&I Loans to Aid KeyCorp (KEY) Q2 Earnings",0.0,1.0,0.0,0.0
78,KEY,2020-07-13,10:55AM,6 Banks Trading With Low Price-Sales Ratios,0.296,0.704,0.0,-0.2732
79,KEY,2020-07-10,10:48AM,"Fed's Income Test Threatens KeyCorp Dividends, BofA Says In Downgrade",0.224,0.776,0.0,-0.3818
80,KEY,2020-07-08,05:15PM,KeyCorp Declares Quarterly Cash Dividend On Common Shares And Preferred Stocks,0.0,0.82,0.18,0.296
81,KEY,2020-07-06,09:06PM,KeyCorp (KEY): Are Hedge Funds Right About This Stock?,0.0,1.0,0.0,0.0
82,KEY,2020-06-30,06:30AM,KeyCorp Preliminary Stress Capital Buffer,0.412,0.588,0.0,-0.4215
83,KEY,2020-06-29,08:05AM,Idemitsu Renewables Completes $60 Million Financing for 50 Megawatt Central 40 Solar Project in California,0.0,1.0,0.0,0.0
84,KEY,2020-06-26,11:50AM,P/E Ratio Insights for KeyCorp,0.0,1.0,0.0,0.0
85,KEY,2020-06-10,08:47AM,"EasyUp® Becomes Most Flexible, Free Debt Paydown Feature on the Market",0.167,0.484,0.349,0.4602
86,KEY,2020-06-09,10:11AM,Edited Transcript of KEY earnings conference call or presentation 16-Apr-20 1:00pm GMT,0.0,1.0,0.0,0.0
87,KEY,2020-05-30,11:58AM,KeyCorp (KEY): A Rare Banking Stock Hedge Funds Piling Into,0.0,1.0,0.0,0.0
88,KEY,2020-05-27,09:00AM,KeyBank Releases 2019 Corporate Responsibility Report,0.0,1.0,0.0,0.0
89,KEY,2020-05-22,07:00AM,6 Banks PNC Might Want to Buy,0.0,0.794,0.206,0.0772
90,KEY,2020-05-20,04:30PM,KeyCorp Declares Quarterly Cash Dividend On Common Shares And Preferred Stocks,0.0,0.82,0.18,0.296
91,KEY,2020-05-15,10:34AM,Here's Why You Should Hold On to KeyCorp (KEY) Stock Now,0.0,1.0,0.0,0.0
92,KEY,2020-05-14,04:58PM,KeyCorp Second Quarter 2020 Earnings Release Date And Conference Call,0.0,1.0,0.0,0.0
93,KEY,2020-05-14,03:37PM,"Wells Fargo, Citizens Financial, and Other Banks That May Cut Their Dividends",0.149,0.709,0.142,-0.0258
94,KEY,2020-05-14,03:20PM,Wells Fargo leads list of bank stocks at risk for dividend cuts,0.281,0.588,0.131,-0.3182
95,KEY,2020-05-14,01:37PM,KeyCorp Looks Locked Out Right Now,0.0,1.0,0.0,0.0
96,KEY,2020-05-13,03:39PM,KeyCorp To Present At The Deutsche Bank Global Financial Institutions Virtual Conference,0.0,1.0,0.0,0.0
97,KEY,2020-05-09,06:00AM,Is KeyCorp Stock a Buy?,0.0,1.0,0.0,0.0
98,KEY,2020-05-06,07:24AM,KeyBank ranks #35 on the 2020 Top 50 Companies List from DiversityInc; named to multiple specialty lists,0.0,0.899,0.101,0.2023
99,KEY,2020-05-05,08:30AM,5 Bank Stocks That Can Gain as the Virus Crisis Eases,0.244,0.417,0.339,0.1531
