,ticker,date,time,headline,neg,neu,pos,compound
0,KR,2021-04-13,02:12PM,Frontline food workers face disproportionate impacts from COVID-19 pandemic,0.0,1.0,0.0,0.0
1,KR,2021-04-13,12:30PM,3 Stocks That Are Absurdly Cheap Right Now,0.0,1.0,0.0,0.0
2,KR,2021-04-12,12:12PM,"Amazon launches new food brand, Aplenty",0.0,0.746,0.254,0.1779
3,KR,2021-04-11,10:03AM,Better Buy: Amazon vs. Kroger,0.0,0.395,0.605,0.5574
4,KR,2021-04-10,08:00AM,"Gen Z, Millennials feed COVID-19's snacking boom, boosting brands like Coke, Pepsi",0.0,0.671,0.329,0.5994
5,KR,2021-04-08,06:05AM,"Beyond Meat to Expand Product Offerings at Kroger, Target, Other Grocers",0.0,0.813,0.187,0.3182
6,KR,2021-04-07,04:32PM,Is KR Stock A Buy or Sell?,0.0,1.0,0.0,0.0
7,KR,2021-04-06,12:55PM,5 Guru Stocks with Predictable Business,0.0,1.0,0.0,0.0
8,KR,2021-04-05,12:13PM,Costco stock may surprise if the company hikes membership fees in fall 2022,0.0,0.851,0.149,0.2732
9,KR,2021-04-05,08:00AM,Jewish community dismayed at Kroger's closure of Ralphs in Pico-Robertson,0.244,0.756,0.0,-0.4404
10,KR,2021-04-02,12:34PM,Smoothies and salads: Kroger says these 4 items account for 28% of its produce sales,0.0,1.0,0.0,0.0
11,KR,2021-04-01,11:04AM,"Kroger (KR) On Track to Boost Digital Business, Reinstates View",0.0,0.769,0.231,0.4019
12,KR,2021-04-01,09:40AM,Krogers Investor Day Left Analysts Cautious,0.219,0.781,0.0,-0.1027
13,KR,2021-04-01,08:30AM,3 Top Value Stocks to Buy in April,0.0,0.543,0.457,0.4939
14,KR,2021-03-31,07:47AM,"Kroger plans to grow with digital, private label brands and fresh food",0.0,0.827,0.173,0.3182
15,KR,2021-03-31,07:30AM,Kroger Outlines Strategy to Deliver Strong and Sustainable Total Shareholder Return by Leading With Fresh and Accelerating With Digital,0.0,0.752,0.248,0.6808
16,KR,2021-03-29,06:29PM,Kroger Co. (The) -- Moody's announces completion of a periodic review of ratings of Kroger Co. (The),0.0,1.0,0.0,0.0
17,KR,2021-03-29,04:40PM,"Ahold Finance U.S.A., LLC -- Moody's announces completion of a periodic review of ratings of Koninklijke Ahold Delhaize N.V.",0.0,1.0,0.0,0.0
18,KR,2021-03-29,01:29PM,Koninklijke Ahold Delhaize N.V. -- Moody's announces completion of a periodic review of ratings of Koninklijke Ahold Delhaize N.V.,0.0,1.0,0.0,0.0
19,KR,2021-03-25,03:00PM,Amazon starts on-site COVID-19 vaccination for U.S. employees,0.0,0.805,0.195,0.1779
20,KR,2021-03-24,06:15PM,"Is Kroger Stock A Buy Right Now? Here's What Earnings, Charts Show",0.0,1.0,0.0,0.0
21,KR,2021-03-24,01:28PM,5 Cheap Stocks Paying High Dividend Yields,0.0,1.0,0.0,0.0
22,KR,2021-03-24,08:45AM,2 Cheap Dividend Stocks You Can Buy Right Now,0.0,1.0,0.0,0.0
23,KR,2021-03-17,03:30PM,Kroger to Host 2021 Virtual Investor Conference,0.0,1.0,0.0,0.0
24,KR,2021-03-15,03:17AM,Are Institutions Heavily Invested In The Kroger Co.'s (NYSE:KR) Shares?,0.0,0.804,0.196,0.296
25,KR,2021-03-12,10:00AM,What Kroger Wants Investors to Know About 2020's Record Year,0.0,1.0,0.0,0.0
26,KR,2021-03-11,04:30PM,Kroger's Board of Directors Declares Quarterly Dividend,0.0,1.0,0.0,0.0
27,KR,2021-03-11,08:26AM,Kroger Health to administer 1 million COVID-19 vaccine doses per week,0.0,1.0,0.0,0.0
28,KR,2021-03-11,08:00AM,Kroger Health Increases COVID-19 Vaccination Capacity to One Million Doses Per Week,0.0,1.0,0.0,0.0
29,KR,2021-03-10,05:24PM,Ralphs and Food 4 Less locations to close in Los Angeles over hazard pay rules,0.097,0.903,0.0,-0.1027
30,KR,2021-03-10,12:14PM,Why one of America's favorite hot dog brands may be up for sale,0.0,0.8,0.2,0.4588
31,KR,2021-03-09,11:27AM,5 Defensive Companies Trading With Low Price-Earnings Ratios,0.256,0.61,0.134,-0.25
32,KR,2021-03-09,10:00AM,Kroger Expands Partnership with 80 Acres Farms to 316 Stores,0.0,0.865,0.135,0.1027
33,KR,2021-03-09,09:24AM,Kroger Is Flush With Cash,0.0,1.0,0.0,0.0
34,KR,2021-03-08,10:00PM,Kroger Expands Partnership With 80 Acres Farms to 316 Stores,0.0,0.865,0.135,0.1027
35,KR,2021-03-08,09:30AM,Kroger (KR) Q4 2020 Earnings Call Transcript,0.0,1.0,0.0,0.0
36,KR,2021-03-06,07:11AM,Why Does Warren Buffett Keep Buying Kroger Stock?,0.0,1.0,0.0,0.0
37,KR,2021-03-05,11:05PM,Kroger (KR) Reports Mixed Financial Results for Q4,0.0,1.0,0.0,0.0
38,KR,2021-03-05,12:41PM,Kroger CEO Talks 2021 Outlook: Consumers Are Loving Family Dinner Time,0.0,0.719,0.281,0.5994
39,KR,2021-03-05,09:39AM,"Company News for Mar 5, 2021",0.0,1.0,0.0,0.0
40,KR,2021-03-05,01:23AM,Kroger Tops 4Q Profit Estimates As Online Sales Spike 118%; Shares Gain,0.205,0.296,0.499,0.7155
41,KR,2021-03-04,12:28PM,Kroger's 4th-Quarter Results: Looking Beyond the Numbers,0.0,1.0,0.0,0.0
42,KR,2021-03-04,11:11AM,"Kroger's (KR) Q4 Earnings Top Estimates, Digital Sales Spike",0.0,0.816,0.184,0.2023
43,KR,2021-03-04,10:48AM,"Kroger Tops Q4 Estimates, But Expects Sales Slowdown as Pandemic-Driven Demand Wanes",0.101,0.676,0.223,0.4215
44,KR,2021-03-04,10:01AM,"Okta surpasses Q4 earnings estimates, Vroom posts mixed earnings",0.0,1.0,0.0,0.0
45,KR,2021-03-04,09:40AM,Kroger Posted Mixed Results. Why Its Outlook Matters More for the Stock.,0.0,0.909,0.091,0.0258
46,KR,2021-03-04,09:25AM,Kroger (KR) Surpasses Q4 Earnings Estimates,0.0,1.0,0.0,0.0
47,KR,2021-03-04,08:47AM,Kroger: Q4 Earnings Insights,0.0,1.0,0.0,0.0
48,KR,2021-03-04,08:34AM,Kroger shares rise after earnings beat,0.0,0.694,0.306,0.296
49,KR,2021-03-04,08:30AM,UPDATE 3-Kroger caps pandemic-fueled record year with upbeat profit forecast,0.0,0.756,0.244,0.4404
50,KR,2021-03-04,08:20AM,Kroger caps pandemic-fueled record year with upbeat profit forecast,0.0,0.734,0.266,0.4404
51,KR,2021-03-04,08:15AM,Kroger Delivers Strong Fourth Quarter and Fiscal Year 2020 Results,0.0,0.732,0.268,0.5106
52,KR,2021-03-04,05:53AM,"Kroger Rises as Adjusted Quarterly Profit, Outlook Beat Estimates",0.0,0.734,0.266,0.4404
53,KR,2021-03-03,01:45PM,Kroger To Still Require Masks In Texas And Mississippi Stores Despite Mandate Lift,0.0,1.0,0.0,0.0
54,KR,2021-03-03,10:55AM,Kroger will continue to require masks in Texas and Mississippi stores,0.0,1.0,0.0,0.0
55,KR,2021-03-03,10:40AM,A Preview Of Kroger's Earnings,0.0,1.0,0.0,0.0
56,KR,2021-03-02,03:55PM,Kroger Continues to Support Disaster Response to Uplift Communities Affected by Texas Winter Storm,0.294,0.567,0.139,-0.4588
57,KR,2021-03-02,10:06AM,Kroger (KR) to Report Q4 Earnings: What Awaits the Stock?,0.0,0.874,0.126,0.0772
58,KR,2021-03-01,04:05PM,Kroger Announces Retirement of EVP and COO Mike Donnelly,0.0,1.0,0.0,0.0
59,KR,2021-03-01,08:00AM,The Kroger Co. Zero Hunger | Zero Waste Foundation Announces Open Call for Second Innovation Fund Cohort,0.235,0.637,0.127,-0.296
60,KR,2021-03-01,07:03AM,"Why Costco pays its 180,000 workers way more than the minimum wage",0.0,1.0,0.0,0.0
61,KR,2021-02-28,01:00PM,Kroger Earnings: What to Watch,0.0,1.0,0.0,0.0
62,KR,2021-02-28,09:14AM,"Benzinga's Weekly Bulls And Bears: Airbnb, Apple, Kroger, Starbucks, Tesla And More",0.0,1.0,0.0,0.0
63,KR,2021-02-26,08:55AM,"Zacks Industry Outlook Highlights: Kroger, Wal-Mart de Mexico, J Sainsbury and Walmart",0.0,1.0,0.0,0.0
64,KR,2021-02-23,01:11PM,"Kroger stock falls after BofA analyst turns bearish, about a week ahead of earnings report",0.0,1.0,0.0,0.0
65,KR,2021-02-23,12:41PM,BofA Turns Bearish On Kroger Ahead Of Tough Comparisons,0.158,0.842,0.0,-0.128
66,KR,2021-02-23,11:10AM,3 Reasons Kroger Stock Has a New Critic,0.296,0.704,0.0,-0.2732
67,KR,2021-02-22,08:00AM,Kroger Closes Stores to Avoid Hazard Pay: Bad News for Real Estate Investors,0.415,0.585,0.0,-0.7269
68,KR,2021-02-22,07:36AM,Kroger Reports Customer Data Breach Incident,0.0,1.0,0.0,0.0
69,KR,2021-02-21,04:47PM,Kroger says customer data may have been stolen in hack,0.262,0.738,0.0,-0.4939
70,KR,2021-02-19,04:05PM,Top Consumer Staples Stocks for March 2021,0.0,0.769,0.231,0.2023
71,KR,2021-02-19,04:05PM,Accellion Security Incident Impacts Kroger Family of Companies Associates and Limited Number of Customers,0.114,0.663,0.223,0.2023
72,KR,2021-02-19,06:00AM,6 Retail Stocks to Buy for Bets on Sales Growth,0.0,0.755,0.245,0.3818
73,KR,2021-02-18,03:57PM,Kroger Fourth Quarter Conference Call with Investors,0.0,1.0,0.0,0.0
74,KR,2021-02-18,03:04PM,Could Berkshire Already Own a Stake in Buffett's Next Deal?,0.0,1.0,0.0,0.0
75,KR,2021-02-17,04:38PM,Clorox wipes can be found in stores again  its CEO explains why,0.0,1.0,0.0,0.0
76,KR,2021-02-17,02:52PM,Kraft Heinz may be cooking up more big deals,0.0,1.0,0.0,0.0
77,KR,2021-02-17,01:20PM,Kroger Health Introduces COVID-19 Vaccine Scheduling Solutions to Enhance Vaccination Efforts,0.0,0.855,0.145,0.1779
78,KR,2021-02-17,07:15AM,Better Buy: Costco vs. Kroger,0.0,0.58,0.42,0.4404
79,KR,2021-02-16,02:26PM,Employer perks for COVID-19 vaccinated workers could draw legal challenges,0.0,0.741,0.259,0.2023
80,KR,2021-02-16,10:15AM,Kroger Health Partners With Gauss For At-Home COVID-19 Testing Kit,0.0,1.0,0.0,0.0
81,KR,2021-02-16,06:00AM,Kroger Health Partners with Gauss to Provide Smartphone-Enabled COVID-19 Rapid Antigen Home Tests,0.0,1.0,0.0,0.0
82,KR,2021-02-12,09:49AM,Why Spam maker Hormel just bought 115-year-old Planters for $3.35 billion,0.2,0.8,0.0,-0.3612
83,KR,2021-02-11,07:00AM,Climate change will cause industry disruptions at unprecedented rate: Gro Intelligence CEO,0.155,0.645,0.2,0.1779
84,KR,2021-02-10,07:43AM,Aldi adding 100 stores in the U.S. in 2021,0.0,1.0,0.0,0.0
85,KR,2021-02-09,03:55PM,Kroger Partner Ocado is Thriving. Heres Why It May Disappoint Investors.,0.213,0.787,0.0,-0.4019
86,KR,2021-02-08,05:45PM,Kroger (KR) Gains But Lags Market: What You Should Know,0.194,0.62,0.186,-0.0258
87,KR,2021-02-08,12:13PM,14 Best Low-Risk Stocks to Buy Right Now,0.0,0.625,0.375,0.6369
88,KR,2021-02-07,01:45PM,The GameStop Phenomenon Is Hardly New. Heres How a Similar Squeeze Played Out in 1923.,0.0,0.844,0.156,0.34
89,KR,2021-02-06,02:30AM,"The Kroger Co. (NYSE:KR) Looks Like A Good Stock, And It's Going Ex-Dividend Soon",0.0,0.671,0.329,0.6597
90,KR,2021-02-05,05:35PM,Kroger to pay $100 to workers who get COVID-19 vaccination,0.135,0.865,0.0,-0.1027
91,KR,2021-02-05,05:27PM,Kroger to pay $100 to workers who get COVID-19 vaccination,0.135,0.865,0.0,-0.1027
92,KR,2021-02-05,05:12PM,Kroger offers $100 to each employee who gets the COVID-19 vaccine,0.0,1.0,0.0,0.0
93,KR,2021-02-05,04:48PM,Kroger Announces New Vaccine Payment for All Associates,0.0,1.0,0.0,0.0
94,KR,2021-02-03,03:00PM,Column: Local officials come to workers' defense as employers strip them of 'hero pay',0.08,0.629,0.291,0.5719
95,KR,2021-02-03,09:41AM,"Impossible Foods cuts grocery store prices 20%, to 'compete with the cow': president",0.155,0.845,0.0,-0.296
96,KR,2021-02-02,07:50PM,Kroger to close 2 California supermarkets after city mandates pandemic hazard pay for workers,0.104,0.896,0.0,-0.1027
97,KR,2021-02-02,05:45PM,Kroger (KR) Stock Sinks As Market Gains: What You Should Know,0.0,0.806,0.194,0.34
98,KR,2021-02-01,09:16PM,Ralphs and Food 4 Less set to close in Long Beach. They blame hazard pay ordinance,0.226,0.774,0.0,-0.4215
99,KR,2021-02-01,06:30AM,The Kroger Co. Foundation Announces Racial Equity Fund Build It Together Partners,0.0,1.0,0.0,0.0
