,ticker,date,time,headline,neg,neu,pos,compound
0,LEN,2021-04-13,12:00PM,What Makes Lennar (LEN) a Strong Momentum Stock: Buy Now?,0.0,0.708,0.292,0.5106
1,LEN,2021-04-13,11:36AM,Ignore warnings about a potential housing bubble and consider these stocks with bright outlooks,0.267,0.568,0.165,-0.2023
2,LEN,2021-04-13,11:19AM,Theres optimism in a demand resurgence for city living: Zillow,0.125,0.583,0.292,0.4588
3,LEN,2021-04-13,08:35AM,Here's How Much You'd Have If You Invested $1000 in Lennar a Decade Ago,0.0,1.0,0.0,0.0
4,LEN,2021-04-10,07:30AM,2 Companies That Raised Their Dividends This Week,0.0,1.0,0.0,0.0
5,LEN,2021-04-08,12:15PM,3 Zacks Rank #1s with High VGM Scores,0.0,1.0,0.0,0.0
6,LEN,2021-04-08,11:50AM,Is Lennar (LEN) a Great Value Stock Right Now?,0.0,0.48,0.52,0.7579
7,LEN,2021-04-08,08:40AM,How Lennar (LEN) Stock Stands Out in a Strong Industry,0.0,0.708,0.292,0.5106
8,LEN,2021-04-08,07:23AM,"The Zacks Analyst Blog Highlights: Goldman Sachs, Google, Alleghany Corp, Lennar Corp and WilliamsSonoma",0.0,1.0,0.0,0.0
9,LEN,2021-04-07,04:30PM,Lennar Corporation Declares Quarterly Dividends,0.0,1.0,0.0,0.0
10,LEN,2021-04-07,09:18AM,"Lennar's (LEN) Shares March Higher, Can It Continue?",0.0,0.761,0.239,0.296
11,LEN,2021-04-07,08:28AM,5 Top Growth Stocks to Boost Your Portfolio Returns in Q2,0.0,0.496,0.504,0.7269
12,LEN,2021-04-07,07:44AM,Economic Diagnosis After 1 Year of COVID-19: 6 Stock Picks,0.0,1.0,0.0,0.0
13,LEN,2021-04-06,09:15AM,"Lennar (LEN) Soars to 52-Week High, Time to Cash Out?",0.0,1.0,0.0,0.0
14,LEN,2021-04-05,09:50AM,Lennar (LEN) Completes SunStreet Solar Business Sale to Sunnova,0.0,1.0,0.0,0.0
15,LEN,2021-04-05,07:01AM,"Zacks.com featured highlights include: Lennar Corp, Vishay Intertechnology, Hillenbrand, TTEC Holdings and Avery Dennison Corp",0.0,1.0,0.0,0.0
16,LEN,2021-04-05,06:30AM,S&P 500 Hits 4K Milestone on Fabulous Economic Data: 5 Picks,0.0,0.726,0.274,0.5267
17,LEN,2021-04-01,04:17PM,Sunnova Completes Acquisition of SunStreetLennars Solar Platform for Homebuilders,0.0,1.0,0.0,0.0
18,LEN,2021-04-01,11:15AM,5 Best-Performing Stocks of the Top ETF of March,0.0,0.795,0.205,0.2023
19,LEN,2021-04-01,07:50AM,S&P 500 Hits New Highs: 5 Growth Stocks to Buy,0.0,0.755,0.245,0.3818
20,LEN,2021-03-31,11:06AM,"Lennar Corp, Ringcentral, Apple, Amazon and Google highlighted as Zacks Bull and Bear of the Day",0.0,0.898,0.102,0.1779
21,LEN,2021-03-31,10:26AM,"If You Invested $1000 in Lennar a Decade Ago, This is How Much It'd Be Worth Now",0.0,0.888,0.112,0.2263
22,LEN,2021-03-31,10:00AM,Pending home sales plunge for the second straight month,0.0,0.808,0.192,0.2263
23,LEN,2021-03-31,06:09AM,Bull Of The Day: Lennar Corp (LEN),0.0,1.0,0.0,0.0
24,LEN,2021-03-30,06:36PM,Third Avenue Value Fund's Top 1st-Quarter Trades,0.0,0.543,0.457,0.4939
25,LEN,2021-03-30,12:45PM,Looking for a Growth Stock? 3 Reasons Why Lennar (LEN) is a Solid Choice,0.0,0.682,0.318,0.4939
26,LEN,2021-03-30,12:27PM,Can Housing ETFs Remain Red-Hot in 2021?,0.0,1.0,0.0,0.0
27,LEN,2021-03-30,11:05AM,Top Ranked Value Stocks to Buy for March 30th,0.0,0.625,0.375,0.4939
28,LEN,2021-03-30,10:26AM,Top Ranked Momentum Stocks to Buy for March 30th,0.0,0.816,0.184,0.2023
29,LEN,2021-03-30,10:13AM,New Strong Buy Stocks for March 30th,0.0,0.645,0.355,0.5106
30,LEN,2021-03-29,11:30AM,Has Lennar (LEN) Outpaced Other Construction Stocks This Year?,0.0,1.0,0.0,0.0
31,LEN,2021-03-26,01:43PM,Is Lennar Corp. (LEN) A Smart Long-Term Buy?,0.0,0.69,0.31,0.4019
32,LEN,2021-03-26,01:10PM,3 Stocks with Low 12-Month and Forward PEG Ratios,0.231,0.769,0.0,-0.2732
33,LEN,2021-03-26,11:01AM,Veev Raises $100 Million for Modular Homes,0.0,1.0,0.0,0.0
34,LEN,2021-03-26,10:40AM,"Lennar Plans To Spin Off a New Company, Build Single-Family Rental Platform",0.0,1.0,0.0,0.0
35,LEN,2021-03-25,12:00PM,Lennar (LEN) Is Up 8.2% in One Week: What You Should Know,0.0,1.0,0.0,0.0
36,LEN,2021-03-25,07:25AM,"The Zacks Analyst Blog Highlights: Beazer Homes, Lennar Corp, M.D.C. Holdings, Toll Brothers and Taylor Morrison Home",0.0,1.0,0.0,0.0
37,LEN,2021-03-24,12:23PM,Top Consumer Discretionary Stocks for April 2021,0.0,0.769,0.231,0.2023
38,LEN,2021-03-24,03:37AM,Are Robust Financials Driving The Recent Rally In Lennar Corporation's (NYSE:LEN) Stock?,0.0,0.821,0.179,0.34
39,LEN,2021-03-23,06:33PM,3 Highly-Ranked Non-Tech Stocks to Buy Now,0.0,1.0,0.0,0.0
40,LEN,2021-03-23,12:31AM,Is Lennar (LEN) Stock A Buy or Sell?,0.0,1.0,0.0,0.0
41,LEN,2021-03-22,07:49PM,Stock Market News: Investors React to Lennar's and Coupa's Reports; Coherent Bidding War Continues,0.231,0.769,0.0,-0.5994
42,LEN,2021-03-22,07:07PM,Buy KB Home Stock Before Q1 Earnings as Longer-Term Play?,0.0,0.789,0.211,0.34
43,LEN,2021-03-22,11:58AM,RESICAP Partners with Lennar's Upward America as Primary Property Management & Maintenance Provider,0.0,1.0,0.0,0.0
44,LEN,2021-03-22,08:42AM,Here's How Much You'd Have If You Invested $1000 in Lennar a Decade Ago,0.0,1.0,0.0,0.0
45,LEN,2021-03-19,12:20PM,Surging Earnings Estimates Signal Upside for Lennar (LEN) Stock,0.0,1.0,0.0,0.0
46,LEN,2021-03-19,11:50AM,Are Investors Undervaluing Lennar (LEN) Right Now?,0.0,1.0,0.0,0.0
47,LEN,2021-03-19,11:09AM,Why Lennar Is a Good Pick for Value Investors,0.0,0.531,0.469,0.6486
48,LEN,2021-03-19,09:01AM,Lennar (LEN) Crossed Above the 200-Day Moving Average: What That Means for Investors,0.0,1.0,0.0,0.0
49,LEN,2021-03-18,10:37AM,Lennar (LEN) Stock Jumps 13.8%: Will It Continue to Soar?,0.0,1.0,0.0,0.0
50,LEN,2021-03-18,09:15AM,Lennar (LEN) Hits Fresh High: Is There Still Room to Run?,0.0,0.813,0.187,0.3182
51,LEN,2021-03-17,08:30PM,Lennar (LEN) Q1 2021 Earnings Call Transcript,0.0,1.0,0.0,0.0
52,LEN,2021-03-17,06:39PM,Lennar Stock Surged After Earnings. Whats Behind the Move.,0.0,1.0,0.0,0.0
53,LEN,2021-03-17,04:15PM,The Market Rallied This Afternoon. Here's Why.,0.0,1.0,0.0,0.0
54,LEN,2021-03-17,03:17PM,Dow Jones Up As Fed Holds Steady On Interest Rates; Powell Makes This Pledge,0.0,0.812,0.188,0.4588
55,LEN,2021-03-17,02:33PM,Stock Upgrades: Lennar Shows Rising Relative Strength,0.0,0.652,0.348,0.4939
56,LEN,2021-03-17,01:35PM,Why Lennar Corporation Stock Just Popped 11%,0.0,1.0,0.0,0.0
57,LEN,2021-03-17,01:31PM,Housing Starts Sunk In February. What It Means for Builder Stocks and Housing.,0.0,1.0,0.0,0.0
58,LEN,2021-03-17,12:55PM,P/E Ratio Insights for Lennar,0.0,1.0,0.0,0.0
59,LEN,2021-03-17,12:41PM,"Travel Stocks, Home Builders, Fear Gauge: 3 Things to Watch",0.286,0.714,0.0,-0.4939
60,LEN,2021-03-17,12:38PM,"UPDATE 2-Lennar to spin-off some non-core units, form a rental housing venture",0.0,1.0,0.0,0.0
61,LEN,2021-03-17,12:19PM,"Lennar to spin-off some non-core units, form a rental housing venture",0.0,1.0,0.0,0.0
62,LEN,2021-03-17,12:15PM,Lennar Announces $4 Billion Single Family Rental Platform with Centerbridge Partners as Lead Investor,0.0,1.0,0.0,0.0
63,LEN,2021-03-17,12:05PM,"Lennar to spin-off businesses to become pure-play homebuilder, financial services company",0.0,1.0,0.0,0.0
64,LEN,2021-03-17,11:02AM,Lennar Reports Good 1st-Quarter Numbers,0.0,0.58,0.42,0.4404
65,LEN,2021-03-17,10:25AM,"Housing Starts, Permits -10%+ for February",0.0,1.0,0.0,0.0
66,LEN,2021-03-17,10:00AM,"Dow Jones Today Rises, Nasdaq Dives; Financials Up Ahead Of Fed; McDonald's Upgraded, Eyes Buy Point",0.0,1.0,0.0,0.0
67,LEN,2021-03-17,09:40AM,Housing Starts & Building Permits Falls Last Month,0.0,1.0,0.0,0.0
68,LEN,2021-03-17,09:40AM,Home builder stocks take a broad hit after disappointing housing starts data,0.242,0.758,0.0,-0.4939
69,LEN,2021-03-17,09:35AM,"5 Top Stock Gainers for Wednesday: Build-A-Bear, Lennar",0.0,0.769,0.231,0.2023
70,LEN,2021-03-17,09:27AM,"Vishay Intertechnology, American Campus Communities, Boeing, CrowdStrike and Lennar Corp highlighted as Zacks Bull and Bear of the Day",0.0,1.0,0.0,0.0
71,LEN,2021-03-17,09:22AM,"Lennar to Spin Off Businesses, Including Tech Investments",0.0,1.0,0.0,0.0
72,LEN,2021-03-17,09:08AM,U.S. Housing Starts Stumble as Winter Weather Impedes Momentum,0.0,1.0,0.0,0.0
73,LEN,2021-03-17,06:51AM,"Lennar (LEN) Q1 Earnings Top Estimates, View Up, Shares Rise",0.0,0.667,0.333,0.4588
74,LEN,2021-03-17,05:06AM,Lennars 1Q Results Top Analysts Expectations As Housing Market Picks Up,0.0,0.847,0.153,0.2023
75,LEN,2021-03-17,01:15AM,"Homebuilder Lennar Tops Earnings Estimates, Target Price $109 in Best Case",0.0,0.545,0.455,0.8176
76,LEN,2021-03-16,07:40PM,Lennar Stock Is Climbing After Stellar Earnings. The Housing Market Remains Very Strong.,0.0,0.77,0.23,0.5563
77,LEN,2021-03-16,07:19PM,Lennar: Q1 Earnings Insights,0.0,1.0,0.0,0.0
78,LEN,2021-03-16,05:55PM,Lennar (LEN) Q1 Earnings and Revenues Beat Estimates,0.0,1.0,0.0,0.0
79,LEN,2021-03-16,05:54PM,"Dow, S&P Snap Winning Streaks; Lennar, Crowdstrike Beat",0.0,0.673,0.327,0.5267
80,LEN,2021-03-16,05:17PM,"Dow Jones Futures: Nasdaq Fades As Tesla Hits Resistance, But Microsoft, These 4 Chip Stocks Make Bullish Moves",0.0,1.0,0.0,0.0
81,LEN,2021-03-16,04:30PM,Lennar Reports First Quarter EPS of $3.20,0.0,1.0,0.0,0.0
82,LEN,2021-03-16,01:09PM,Lennar Corp. Tops Estimates as Low Rates Drive Housing Sales,0.157,0.597,0.246,0.296
83,LEN,2021-03-16,02:49AM,"U.S. Retail Sales, Fed Meeting, Europe Vaccine Disarray  Whats up in Markets",0.0,1.0,0.0,0.0
84,LEN,2021-03-15,12:03PM,Lennar to Beat Earnings Estimates; Stock Has Over 20% Upside Potential,0.0,1.0,0.0,0.0
85,LEN,2021-03-15,11:39AM,Preview: Lennar's Earnings,0.0,1.0,0.0,0.0
86,LEN,2021-03-15,10:44AM,Titan Machinery (TITN) to Report Q4 Earnings: What to Expect?,0.0,1.0,0.0,0.0
87,LEN,2021-03-15,08:53AM,Is Lennar (LEN) Stock a Solid Choice Right Now?,0.0,0.814,0.186,0.1531
88,LEN,2021-03-15,08:44AM,"Nike, FedEx, AMD, Lennar, and Other Stocks to Watch This Week",0.0,1.0,0.0,0.0
89,LEN,2021-03-14,03:57AM,"Earnings to Watch Next Week: Lennar, Five Below, Dollar General, FedEx and Nike in Focus",0.0,1.0,0.0,0.0
90,LEN,2021-03-12,10:33AM,"M.D.C. Holdings stock sinks after BofA turns bearish, citing valuation and affordability concerns",0.0,1.0,0.0,0.0
91,LEN,2021-03-12,08:47AM,Should You Buy Lennar (LEN) Ahead of Earnings?,0.0,1.0,0.0,0.0
92,LEN,2021-03-11,11:30AM,Is Lennar (LEN) Stock Outpacing Its Construction Peers This Year?,0.0,1.0,0.0,0.0
93,LEN,2021-03-11,09:23AM,"Higher Deliveries, Margins to Aid Lennar's (LEN) Q1 Earnings",0.0,1.0,0.0,0.0
94,LEN,2021-03-10,09:08AM,Should Investors Move Into Lennar Before Earnings?,0.0,1.0,0.0,0.0
95,LEN,2021-03-09,05:45PM,Lennar (LEN) Gains But Lags Market: What You Should Know,0.194,0.62,0.186,-0.0258
96,LEN,2021-03-09,03:48PM,IBD 50 Stock To Watch: D.R. Horton Is Suited Up For A Market Rally,0.0,1.0,0.0,0.0
97,LEN,2021-03-09,12:30PM,Lennar (LEN) Reports Next Week: Wall Street Expects Earnings Growth,0.0,0.776,0.224,0.3818
98,LEN,2021-03-08,04:30PM,Lennar Corporation's First Quarter Earnings Conference Call to be Broadcast Live on the Internet,0.0,1.0,0.0,0.0
99,LEN,2021-03-08,02:56PM,Will rising mortgage rates derail the red-hot housing market?,0.216,0.784,0.0,-0.296
