,ticker,date,time,headline,neg,neu,pos,compound
0,MET,2021-04-13,10:00AM,MetLife Earns 2021 ENERGY STAR® Sustained Excellence Award,0.0,0.324,0.676,0.8868
1,MET,2021-04-12,07:11AM,10 Best Home Insurance Companies,0.0,0.488,0.512,0.6369
2,MET,2021-04-07,04:54PM,Is MET Stock A Buy or Sell?,0.0,1.0,0.0,0.0
3,MET,2021-04-07,04:22PM,"MetLife Completes Sale of Auto & Home Business to Zurich Insurance Group Subsidiary Farmers Group, Inc.",0.0,1.0,0.0,0.0
4,MET,2021-04-07,04:15PM,MetLife to Hold Conference Call for First Quarter 2021 Results,0.0,1.0,0.0,0.0
5,MET,2021-04-02,01:17PM,12 Most Valuable Insurance Companies In The World,0.0,0.674,0.326,0.5256
6,MET,2021-04-02,12:03PM,A Trio of Low Price-Book Ratio Stock Picks,0.259,0.741,0.0,-0.2732
7,MET,2021-04-01,03:00PM,MetLife Investment Management Announces Partnership With Girls Who Invest,0.0,1.0,0.0,0.0
8,MET,2021-04-01,11:26AM,MetLife (MET) Set to Gain From High Demand for Holistic Benefits,0.097,0.516,0.387,0.6705
9,MET,2021-03-31,04:32PM,MetLife Statement on Voting Rights,0.0,1.0,0.0,0.0
10,MET,2021-03-31,08:00AM,Half of Young Employees Say Pandemic Made Work-Life Balance Better; 3 in 4 Baby Boomers Disagree,0.149,0.686,0.166,0.0772
11,MET,2021-03-29,02:33PM,MetLife Investment Management to Provide USD 161 Million / GBP 117.5 Million in Financing for English Football League,0.0,1.0,0.0,0.0
12,MET,2021-03-28,08:00PM,Football League turns to MetLife after BoE Covid support falls through,0.0,0.787,0.213,0.4019
13,MET,2021-03-25,11:23PM,MetLifes Global CEO Speaks on Gender Equity at United Nations Event,0.0,0.781,0.219,0.4215
14,MET,2021-03-25,04:31PM,MetLife Investment Management Reaches Record $22.4 Billion in Total Agricultural Mortgage Loan Assets Under Management,0.0,0.818,0.182,0.2263
15,MET,2021-03-24,09:30AM,MetLife (MET) Unit's Commercial Real Estate AUM Grows to $106.7B,0.0,1.0,0.0,0.0
16,MET,2021-03-23,04:30PM,MetLife Investment Management Completed $10.7 Billion in Commercial Real Estate Debt and Equity Investments in 2020,0.143,0.857,0.0,-0.3612
17,MET,2021-03-23,02:44PM,MetLife Names Robin Gordon as Chief Data and Analytics Officer,0.0,1.0,0.0,0.0
18,MET,2021-03-15,11:12AM,MetLife (MET) Soars 128% in a Year: Will the Rally Continue?,0.0,1.0,0.0,0.0
19,MET,2021-03-15,08:30AM,MetLife Elevates Global Chief Diversity & Inclusion Officer Role Through New Reporting Line to CEO,0.0,1.0,0.0,0.0
20,MET,2021-03-12,09:24AM,MetLife's (MET) Unit Private Debt Portfolio Reaches $102.1B,0.258,0.619,0.124,-0.3182
21,MET,2021-03-11,04:23PM,MetLife Investment Management Originates $15.7 Billion in Private Placement Debt and Private Structured Credit In 2020,0.131,0.733,0.136,0.0258
22,MET,2021-03-11,04:20PM,MetLife Investment Grows Private Debt Portfolio to $102 Billion,0.238,0.762,0.0,-0.3612
23,MET,2021-03-05,04:15PM,MetLife Confirms First Quarter 2021 Series A Preferred Stock Dividend,0.0,1.0,0.0,0.0
24,MET,2021-03-05,11:30AM,Why Is MetLife (MET) Up 13% Since Last Earnings Report?,0.0,1.0,0.0,0.0
25,MET,2021-03-02,08:30AM,MetLife CEO To Speak At U.N. Global Compact Target Gender Equality Live Conference,0.0,1.0,0.0,0.0
26,MET,2021-03-01,11:06AM,Sara Queen to Join MetLife Investment Management as Head of Real Estate Equity Group,0.0,0.855,0.145,0.296
27,MET,2021-02-25,10:35AM,MetLife Completes $5 Billion Longevity Reinsurance Transactions with Rothesay,0.0,1.0,0.0,0.0
28,MET,2021-02-23,12:30PM,"MetLife and Principal to Provide Annuity Benefits to Philips North America, LLC Retirement Participants",0.0,0.833,0.167,0.3818
29,MET,2021-02-22,11:28AM,MetLife Investment Management Supports Prince Georges County Public Schools With $203.5 Million in Public-Private Partnership Financing,0.0,0.857,0.143,0.3612
30,MET,2021-02-16,04:15PM,MetLife Announces First Quarter 2021 Preferred Stock Dividend Actions,0.0,1.0,0.0,0.0
31,MET,2021-02-11,10:53AM,"Jingsu Pu Rejoins MetLife Investment Management as Global Head of Insurance Strategy & Solutions and Head of Institutional Client Group, Asia Ex-Japan",0.092,0.833,0.075,-0.1027
32,MET,2021-02-10,05:40AM,"The Zacks Analyst Blog Highlights: Exxon Mobil, AbbVie, Caterpillar, Deere & Co and MetLife",0.0,1.0,0.0,0.0
33,MET,2021-02-08,11:00AM,"MetLife to Provide Annuity Benefits to Nearly 12,000 Dow Retirees and Beneficiaries",0.0,0.649,0.351,0.6597
34,MET,2021-02-07,09:19AM,3 Ways Investors Can Benefit From Americans' Renewed Interest In Life Insurance,0.0,0.6,0.4,0.7184
35,MET,2021-02-04,08:00PM,Metlife Inc (MET) Q4 2020 Earnings Call Transcript,0.0,1.0,0.0,0.0
36,MET,2021-02-04,04:56PM,Prudential Financial profit beats on asset management strength,0.0,0.368,0.632,0.8225
37,MET,2021-02-04,10:19AM,Price Over Earnings Overview: MetLife,0.0,1.0,0.0,0.0
38,MET,2021-02-04,09:39AM,"MetLife (MET) Q4 Earnings Beat Estimates, Revenues Rise Y/Y",0.0,1.0,0.0,0.0
39,MET,2021-02-04,07:15AM,"MetLife, Inc. to Host Earnings Call",0.0,1.0,0.0,0.0
40,MET,2021-02-04,01:56AM,MetLifes 4Q Profit Beats Estimates; Shares Gain,0.296,0.184,0.52,0.3954
41,MET,2021-02-03,09:06PM,MetLife Named to the Bloomberg Gender-Equality Index,0.0,1.0,0.0,0.0
42,MET,2021-02-03,05:55PM,MetLife (MET) Q4 Earnings and Revenues Beat Estimates,0.0,1.0,0.0,0.0
43,MET,2021-02-03,04:19PM,"MetLife profit rises marginally on investment gains, strong underwriting",0.0,0.419,0.581,0.8093
44,MET,2021-02-03,04:15PM,"MetLife profit rises marginally on investment gains, strong underwriting",0.0,0.419,0.581,0.8093
45,MET,2021-02-03,04:15PM,MetLife CFO John McCallion Provides Fourth Quarter and Full Year 2020 Financial Update Video,0.0,1.0,0.0,0.0
46,MET,2021-02-03,04:15PM,MetLife Announces Full Year and Fourth Quarter 2020 Results,0.0,1.0,0.0,0.0
47,MET,2021-02-03,03:22AM,MetLife Named to Worlds Most Admired Companies List by Fortune Magazine,0.0,0.736,0.264,0.5563
48,MET,2021-02-02,12:42PM,"Insurance Stock Earnings Roster for Feb 3: MET, ALL & More",0.0,1.0,0.0,0.0
49,MET,2021-02-02,10:11AM,MetLife's Earnings: A Preview,0.0,1.0,0.0,0.0
50,MET,2021-02-02,08:44AM,MetLife Named a Best Place to Work for LGBTQ Equality,0.0,0.656,0.344,0.6369
51,MET,2021-02-01,10:27AM,MetLife (MET) to Report Q4 Earnings: What's in the Cards?,0.0,1.0,0.0,0.0
52,MET,2021-02-01,10:03AM,Value or Momentum? How About Some of Both,0.0,0.745,0.255,0.34
53,MET,2021-02-01,09:32AM,MetLife Named to Worlds Most Admired Companies List by Fortune Magazine,0.0,0.736,0.264,0.5563
54,MET,2021-01-27,04:15PM,MetLife CEO and CFO to Speak at Bank of America 2021 Virtual Insurance Conference,0.0,1.0,0.0,0.0
55,MET,2021-01-27,08:30AM,MetLife Named to the Bloomberg Gender-Equality Index,0.0,1.0,0.0,0.0
56,MET,2021-01-26,01:02PM,"MetLife to Provide Annuity Benefits to 13,500 Lockheed Martin Retirees and Beneficiaries",0.0,0.649,0.351,0.6597
57,MET,2021-01-26,03:44AM,Did You Participate In Any Of MetLife's (NYSE:MET) Respectable 54% Return?,0.0,0.775,0.225,0.4404
58,MET,2021-01-25,05:24PM,"MetLife to Provide Annuity Benefits to Nearly 5,200 Weyerhaeuser Retirees and Beneficiaries",0.0,0.649,0.351,0.6597
59,MET,2021-01-24,03:37PM,10 Best Insurance Stocks To Buy Now,0.0,0.588,0.412,0.6369
60,MET,2021-01-21,07:04AM,"The Zacks Analyst Blog Highlights: Novartis, QUALCOMM, Accenture, MetLife and Electronic Arts",0.0,1.0,0.0,0.0
61,MET,2021-01-14,04:00PM,MetLife Names Merrilee Matchett as Head of Global Customer Service & Operations,0.0,1.0,0.0,0.0
62,MET,2021-01-14,12:44PM,"James Reid Named CEO of Versant Health, a MetLife Company",0.0,1.0,0.0,0.0
63,MET,2021-01-12,10:34AM,MetLife (MET) Unit to Reinsure Legal & General's Longevity Risk,0.198,0.66,0.142,-0.1531
64,MET,2021-01-11,08:51AM,MetLife Completes Longevity Reinsurance Transactions With Legal & General,0.0,0.824,0.176,0.128
65,MET,2021-01-07,04:15PM,MetLife Declares First Quarter 2021 Common Stock Dividend,0.0,1.0,0.0,0.0
66,MET,2021-01-06,04:15PM,MetLife to Hold Combined Earnings and Outlook Conference Call,0.0,1.0,0.0,0.0
67,MET,2020-12-23,03:00PM,MetLife Investment Management Partnerships With Norges Bank Investment Management and New York State Common Retirement Fund Receive 5 Star Rating From Global Real Estate Sustainability Benchmark,0.0,1.0,0.0,0.0
68,MET,2020-12-21,05:15PM,Is MET A Good Stock To Buy Now?,0.0,0.674,0.326,0.4404
69,MET,2020-12-21,09:30AM,"MetLife Investment Management Facilitates $130M Investment in Brookfield Renewable Partners Sidney A. Murray, Jr. Hydroelectric Facility in Louisiana",0.0,1.0,0.0,0.0
70,MET,2020-12-17,04:51PM,"AM Best Affirms Credit Ratings of MetLife, Inc. and Key Life/Health Subsidiaries; Upgrades Credit Ratings of Other Life/Health Subsidiaries",0.0,0.63,0.37,0.8555
71,MET,2020-12-17,01:37PM,MetLife (MET) Dips 5% Year to Date: Will it Recover in 2021?,0.0,1.0,0.0,0.0
72,MET,2020-12-15,08:30AM,MetLife Ranked in Top 25 of the S&P 500 for Gender Equality,0.0,0.859,0.141,0.2023
73,MET,2020-12-14,10:43AM,MetLife (MET) Announces Share Buyback Program Worth $3B,0.0,0.594,0.406,0.4767
74,MET,2020-12-11,12:21PM,MetLife (MET) to Sell Auto & Home Units to Streamline Business,0.0,1.0,0.0,0.0
75,MET,2020-12-11,05:30AM,Zurich Insurance to Buy MetLifes P&C Unit for $4 Billion,0.0,1.0,0.0,0.0
76,MET,2020-12-11,12:50AM,Zurich to buy MetLife U.S. property and casualty business for $3.94 bln,0.236,0.764,0.0,-0.5267
77,MET,2020-12-11,12:48AM,MetLife Announces New $3 Billion Share Repurchase Authorization,0.0,0.761,0.239,0.296
78,MET,2020-12-11,12:46AM,"MetLife to Sell Auto & Home Business to Zurich Insurance Group Subsidiary Farmers Group, Inc. for $3.94 Billion",0.0,1.0,0.0,0.0
79,MET,2020-12-08,08:30AM,MetLife Named One of the Top 75 Companies for Executive Women,0.0,0.847,0.153,0.2023
80,MET,2020-12-07,01:26PM,15 Largest Insurance Companies in the World,0.0,1.0,0.0,0.0
81,MET,2020-12-04,11:31AM,Why Is MetLife (MET) Up 16% Since Last Earnings Report?,0.0,1.0,0.0,0.0
82,MET,2020-12-02,11:00AM,Short-Term Woes Could Yield Long-Term Wins for Alert Office Investors,0.184,0.443,0.373,0.4588
83,MET,2020-11-24,10:57AM,MetLife's (MET) Business Restructuring on Track for Efficiency,0.0,0.737,0.263,0.3612
84,MET,2020-11-23,11:09AM,Why SmileDirectClub Stock Is Jumping Today,0.0,1.0,0.0,0.0
85,MET,2020-11-20,11:51AM,Exclusive: Zurich Insurance nears $4 billion deal for MetLife unit - sources,0.0,0.87,0.13,0.128
86,MET,2020-11-18,08:30AM,MetLife Foundation Provides $4 Million in Grants to Support Ongoing COVID-19 Relief Efforts,0.0,0.565,0.435,0.7717
87,MET,2020-11-16,04:15PM,MetLife Declares Fourth Quarter 2020 Preferred Stock Dividends,0.0,1.0,0.0,0.0
88,MET,2020-11-16,08:30AM,MetLife Named to 2020 Dow Jones Sustainability Index,0.0,1.0,0.0,0.0
89,MET,2020-11-16,07:00AM,What Is A Dividend? Plus The 5 Best Dividend Stocks Now,0.0,0.656,0.344,0.6369
90,MET,2020-11-11,09:50AM,Analyzing MetLife's Unusual Options Activity,0.0,1.0,0.0,0.0
91,MET,2020-11-11,08:30AM,MetLife Recognized as Military Friendly Employer Ninth Year in a Row,0.0,0.738,0.262,0.4939
92,MET,2020-11-10,03:00PM,"Brighthouse Financial, Inc. -- Moodys rates Brighthouse Financials preferred stock at Ba2(hyb); stable outlook",0.0,0.855,0.145,0.296
93,MET,2020-11-09,10:33AM,"Most Plan Sponsors Not Expecting Delays in Future Pension Buy Out Activity Due to COVID-19, MetLife Poll Finds",0.0,1.0,0.0,0.0
94,MET,2020-11-06,08:27AM,Preferred-Stock Yields Are Dropping. Banks Are Taking Advantage.,0.0,0.778,0.222,0.25
95,MET,2020-11-05,03:00PM,Metlife Inc (MET) Q3 2020 Earnings Call Transcript,0.0,1.0,0.0,0.0
96,MET,2020-11-05,12:13PM,MetLife Profit Tops Forecast on Rising Private Equity Income,0.0,0.53,0.47,0.7351
97,MET,2020-11-05,10:50AM,MetLife (MET) Earnings and Revenues Beat Estimates in Q3,0.0,1.0,0.0,0.0
98,MET,2020-11-04,05:55PM,MetLife (MET) Surpasses Q3 Earnings and Revenue Estimates,0.0,1.0,0.0,0.0
99,MET,2020-11-04,04:15PM,MetLife CFO John McCallion Provides Third Quarter 2020 Financial Update Video,0.0,1.0,0.0,0.0
