,ticker,date,time,headline,neg,neu,pos,compound
0,MRO,2021-04-14,07:45AM,"U.S. Shale Oil Output Rising, Permian to Hit 1-Year High",0.0,1.0,0.0,0.0
1,MRO,2021-04-06,07:24AM,"The Zacks Analyst Blog Highlights: Marathon Oil, Occidental Petroleum, Diamondback Energy, EOG Resources and Devon Energy",0.0,0.769,0.231,0.4939
2,MRO,2021-04-06,06:45AM,What Kind Of Shareholders Hold The Majority In Marathon Oil Corporation's (NYSE:MRO) Shares?,0.0,0.845,0.155,0.296
3,MRO,2021-04-06,05:47AM,"Oil & Gas Stock Roundup: Exxon & Conoco Q1 Updates, Pioneer's Acquisition & More",0.0,1.0,0.0,0.0
4,MRO,2021-04-05,08:11AM,These Are the Best Performing S&P 500 Energy Stocks of Q1,0.0,0.588,0.412,0.743
5,MRO,2021-04-01,12:44PM,Marathon Oil (MRO) to Redeem $500M Senior Notes to Ease Debt Load,0.167,0.667,0.167,0.0
6,MRO,2021-04-01,12:44PM,Callon (CPE) Adopts New ESG Initiatives to Reduce Emissions,0.0,0.825,0.175,0.1779
7,MRO,2021-04-01,08:16AM,OPEC+ Likely to Extend Production Cuts Today: Here's Why,0.202,0.642,0.156,-0.128
8,MRO,2021-03-30,05:07PM,Marathon Oil Announces $500 Million Gross Debt Reduction,0.483,0.517,0.0,-0.6808
9,MRO,2021-03-29,07:30AM,"The Zacks Analyst Blog Highlights: Marathon Oil, Occidental Petroleum, Diamondback Energy, EOG Resources and Devon Energy",0.0,0.769,0.231,0.4939
10,MRO,2021-03-24,11:30AM,Marathon Oil (MRO) Down 8.9% Since Last Earnings Report: Can It Rebound?,0.0,1.0,0.0,0.0
11,MRO,2021-03-23,04:09PM,"Baytex Energy Corp. -- Moody's affirms Baytex's ratings, changes outlook to stable",0.0,0.699,0.301,0.5106
12,MRO,2021-03-18,04:25PM,The SPY Was Down Today. Here's Why.,0.0,1.0,0.0,0.0
13,MRO,2021-03-17,05:01PM,Holli Ladhani elected to Marathon Oil Corporation Board of Directors,0.0,1.0,0.0,0.0
14,MRO,2021-03-16,12:55PM,"Energy sector suffers broad selloff, as NOV's stock tumble and crude oil decline weigh",0.342,0.553,0.106,-0.6908
15,MRO,2021-03-12,06:20AM,Should You Invest in the First Trust Natural Gas ETF (FCG)?,0.0,0.608,0.392,0.7003
16,MRO,2021-03-09,10:09AM,"How these teens are having fun in todays stock market, and, for the most part, making money",0.0,0.829,0.171,0.5106
17,MRO,2021-03-08,02:02PM,"Marathon Oil Stock Is a Winner, But How Much Higher Can It Go?",0.0,0.743,0.257,0.5859
18,MRO,2021-03-08,05:57AM,"The Zacks Analyst Blog Highlights: Diamondback Energy, EOG Resources, Marathon Oil, APA Corp and Hess Corp",0.0,0.877,0.123,0.2732
19,MRO,2021-03-05,08:17AM,Oil Soars on OPEC+ Surprise: Energy Stocks Post Big Gains,0.0,0.515,0.485,0.6808
20,MRO,2021-03-05,02:47AM,"Premarket Movers Friday - Broadcom, Marathon Oil, Tesla, Vroom",0.0,1.0,0.0,0.0
21,MRO,2021-03-04,12:01PM,Oil Prices Are Spiking. One Analyst Thinks the Rally Could End.,0.0,1.0,0.0,0.0
22,MRO,2021-03-01,08:00PM,3 Ways To Play The Next Commodity Supercycle,0.0,0.714,0.286,0.34
23,MRO,2021-03-01,07:51AM,5 Energy Stocks That Gave S&P 500 a Big Boost in February,0.0,0.625,0.375,0.5859
24,MRO,2021-02-26,06:22PM,"Two Stocks Turned $10,000 Into $21,109 In Two Months",0.0,1.0,0.0,0.0
25,MRO,2021-02-24,08:09AM,This Oil Stock Expects to Produce a Cash Flow Gusher in 2021 and Beyond,0.0,1.0,0.0,0.0
26,MRO,2021-02-23,07:01PM,Marathon Oil (MRO) Q4 2020 Earnings Call Transcript,0.0,1.0,0.0,0.0
27,MRO,2021-02-23,02:58PM,"Marathon Oil stock surges to pace S&P 500 gainers after upbeat earnings, outlook",0.0,1.0,0.0,0.0
28,MRO,2021-02-22,04:54PM,Marathon Oil: Q4 Earnings Insights,0.0,1.0,0.0,0.0
29,MRO,2021-02-22,04:32PM,Marathon Oil Announces 2021 Capital Budget and Reports Fourth Quarter and Full Year 2020 Results,0.0,1.0,0.0,0.0
30,MRO,2021-02-22,11:57AM,Oil at $75 a Barrel by Summer? Goldman Analysts Forecast Is Bullish for Energy Stocks.,0.0,0.861,0.139,0.2732
31,MRO,2021-02-22,11:50AM,"Energy sector ETF sees unanimous rally to 1-year high, led by Marathon Petroleum, as oil prices surges",0.0,0.884,0.116,0.2732
32,MRO,2021-02-21,07:16PM,Oil Advances as Markets Assess Texas Return Before OPEC+ Meet,0.0,1.0,0.0,0.0
33,MRO,2021-02-21,01:27AM,Precious Metals & Energy - Weekly Review and Calendar Ahead,0.0,0.508,0.492,0.7003
34,MRO,2021-02-19,10:42AM,Earnings Preview: Marathon Oil,0.0,1.0,0.0,0.0
35,MRO,2021-02-19,06:00AM,Texas Oil Patch Starts to Resume Operations After Cold Snap,0.0,1.0,0.0,0.0
36,MRO,2021-02-17,01:40AM,"Texas Freeze, Buffett Cuts Apple Stake, Retail Sales and IP - What's up in Markets",0.143,0.779,0.078,-0.25
37,MRO,2021-02-16,04:41PM,Marathon Oil Reschedules Fourth Quarter and Full-Year 2020 Earnings Release and Conference Call,0.0,1.0,0.0,0.0
38,MRO,2021-02-12,07:00PM,Energy Stocks Still Offer Plenty of Value,0.0,0.526,0.474,0.5423
39,MRO,2021-02-12,03:00PM,How High Can Oil Prices Go?,0.0,1.0,0.0,0.0
40,MRO,2021-02-12,11:44AM,Marathon Oil (MRO) to Post Q4 Earnings: What's in Store?,0.0,1.0,0.0,0.0
41,MRO,2021-02-11,10:36AM,"Bitcoin Pop, Pot Stock Drop, Bumble Debut: 3 Things to Watch",0.189,0.811,0.0,-0.2732
42,MRO,2021-02-10,02:50PM,"Oil Prices Are Bound to Fall, Government Agency Predicts. Heres Why.",0.0,1.0,0.0,0.0
43,MRO,2021-02-10,12:31PM,Analysts Estimate Marathon Oil (MRO) to Report a Decline in Earnings: What to Look Out for,0.0,1.0,0.0,0.0
44,MRO,2021-02-10,05:33AM,"The Zacks Analyst Blog Highlights: Marathon Oil, Occidental Petroleum, Apache Corp, Hess Corp and Chevron",0.0,1.0,0.0,0.0
45,MRO,2021-02-09,11:30AM,Has Marathon Oil (MRO) Outpaced Other Oils-Energy Stocks This Year?,0.0,1.0,0.0,0.0
46,MRO,2021-02-09,08:00AM,Energy Names Take Off as Oil Returns to Pre-Pandemic Levels,0.0,0.811,0.189,0.2732
47,MRO,2021-02-08,02:03PM,"Marathon Oil, Occidental Petroleum stocks soar to lead energy sector to broad gains",0.0,0.71,0.29,0.5423
48,MRO,2021-02-05,12:26PM,5 Stocks That Are Most Sensitive to a Change in Oil Prices,0.0,1.0,0.0,0.0
49,MRO,2021-02-04,06:17PM,"Energy stocks and bonds shine after brutal slump, even as Biden moves to curb fossil fuels",0.203,0.693,0.104,-0.4588
50,MRO,2021-02-04,06:10PM,Marathon Oil Corporation -- Moody's withdraws Marathon Oil's P-3 commercial paper rating,0.0,1.0,0.0,0.0
51,MRO,2021-02-03,04:24AM,Would Shareholders Who Purchased Marathon Oil's (NYSE:MRO) Stock Three Years Be Happy With The Share price Today?,0.0,0.718,0.282,0.7096
52,MRO,2021-01-27,04:30PM,Marathon Oil Announces Executive Compensation Changes and GHG Emissions Intensity Reduction Initiatives,0.0,1.0,0.0,0.0
53,MRO,2021-01-27,01:12PM,Marathon Oil Corporation Declares Fourth Quarter 2020 Dividend,0.0,1.0,0.0,0.0
54,MRO,2021-01-18,10:07AM,4 US Integrated Oil Stocks Countering Industry Headwinds,0.0,1.0,0.0,0.0
55,MRO,2021-01-16,12:04PM,"Benzinga's Weekly Bulls And Bears: AMD, Marathon, Tesla, Uber, Walgreens And More",0.0,1.0,0.0,0.0
56,MRO,2021-01-14,04:41PM,U.S. Stock Indexes Slide Into the Red as Investors Look Ahead to Bidens Stimulus Address,0.0,1.0,0.0,0.0
57,MRO,2021-01-14,10:11AM,"Benzinga's Top Ratings Upgrades, Downgrades For January 14, 2021",0.0,0.816,0.184,0.2023
58,MRO,2021-01-12,11:03AM,"Marathon Oil Gets Upgrade Due To Higher Oil Prices, More Cash Return To Shareholders",0.0,1.0,0.0,0.0
59,MRO,2021-01-11,04:30PM,Brent Smolik elected to Marathon Oil Corporation Board of Directors,0.0,1.0,0.0,0.0
60,MRO,2021-01-08,08:30AM,Marathon Oil Appoints Kimberly Warnica Senior Vice President and General Counsel,0.0,1.0,0.0,0.0
61,MRO,2020-12-24,07:30AM,Energy Stocks Rally as U.S. Crude & Fuel Inventories Drop,0.417,0.432,0.151,-0.5719
62,MRO,2020-12-21,09:22PM,"Among This Year's Dogs, These 2 Could Hunt",0.0,1.0,0.0,0.0
63,MRO,2020-12-21,02:24PM,15 Largest Gas Companies in the US,0.0,1.0,0.0,0.0
64,MRO,2020-12-18,02:56AM,A Look At The Intrinsic Value Of Marathon Oil Corporation (NYSE:MRO),0.0,0.789,0.211,0.34
65,MRO,2020-12-15,05:29PM,Is MRO A Good Stock To Buy Now?,0.0,0.674,0.326,0.4404
66,MRO,2020-12-14,11:04AM,"The Zacks Analyst Blog Highlights: Pfizer, BioNTech, Occidental Petroleum, Devon Energy, Diamondback Energy, Baker Hughes and Marathon Oil",0.0,0.792,0.208,0.4939
67,MRO,2020-12-04,11:31AM,Marathon Oil (MRO) Up 44.3% Since Last Earnings Report: Can It Continue?,0.0,1.0,0.0,0.0
68,MRO,2020-12-04,11:01AM,Heres the Technical Roadmap for Marathon Oil Speculators,0.0,1.0,0.0,0.0
69,MRO,2020-11-23,02:47PM,"Energy sector sees broad, sharp gains as crude oil prices head for 3-month high",0.193,0.573,0.234,-0.0516
70,MRO,2020-11-20,09:02AM,"The Zacks Analyst Blog Highlights: Devon Energy, Baker Hughes, Diamondback Energy, Marathon Oil and Chevron",0.0,0.756,0.244,0.4939
71,MRO,2020-11-19,01:53PM,Tesla Stock Is Going Into the S&P 500. Heres How the Index Might Make Room for It.,0.0,1.0,0.0,0.0
72,MRO,2020-11-16,10:13AM,Understanding Marathon Oil's Ex-Dividend Date,0.0,1.0,0.0,0.0
73,MRO,2020-11-12,06:43AM,Don't Race Out To Buy Marathon Oil Corporation (NYSE:MRO) Just Because It's Going Ex-Dividend,0.0,1.0,0.0,0.0
74,MRO,2020-11-05,10:32PM,Marathon Oil (MRO) Q3 2020 Earnings Call Transcript,0.0,1.0,0.0,0.0
75,MRO,2020-11-05,09:52AM,"Stock Market News for Nov 5, 2020",0.0,1.0,0.0,0.0
76,MRO,2020-11-05,08:06AM,"Marathon Oil's (MRO) Q3 Loss in Line, Revenues Top Estimates",0.19,0.661,0.149,-0.128
77,MRO,2020-11-05,12:30AM,Marathon Oil Posts Fourth Straight Loss in Q3 as COVID-19 Pandemic Hit Demand,0.242,0.637,0.121,-0.2263
78,MRO,2020-11-04,05:25PM,"Marathon Oil (MRO) Reports Q3 Loss, Tops Revenue Estimates",0.183,0.556,0.262,0.25
79,MRO,2020-11-04,04:19PM,Recap: Marathon Oil Q3 Earnings,0.0,1.0,0.0,0.0
80,MRO,2020-11-04,04:01PM,Marathon Oil Reports Third Quarter 2020 Results,0.0,1.0,0.0,0.0
81,MRO,2020-11-02,10:00AM,Evergy (EVRG) to Report Q3 Earnings: What's in the Offing?,0.0,1.0,0.0,0.0
82,MRO,2020-11-02,08:46AM,EOG Resources (EOG) to Report Q3 Earnings: What's in Store?,0.0,1.0,0.0,0.0
83,MRO,2020-10-30,01:23PM,Factors Likely to Decide Apache's (APA) Fate in Q3 Earnings,0.0,1.0,0.0,0.0
84,MRO,2020-10-30,01:12PM,Marathon Oil (MRO) to Post Q3 Earnings: What's in Store?,0.0,1.0,0.0,0.0
85,MRO,2020-10-30,12:47PM,"Amid An Oil Industry Slide, BP Stands for Bad Play",0.252,0.576,0.173,-0.2732
86,MRO,2020-10-29,12:15PM,Things to Know Before Marathon Petroleum's (MPC) Q3 Earnings,0.0,1.0,0.0,0.0
87,MRO,2020-10-29,12:06PM,How is Williams Companies (WMB) Placed Ahead of Q3 Earnings?,0.0,1.0,0.0,0.0
88,MRO,2020-10-29,12:01PM,What's in the Offing for Diamondback (FANG) Q3 Earnings?,0.0,1.0,0.0,0.0
89,MRO,2020-10-29,08:21AM,4 Energy Stocks Poised to Trump Earnings Estimates in Q3,0.0,0.631,0.369,0.4767
90,MRO,2020-10-28,12:32PM,Marathon Oil (MRO) Expected to Beat Earnings Estimates: Can the Stock Move Higher?,0.0,1.0,0.0,0.0
91,MRO,2020-10-27,03:36PM,Oil-Hedging Strategies Show Companies Remain Wary of Another Plunge,0.0,1.0,0.0,0.0
92,MRO,2020-10-26,10:50AM,Energy stocks take a dive as crude oil prices fall to 3-week low,0.343,0.533,0.124,-0.5719
93,MRO,2020-10-20,10:07AM,Are Institutions Heavily Invested In Marathon Oil Corporation's (NYSE:MRO) Shares?,0.0,0.804,0.196,0.296
94,MRO,2020-10-17,01:55AM,Marathon Oil Corporation -- Moody's announces completion of a periodic review of ratings of Marathon Oil Corporation,0.0,1.0,0.0,0.0
95,MRO,2020-10-16,05:01AM,Marathon Oil is Cheap But Only if Crude Prices Go Higher From Here,0.236,0.764,0.0,-0.5719
96,MRO,2020-10-15,10:09AM,Is the Options Market Predicting a Spike in Marathon Oil (MRO) Stock?,0.0,1.0,0.0,0.0
97,MRO,2020-10-01,05:16PM,"Marathon Oil reinstates dividend, says balance sheet is 'solid'",0.0,1.0,0.0,0.0
98,MRO,2020-10-01,05:00PM,Marathon Oil Reinstates Base Dividend and Reduces Debt,0.263,0.737,0.0,-0.3612
99,MRO,2020-09-30,05:00PM,"Marathon Oil Announces Pricing Of Tender Offer For Up To $500,000,000 Of Its 2.800% Senior Notes Due 2022",0.0,1.0,0.0,0.0
