,ticker,date,time,headline,neg,neu,pos,compound
0,PNC,2021-04-13,08:43AM,PNC to delay overdraft fees for at least a day with 'virtual wallet' customers,0.161,0.839,0.0,-0.3182
1,PNC,2021-04-13,07:15AM,PNC Launches Low Cash Mode(SM) To Address $17 Billion In Industry Overdraft Fees,0.149,0.851,0.0,-0.2732
2,PNC,2021-04-09,12:30PM,"The PNC Financial Services Group, Inc (PNC) Earnings Expected to Grow: What to Know Ahead of Next Week's Release",0.0,1.0,0.0,0.0
3,PNC,2021-04-09,09:22AM,Harris Williams Advises DSI Logistics on its Sale to Pilot Freight Services,0.0,1.0,0.0,0.0
4,PNC,2021-04-08,05:39PM,Progress Residential 2021-SFR2 Trust -- Moody's assigns definitive ratings to Progress Residential 2021-SFR2 Trust,0.0,0.45,0.55,0.9042
5,PNC,2021-04-07,09:11AM,Harris Williams Advises AIT Worldwide Logistics on its Recapitalization by The Jordan Company,0.0,1.0,0.0,0.0
6,PNC,2021-04-06,03:16PM,Is PNC Stock A Buy or Sell?,0.0,1.0,0.0,0.0
7,PNC,2021-04-06,10:11AM,Progress Residential 2021-SFR3 Trust -- Moody's assigns provisional ratings to Progress Residential 2021-SFR3 Trust,0.0,0.45,0.55,0.9042
8,PNC,2021-04-05,10:10PM,"BXMT 2021-FL4, Ltd. -- Moody's assigns a provisional rating to one class of notes to be issued by BXMT 2021-FL4, Ltd.",0.0,1.0,0.0,0.0
9,PNC,2021-04-05,09:56PM,"BXMT 2021-FL4, Ltd. -- Moody's assigns a provisional rating to one class of notes to be issued by BXMT 2021-FL4, Ltd.",0.0,1.0,0.0,0.0
10,PNC,2021-04-05,09:02AM,3 reasons Goldman Sachs is super bullish on bank stocks,0.0,0.672,0.328,0.5994
11,PNC,2021-04-01,01:05PM,PNC Declares Dividend Of $1.15 On Common Stock,0.0,1.0,0.0,0.0
12,PNC,2021-03-30,10:49AM,Harris Williams Advises Opus 2 on its Pending Sale to Astorg Partners,0.0,1.0,0.0,0.0
13,PNC,2021-03-30,08:05AM,PNC First Bank To Offer Two Bank On Certified Accounts,0.0,1.0,0.0,0.0
14,PNC,2021-03-24,10:00AM,Is The PNC Financial Services (PNC) a Great Stock for Value Investors?,0.0,0.581,0.419,0.7579
15,PNC,2021-03-23,11:46AM,Harris Williams Advises Learn on Demand Systems on its Investment from Shamrock Capital,0.111,0.889,0.0,-0.128
16,PNC,2021-03-19,09:40AM,Progress Residential 2021-SFR2 Trust -- Moody's assigns provisional ratings to Progress Residential 2021-SFR2 Trust,0.0,0.45,0.55,0.9042
17,PNC,2021-03-19,08:46AM,"PNC Announces Redemption Of 2.150 Percent Senior Bank Notes Due April 29, 2021",0.0,1.0,0.0,0.0
18,PNC,2021-03-18,09:28AM,Harris Williams Advises Rohrer Corporation on its Sale to Wellspring Capital Management,0.0,0.815,0.185,0.3612
19,PNC,2021-03-16,04:08PM,Harris Williams Advises American Veterinary Group on its Sale to Oak Hill Capital,0.0,1.0,0.0,0.0
20,PNC,2021-03-11,04:19AM,"Have Insiders Been Buying The PNC Financial Services Group, Inc. (NYSE:PNC) Shares?",0.0,0.833,0.167,0.296
21,PNC,2021-03-11,03:24AM,3 Regional Banking Stocks Gaining After House Passes $1.9 Trillion Relief Bill,0.0,0.604,0.396,0.7096
22,PNC,2021-03-10,06:55PM,Star 2021-SFR1 -- Moody's assigns definitive ratings to STAR 2021-SFR1 Trust,0.0,0.752,0.248,0.5106
23,PNC,2021-03-10,08:31AM,The PNC Financial Services Group Announces First Quarter 2021 Earnings Conference Call and Virtual-Only Annual Shareholders Meeting Details,0.0,1.0,0.0,0.0
24,PNC,2021-03-04,08:46AM,"Harris Williams Advises GSL Solutions, Inc. on its Sale to BD",0.0,0.855,0.145,0.1779
25,PNC,2021-03-04,08:30AM,Harris Williams Advises TricorBraun on its Sale to Ares Management and Ontario Teachers Pension Plan Board,0.0,1.0,0.0,0.0
26,PNC,2021-03-03,10:47AM,PNC Asset Management Group Names Amanda Agati Chief Investment Officer; Mark McGlone To Retire,0.0,0.839,0.161,0.3612
27,PNC,2021-03-03,09:25AM,'Services will be the big driver of growth in the job market: PNC chief economist,0.0,0.843,0.157,0.3818
28,PNC,2021-03-02,11:44AM,Harris Williams Advises International Sports Sciences Association (ISSA) on its Sale to Tailwind Capital,0.0,1.0,0.0,0.0
29,PNC,2021-03-01,07:10AM,"With Small Businesses Permanently Changed By The Pandemic, Owners Looking To Vaccine-Driven Recovery, PNC Survey Shows",0.0,1.0,0.0,0.0
30,PNC,2021-02-26,06:38PM,Progress Residential 2021-SFR1 Trust -- Moody's assigns definitive ratings to Progress Residential 2021-SFR1 Trust,0.0,0.45,0.55,0.9042
31,PNC,2021-02-25,09:30AM,Harris Williams Advises Chequers Capital on its Acquisition of 7days,0.0,1.0,0.0,0.0
32,PNC,2021-02-25,09:00AM,Early Warning Services and The Clearing House Now Enable Zelle® Payments on the RTP® Network,0.146,0.854,0.0,-0.34
33,PNC,2021-02-23,08:52AM,Harris Williams Advises Altasciences on its Pending Sale to Novo Holdings A/S,0.0,1.0,0.0,0.0
34,PNC,2021-02-22,01:25PM,Harris Williams Enhances Senior Capabilities Across the Firm with 26 Promotions,0.0,1.0,0.0,0.0
35,PNC,2021-02-17,01:25PM,Harris Williams Advises Kaizen Collision Center on its Growth Equity Investment from LNC Partners,0.146,0.702,0.152,0.0258
36,PNC,2021-02-17,09:47AM,JPMorgan (JPM) Breaks Out to All-Time High,0.0,1.0,0.0,0.0
37,PNC,2021-02-17,09:13AM,Regional Bank ETFs Set Multi-Year High as Bond Yields Surge,0.0,1.0,0.0,0.0
38,PNC,2021-02-17,06:54AM,"Warren Buffett's favorite indicator is at a dangerous level, but he just bought these stocks anyway",0.12,0.762,0.117,-0.0129
39,PNC,2021-02-12,09:02AM,"Harris Williams Advises Xirgo Technologies, LLC on its Pending Sale to Sensata Technologies, Inc.",0.0,1.0,0.0,0.0
40,PNC,2021-02-10,07:33AM,PNC Executives To Speak At Credit Suisse Virtual Conference,0.0,0.755,0.245,0.3818
41,PNC,2021-02-05,09:49AM,"PNC Financial Services Group, Inc. -- Moody's announces completion of a periodic review of ratings of PNC Financial Services Group, Inc.",0.0,1.0,0.0,0.0
42,PNC,2021-02-04,04:32PM,"BBVA USA Bancshares, Inc. -- Moody's announces completion of a periodic review of ratings of BBVA USA Bancshares, Inc.",0.0,1.0,0.0,0.0
43,PNC,2021-01-21,12:25PM,Harris Williams Advises Continental Batteries on its Sale to H.I.G. Capital,0.0,1.0,0.0,0.0
44,PNC,2021-01-19,09:42AM,"Company News for Jan 19, 2021",0.0,1.0,0.0,0.0
45,PNC,2021-01-17,03:19AM,"PNC Financial Surpasses 4Q Street Estimates, Shares Decline",0.371,0.46,0.169,-0.5622
46,PNC,2021-01-15,05:30PM,RBC's Gerard Cassidy on his biggest takeaways from bank earnings,0.0,1.0,0.0,0.0
47,PNC,2021-01-15,10:00AM,P/E Ratio Insights for PNC Financial Services,0.0,1.0,0.0,0.0
48,PNC,2021-01-15,09:43AM,Big banks Q4 earnings beat: can trading remain this strong in 2021?,0.0,0.739,0.261,0.596
49,PNC,2021-01-15,09:15AM,"The PNC Financial Services Group, Inc. to Host Earnings Call",0.0,1.0,0.0,0.0
50,PNC,2021-01-15,09:08AM,PNC Financial (PNC) Q4 Earnings Beat Estimates on Lower Costs,0.196,0.804,0.0,-0.296
51,PNC,2021-01-15,08:55AM,"Tesla, Wells Fargo, JPMorgan, Citigroup - Friday's Premarket Movers",0.0,0.778,0.222,0.25
52,PNC,2021-01-15,08:55AM,"PNC Beats Estimates, Recaptures Loan-Loss Provision",0.0,1.0,0.0,0.0
53,PNC,2021-01-15,08:06AM,What JPMorgan Earnings Say About the Economy,0.0,1.0,0.0,0.0
54,PNC,2021-01-15,07:02AM,PNC Financial Services: Q4 Earnings Insights,0.0,1.0,0.0,0.0
55,PNC,2021-01-15,06:50AM,"PNC Reports Full Year 2020 Net Income Of $7.6 Billion, $16.96 Diluted EPS",0.0,1.0,0.0,0.0
56,PNC,2021-01-14,04:16PM,5 Banks Trading With Low Price-Earnings Ratios,0.296,0.704,0.0,-0.2732
57,PNC,2021-01-14,10:20AM,Understanding PNC Financial Services Gr's Ex-Dividend Date,0.0,1.0,0.0,0.0
58,PNC,2021-01-14,10:16AM,Preview: PNC Financial Services Gr's Earnings,0.0,1.0,0.0,0.0
59,PNC,2021-01-14,08:39AM,Will Mortgage Banking Support Wells Fargo (WFC) Q4 Earnings?,0.0,0.598,0.402,0.5719
60,PNC,2021-01-14,08:34AM,Can Q4 Earnings Propel PNC Financial (PNC) Stock to New Highs?,0.0,1.0,0.0,0.0
61,PNC,2021-01-13,01:54PM,Big banks kick off earnings season on Friday  here's what to expect,0.0,1.0,0.0,0.0
62,PNC,2021-01-13,08:52AM,Why PNC Financial Services (PNC) Might Surprise This Earnings Season,0.0,0.811,0.189,0.2732
63,PNC,2021-01-12,08:56AM,Bank of America stock rallies after analyst says it's time to buy,0.0,1.0,0.0,0.0
64,PNC,2021-01-10,12:30PM,"Big banks kick off Q4 earnings season, retail sales: What to know in the week ahead",0.0,1.0,0.0,0.0
65,PNC,2021-01-10,01:49AM,"The PNC Financial Services Group, Inc. (NYSE:PNC) Pays A US$1.15 Dividend In Just Four Days",0.0,1.0,0.0,0.0
66,PNC,2021-01-07,12:16PM,Harris Williams Advises TricorBraun on its Pending Sale to Ares Management Corporation and Ontario Teachers Pension Plan Board,0.0,1.0,0.0,0.0
67,PNC,2021-01-07,07:15AM,2 Dividend Stocks to Supplement Your Social Security,0.0,0.714,0.286,0.34
68,PNC,2021-01-06,02:25PM,Bank Stocks Are a Winner in the Georgia Vote,0.0,0.648,0.352,0.5859
69,PNC,2021-01-06,09:40AM,PNC Financial Services Declares Dividend; Yield Is 3.1%,0.0,1.0,0.0,0.0
70,PNC,2021-01-05,11:26AM,PNC Declares Dividend Of $1.15 On Common Stock,0.0,1.0,0.0,0.0
71,PNC,2021-01-05,10:08AM,Harris Williams Advises LYNX Franchising on Its Sale to MidOcean Partners,0.0,1.0,0.0,0.0
72,PNC,2021-01-04,01:05PM,Harris Williams Advises Brady Industries on its Sale to Individual FoodService,0.0,1.0,0.0,0.0
73,PNC,2021-01-04,11:39AM,Harris Williams Advises Knox Lane on its Strategic Investment in Fingerpaint,0.0,1.0,0.0,0.0
74,PNC,2020-12-25,07:00AM,The Largest Bank Acquisitions in 2020 Had These 4 Things in Common,0.0,1.0,0.0,0.0
75,PNC,2020-12-23,02:47PM,Harris Williams Advises Inmark Packaging on its Investment from Kelso & Company,0.0,1.0,0.0,0.0
76,PNC,2020-12-23,01:42PM,Harris Williams Advises FitzMark on its Majority Recapitalization by Calera Capital,0.0,1.0,0.0,0.0
77,PNC,2020-12-22,06:03PM,Harris Williams Advises TractManager on its Sale to symplr,0.0,1.0,0.0,0.0
78,PNC,2020-12-22,07:56AM,Harris Williams Advises Inspired Pet Nutrition Limited on its Pending Sale to CapVest Partners LLP,0.105,0.718,0.177,0.3182
79,PNC,2020-12-21,01:35PM,Is PNC A Good Stock To Buy According To Hedge Funds?,0.0,0.756,0.244,0.4404
80,PNC,2020-12-18,08:19PM,Banks Have Begun to Merge Again. Next Year Could See Even More Deals.,0.0,1.0,0.0,0.0
81,PNC,2020-12-18,04:31PM,Fed loosens restrictions on bank share buybacks after second stress test,0.2,0.643,0.157,-0.1531
82,PNC,2020-12-18,02:01AM,Why M&A is set to continue its hot streak in 2021,0.0,1.0,0.0,0.0
83,PNC,2020-12-15,02:44PM,Wall Street Likes the Huntington-TCF Deal. Expect More Regional Bank Marriages in 2021.,0.0,0.811,0.189,0.4215
84,PNC,2020-12-15,11:10AM,"Harris Williams Advises Appalachian Railcar Services, LLC on its Sale to Cathcart Rail, LLC",0.0,1.0,0.0,0.0
85,PNC,2020-12-11,08:19AM,"PNC Announces Redemption of 2.500 Percent Senior Bank Notes Due January 22, 2021",0.0,1.0,0.0,0.0
86,PNC,2020-12-11,07:00AM,"How Much Of The PNC Financial Services Group, Inc. (NYSE:PNC) Do Institutions Own?",0.0,1.0,0.0,0.0
87,PNC,2020-12-10,07:45AM,The PNC Financial Services Group Announces Fourth Quarter And Full Year Earnings Conference Call Details,0.0,1.0,0.0,0.0
88,PNC,2020-12-02,08:19AM,Harris Williams Advises Midwest Dental on its Sale to Smile Brands Inc.,0.0,0.815,0.185,0.3612
89,PNC,2020-12-01,11:21AM,Harris Williams Advises FullSpeed Automotive on its Sale to MidOcean Partners,0.0,1.0,0.0,0.0
90,PNC,2020-11-28,04:27PM,10 Best Bank Stocks To Buy Right Now,0.0,0.625,0.375,0.6369
91,PNC,2020-11-27,11:23AM,Shares of Spains Banco de Sabadell Tumble After Merger Talks With BBVA Are Called Off,0.0,0.864,0.136,0.296
92,PNC,2020-11-25,09:54AM,Price Over Earnings Overview: PNC Financial Services,0.0,1.0,0.0,0.0
93,PNC,2020-11-25,08:15AM,Why Catherine Faddis Is Bullish On PNC Financial Services,0.0,1.0,0.0,0.0
94,PNC,2020-11-24,08:40AM,PNC Executives To Speak At Goldman Sachs Virtual Conference,0.0,1.0,0.0,0.0
95,PNC,2020-11-23,03:08PM,"PNC Stock Warrants an Upgrade After BBVA Deal, but Its Lukewarm",0.0,1.0,0.0,0.0
96,PNC,2020-11-20,06:10AM,BBVA USA Is a Bad Bank. How Will It Help PNC?,0.246,0.563,0.19,-0.2023
97,PNC,2020-11-20,12:24AM,"StockBeat: Surge, Schmurge: The Rotation Trade Is Intact",0.0,0.795,0.205,0.2023
98,PNC,2020-11-18,01:55PM,"Banco Bilbao Vizcaya Argentaria, S.A. -- Moody's - Sale of US unit will only boost BBVAs capital buffers temporarily, as buybacks and strategic options are on the table",0.0,0.906,0.094,0.4019
99,PNC,2020-11-18,09:47AM,What Gives Moderna's Coronavirus Vaccine an Edge?,0.0,1.0,0.0,0.0
