,ticker,date,time,headline,neg,neu,pos,compound
0,SNAP,2021-04-13,05:14PM,Buy Netflix and Snap Stock Before Earnings for Big Growth Upside?,0.0,0.794,0.206,0.3818
1,SNAP,2021-04-13,03:34PM,Top Snap Shareholders,0.0,0.526,0.474,0.2023
2,SNAP,2021-04-13,09:00AM,The Los Angeles County Museum of Art (LACMA) and Snap Inc. Launch LACMA × Snapchat: Monumental Perspectives,0.0,1.0,0.0,0.0
3,SNAP,2021-04-12,05:50PM,Snap (SNAP) Dips More Than Broader Markets: What You Should Know,0.0,1.0,0.0,0.0
4,SNAP,2021-04-11,08:28AM,"Analysts Upgraded AMC, Snap, United Airlines And Tesla In The Past Week",0.0,0.797,0.203,0.4215
5,SNAP,2021-04-10,09:08AM,Why Snap Inc. Shares Could Leave Investors Ghosted,0.128,0.638,0.234,0.25
6,SNAP,2021-04-08,07:00AM,"Is Snap Stock A Buy Right Now? Here's What Earnings, Charts Show",0.0,1.0,0.0,0.0
7,SNAP,2021-04-08,02:54AM,India Lands Yet Another $1 Billion-Plus Startup in Mohalla,0.0,1.0,0.0,0.0
8,SNAP,2021-04-08,02:54AM,Snapchat Among Backers Of Indian Social Media Platform In $502M Funding Round,0.0,1.0,0.0,0.0
9,SNAP,2021-04-08,12:58AM,"India's ShareChat raises $502 million from Snap, Twitter, others; valuation tops $2 billion",0.0,0.784,0.216,0.5106
10,SNAP,2021-04-07,04:40PM,"MrBeast Signs Exclusive Snapchat, Facebook Video Distribution Pact With Jellysmack",0.0,0.857,0.143,0.128
11,SNAP,2021-04-07,04:25PM,Snap stock up more than 20% in a week amid efforts to find new uses for Snapchat,0.0,1.0,0.0,0.0
12,SNAP,2021-04-07,04:10PM,Snap Inc. Announces Date of First Quarter 2021 Results Conference Call,0.0,1.0,0.0,0.0
13,SNAP,2021-04-07,12:00PM,3 Stocks to Invest in Augmented Reality,0.0,1.0,0.0,0.0
14,SNAP,2021-04-06,04:35PM,US STOCKS-S&P 500 slips but closes near record level,0.0,1.0,0.0,0.0
15,SNAP,2021-04-06,01:04PM,Why Snap Analyst Is Confident of Multiple Years Of 'Elevated Growth',0.0,0.608,0.392,0.7003
16,SNAP,2021-04-06,12:13PM,A Trio of Stock Picks for Growth-Focused Investors,0.0,1.0,0.0,0.0
17,SNAP,2021-04-06,12:11PM,US STOCKS-S&P 500 resumes record run on economic rebound hopes,0.0,0.763,0.237,0.4215
18,SNAP,2021-04-06,10:37AM,"Illumina expects to top $1 billion in revenue, Snap gets upgrade",0.0,0.847,0.153,0.2023
19,SNAP,2021-04-06,10:21AM,US STOCKS-Wall St treads water after record rally on economic rebound hopes,0.0,0.797,0.203,0.4215
20,SNAP,2021-04-06,08:50AM,"5 Top Stock Gainers for Tuesday: Mudrick Capital, Snap",0.0,0.795,0.205,0.2023
21,SNAP,2021-04-06,08:47AM,US STOCKS-Wall St set for muted open after record rally on recovery hopes,0.0,0.811,0.189,0.4215
22,SNAP,2021-04-06,04:36AM,"Premarket Movers Tuesday - Illumina, ViacomCBS, Snap, Acadia",0.0,1.0,0.0,0.0
23,SNAP,2021-04-05,09:14AM,Will Snap Avoid or Repeat GoPro's Fatal Mistakes?,0.621,0.379,0.0,-0.802
24,SNAP,2021-04-05,08:00AM,Why Snap Stock Fell 20% in March,0.0,1.0,0.0,0.0
25,SNAP,2021-04-05,01:33AM,Snapchat Risks Apple's Wrath With Attempts At Skirting New Privacy Rules: FT,0.16,0.84,0.0,-0.2732
26,SNAP,2021-04-04,01:00PM,EXCLUSIVE: How Snapchat AR Ignited Christian Diors B27 Launch,0.0,0.782,0.218,0.3034
27,SNAP,2021-04-02,05:55AM,These 3 Robinhood Stocks Could Double Your Money in 2021,0.0,1.0,0.0,0.0
28,SNAP,2021-04-01,08:00PM,Snap looked at ways of circumventing Apples new privacy rules,0.0,1.0,0.0,0.0
29,SNAP,2021-04-01,10:22AM,Building True Connections Via TikTok and Snapchat,0.0,0.682,0.318,0.4215
30,SNAP,2021-04-01,06:20AM,2 Incredible Stocks That Could Double Your Money in a Post-Pandemic World,0.0,1.0,0.0,0.0
31,SNAP,2021-03-31,08:48PM,2 Big Growth Stocks to Buy on the Dip for Q2 and Beyond,0.0,0.809,0.191,0.3818
32,SNAP,2021-03-31,09:40AM,People are making lots of money off of the big lie: Ken Burns,0.0,1.0,0.0,0.0
33,SNAP,2021-03-31,04:41AM,"Snapchat Parent To Launch AR Glasses And A Drone, Furthering Hardware Push: Report",0.0,1.0,0.0,0.0
34,SNAP,2021-03-29,08:32AM,"Thinking About Buying Stock Or Options In Amazon, Nio, Snap Or Apple?",0.0,0.866,0.134,0.1779
35,SNAP,2021-03-29,05:00AM,"Zoom, Other WFH Tech Darlings, Risk User Exodus as the World Reopens",0.137,0.654,0.209,0.2732
36,SNAP,2021-03-26,03:21PM,Number of people in group video and audio calls on Messenger nearly doubles over past year,0.0,0.92,0.08,0.0772
37,SNAP,2021-03-25,05:50PM,Snap (SNAP) Outpaces Stock Market Gains: What You Should Know,0.0,0.789,0.211,0.34
38,SNAP,2021-03-25,09:56AM,UK's competition regulator sounds alarm on Facebook's $400m Giphy buy,0.211,0.789,0.0,-0.34
39,SNAP,2021-03-24,05:22PM,"Snap Inc. Has Acquired Fit Analytics, Adding Size Technology to its Social Shopping Capabilities",0.0,0.839,0.161,0.3612
40,SNAP,2021-03-24,09:25AM,Snap Takes Aim at Pinterest With its Latest E-Commerce Acquisition,0.0,1.0,0.0,0.0
41,SNAP,2021-03-24,06:00AM,Microsoft CEO Hunts Anew for Creator Hub After TikTok Bid Fails,0.219,0.781,0.0,-0.4215
42,SNAP,2021-03-22,02:08PM,2 Highflying Social Media Stocks Just Got Downgraded. Why Their Runs Could Be Over.,0.0,1.0,0.0,0.0
43,SNAP,2021-03-22,01:25PM,Is It Too Late to Buy Snap (SNAP) Stock?,0.0,1.0,0.0,0.0
44,SNAP,2021-03-22,12:34PM,"Why Booking Holdings Is A Reopening Winner  And Snap, Pinterest Are Not",0.0,0.725,0.275,0.5859
45,SNAP,2021-03-22,10:29AM,"Snap, Pinterest stocks get downgraded at Bank of America",0.0,1.0,0.0,0.0
46,SNAP,2021-03-22,08:33AM,Snap Under Pressure After Downgrade,0.355,0.645,0.0,-0.296
47,SNAP,2021-03-22,06:36AM,Snap Falls on Downgrade on Valuation Concerns,0.0,1.0,0.0,0.0
48,SNAP,2021-03-21,11:44AM,Top 10 High Growth Companies Hedge Funds Are Buying,0.0,0.614,0.386,0.5267
49,SNAP,2021-03-21,10:28AM,Is SNAP Stock A Buy or Sell?,0.0,1.0,0.0,0.0
50,SNAP,2021-03-20,08:09AM,These 3 Stocks Have Doubled and Still Have Room to Grow,0.0,1.0,0.0,0.0
51,SNAP,2021-03-20,06:00AM,Google CFO on equality in the workplace: Society isnt where it needs to be,0.0,1.0,0.0,0.0
52,SNAP,2021-03-18,06:38PM,Snapchat Signals Fashion Ambitions With Latest Acquisition,0.0,1.0,0.0,0.0
53,SNAP,2021-03-18,01:26PM,Influencers with Andy Serwer: Ruth Porat,0.0,1.0,0.0,0.0
54,SNAP,2021-03-18,10:25AM,"SNAP Acquires Fit Analytics to Expand in Fashion, E-Commerce",0.0,0.593,0.407,0.5859
55,SNAP,2021-03-18,08:15AM,"Is Pinterest Stock A Buy Right Now? Here's What Earnings, Charts Show",0.0,1.0,0.0,0.0
56,SNAP,2021-03-17,02:18PM,Tiger Cub Billionaire Stephen Mandels Top 10 Stock Picks,0.0,0.816,0.184,0.2023
57,SNAP,2021-03-17,01:38PM,Should You Buy Snap (SNAP) Stock Before Its Too Late?,0.0,1.0,0.0,0.0
58,SNAP,2021-03-17,10:40AM,Snap Acquires Apparel-Sizing Analytics Firm to Boost Snapchat Shopping Features,0.0,0.769,0.231,0.4019
59,SNAP,2021-03-17,09:05AM,"Looking Good - Feeling Good: CEOs of lululemon athletica, Hapbee Technologies, Peloton Interactive and Snap, Discuss New Consumer Tech Innovation Driving Revenue Growth",0.0,0.576,0.424,0.8885
60,SNAP,2021-03-16,07:42PM,Samsung unveils A52 5G and A72 Galaxy smartphones  live updates,0.0,1.0,0.0,0.0
61,SNAP,2021-03-15,05:45PM,Snap (SNAP) Outpaces Stock Market Gains: What You Should Know,0.0,0.789,0.211,0.34
62,SNAP,2021-03-15,12:33PM,Stripe Founders Build $23 Billion Fortune With Top U.S. Startup,0.0,0.833,0.167,0.2023
63,SNAP,2021-03-12,07:30AM,"5 Top ""Winners Keep Winning"" Stocks",0.0,0.194,0.806,0.8074
64,SNAP,2021-03-11,10:01AM,UPDATE 1-Facebook to let content creators earn money from short-form videos,0.0,1.0,0.0,0.0
65,SNAP,2021-03-11,09:00AM,Facebook to Run More Ads on Shorter Videos to Chase TikTok,0.0,1.0,0.0,0.0
66,SNAP,2021-03-10,03:19PM,Facebook Asks Court to Toss U.S. Lawsuit Seeking Breakup,0.192,0.808,0.0,-0.2263
67,SNAP,2021-03-09,02:38PM,Snapchats Jared Grusd Buys $18 Million Beverly Hills Mansion,0.0,1.0,0.0,0.0
68,SNAP,2021-03-09,06:55AM,Instagram Testing Reels Integration On Facebook Indian Accounts: Reuters,0.0,1.0,0.0,0.0
69,SNAP,2021-03-09,12:18AM,Instagram to Integrate Reels Into Facebook Social Network,0.0,1.0,0.0,0.0
70,SNAP,2021-03-06,11:31AM,Why Is Snap (SNAP) Down 1.5% Since Last Earnings Report?,0.0,1.0,0.0,0.0
71,SNAP,2021-03-05,05:45PM,Snap (SNAP) Stock Sinks As Market Gains: What You Should Know,0.0,0.806,0.194,0.34
72,SNAP,2021-03-05,03:32PM,Reddit Hires the CFO Who Helped Snap to Go Public,0.0,1.0,0.0,0.0
73,SNAP,2021-03-05,11:38AM,Reddit Ropes In Former Snap Executive Drew Vollero As Finance Chief: Reuters,0.0,1.0,0.0,0.0
74,SNAP,2021-03-05,10:29AM,"Reddit Takes Step Toward Eventual IPO, Naming Vollero First CFO",0.0,1.0,0.0,0.0
75,SNAP,2021-03-05,08:44AM,Reddit Hires Former Snap CFO as It Mulls IPO,0.0,1.0,0.0,0.0
76,SNAP,2021-03-05,07:45AM,3 Reasons Twitter Won't Double Its Annual Revenue by 2023,0.0,1.0,0.0,0.0
77,SNAP,2021-03-05,06:33AM,UPDATE 2-Reddit hires former Snap exec Drew Vollero as first CFO,0.0,1.0,0.0,0.0
78,SNAP,2021-03-04,09:30AM,3 Stocks for the Roaring 2020s,0.0,1.0,0.0,0.0
79,SNAP,2021-03-03,01:00PM,BetterUp CEO expects continued growth post COVID-19,0.0,0.698,0.302,0.3818
80,SNAP,2021-03-02,01:57PM,Here's Why Snap Stock Soared 24% Higher in February,0.0,1.0,0.0,0.0
81,SNAP,2021-03-02,01:29PM,Microsoft Steps Up Push to Bring Virtual Reality to the Masses,0.0,1.0,0.0,0.0
82,SNAP,2021-03-01,06:04PM,SoftBank-Backed Mapbox Names New CEO to Go After Carmakers,0.0,1.0,0.0,0.0
83,SNAP,2021-03-01,10:59AM,Return On Capital Employed Overview: Snap,0.0,1.0,0.0,0.0
84,SNAP,2021-02-28,08:55AM,How Facebook Beats Pinterest And Snapchat At User Monetization,0.0,1.0,0.0,0.0
85,SNAP,2021-02-27,07:15AM,"Forget Facebook, Buy These 2 Social Media Stocks Instead",0.213,0.787,0.0,-0.2263
86,SNAP,2021-02-26,02:29PM,"Twitters upbeat revenue goals boost the stock, but some analysts arent buying it",0.0,0.866,0.134,0.2144
87,SNAP,2021-02-25,12:01AM,EXCLUSIVE: American Eagle Pursues Gen Z With Outer Banks Stars and Snapchat,0.0,0.817,0.183,0.3034
88,SNAP,2021-02-24,05:55PM,Snapchat's 'Open-Ended Growth Story' Solidified After Analyst Day Event,0.0,0.755,0.245,0.3818
89,SNAP,2021-02-24,04:10PM,"Snap Inc. to Participate in the Morgan Stanley Technology, Media & Telecom Conference 2021",0.0,1.0,0.0,0.0
90,SNAP,2021-02-24,01:54PM,Triller CEO Mike Lu says the world chose the app as a 'successor' to TikTok,0.0,1.0,0.0,0.0
91,SNAP,2021-02-24,11:59AM,Snaps big revenue ambitions draw cheers,0.0,0.617,0.383,0.4767
92,SNAP,2021-02-24,10:12AM,Let's Take A Look At This Weeks Top-Performing Sectors,0.0,1.0,0.0,0.0
93,SNAP,2021-02-24,09:56AM,3 Stocks Killing It in This Week's Crazy Calamity,0.531,0.469,0.0,-0.7783
94,SNAP,2021-02-24,09:13AM,Snap Rockets to All-Time High After Major Shakeout,0.247,0.753,0.0,-0.3182
95,SNAP,2021-02-24,07:21AM,3 Growth Stocks I'd Buy Right Now,0.0,0.658,0.342,0.3818
96,SNAP,2021-02-24,03:20AM,"Premarket Movers Wednesday - Square, PRA Health, Snap",0.0,1.0,0.0,0.0
97,SNAP,2021-02-23,07:00PM,Snap: camera angles,0.0,1.0,0.0,0.0
98,SNAP,2021-02-23,06:05PM,Why Snap Stock Surged Today,0.0,1.0,0.0,0.0
99,SNAP,2021-02-23,04:35PM,"Dow, S&P 500 erase sharp losses to end higher as Powell pledges Fed support for economy through COVID crisis",0.267,0.627,0.106,-0.6249
