,ticker,date,time,headline,neg,neu,pos,compound
0,TDG,2021-04-13,06:20AM,Searchlight Capital Partners to Acquire Technical Airborne Components from TransDigm Group,0.0,1.0,0.0,0.0
1,TDG,2021-04-12,10:08AM,TransDigm Inc. -- Moody's assigns B3 ratings to TransDigm's new senior subordinated notes; B1 CFR unchanged,0.0,1.0,0.0,0.0
2,TDG,2021-04-12,07:28AM,TransDigm Group Announces Proposed Private Offering to Refinance Senior Subordinated Notes,0.0,1.0,0.0,0.0
3,TDG,2021-03-21,10:01AM,Is TransDigm (TDG) Stock A Buy or Sell?,0.0,1.0,0.0,0.0
4,TDG,2021-03-06,04:06PM,10 Best Cheap Stocks To Buy Now According To Billionaire Abrams,0.0,0.704,0.296,0.6369
5,TDG,2021-03-01,03:11PM,'We've always been good at picking market niches': Rocket Lab CEO,0.0,0.775,0.225,0.4404
6,TDG,2021-03-01,08:00AM,TransDigm Plans to Divest ScioTeq and TREALITY Businesses to OpenGate Capital,0.0,1.0,0.0,0.0
7,TDG,2021-02-26,12:20PM,"SHAREHOLDER ALERT: Levi & Korsinsky, LLP Notifies Shareholders of an Investigation Concerning Possible Breaches of Fiduciary Duty by Certain Officers and Directors of TransDigm Group Incorporated - TDG",0.0,0.827,0.173,0.6166
8,TDG,2021-02-26,08:10AM,The Smartest People on Wall Street Are Buying These 3 Stocks -- Should You Follow?,0.0,0.765,0.235,0.6124
9,TDG,2021-02-15,06:35AM,"At US$576, Is It Time To Put TransDigm Group Incorporated (NYSE:TDG) On Your Watch List?",0.0,1.0,0.0,0.0
10,TDG,2021-02-10,03:35AM,10 Best Aerospace Stocks to Buy Now,0.0,0.588,0.412,0.6369
11,TDG,2021-02-09,10:31PM,TransDigm Group (TDG) Q1 2021 Earnings Call Transcript,0.0,1.0,0.0,0.0
12,TDG,2021-02-09,10:21AM,"TransDigm's (TDG) Q1 Earnings Miss Estimates, Sales Down Y/Y",0.167,0.833,0.0,-0.1531
13,TDG,2021-02-09,08:45AM,TransDigm Group (TDG) Lags Q1 Earnings and Revenue Estimates,0.238,0.762,0.0,-0.3612
14,TDG,2021-02-09,08:45AM,"TransDigm Group, Inc. to Host Earnings Call",0.0,1.0,0.0,0.0
15,TDG,2021-02-09,07:46AM,Recap: TransDigm Q1 Earnings,0.0,1.0,0.0,0.0
16,TDG,2021-02-08,10:24AM,Preview: TransDigm Gr's Earnings,0.0,1.0,0.0,0.0
17,TDG,2021-02-08,09:22AM,4 Defense Equipment Stocks to Watch as Air Traffic Gradually Improves,0.0,0.65,0.35,0.5106
18,TDG,2021-02-06,09:49PM,12 Best Industrial Stocks to Buy Now,0.0,0.588,0.412,0.6369
19,TDG,2021-02-06,07:00AM,Hindsight 2020: 3 Biggest Investing Lessons of the Past Year,0.0,1.0,0.0,0.0
20,TDG,2021-02-04,08:44AM,TransDigm Group (TDG) to Report Q1 Earnings: What's in Store?,0.0,1.0,0.0,0.0
21,TDG,2021-02-03,11:40AM,Why Shares of Triumph Group Are Flying High Today,0.0,0.569,0.431,0.6486
22,TDG,2021-02-03,08:15AM,Northrop Announces $2B Accelerated Share Repurchase Agreement,0.0,0.481,0.519,0.6597
23,TDG,2021-02-02,02:03PM,Why Shares of TransDigm Fell in January,0.0,0.732,0.268,0.296
24,TDG,2021-02-02,12:31PM,Analysts Estimate TransDigm Group (TDG) to Report a Decline in Earnings: What to Look Out for,0.0,1.0,0.0,0.0
25,TDG,2021-02-01,08:50AM,L3Harris (LHX) Announces Quarterly Dividend Increase of 20%,0.0,0.753,0.247,0.3182
26,TDG,2021-02-01,08:00AM,"TransDigm First Quarter Earnings Report and Conference Call Set for Tuesday, February 9, 2021",0.0,1.0,0.0,0.0
27,TDG,2021-01-29,08:18AM,Is TransDigm Stock a Buy?,0.0,1.0,0.0,0.0
28,TDG,2021-01-20,11:28AM,General Dynamics (GD) Arm Wins $695M US Army Europe Contract,0.0,0.58,0.42,0.7003
29,TDG,2021-01-15,10:35AM,TransDigm's (TDG) Unit Prices 4.6% Senior Notes Worth $1.2B,0.0,0.808,0.192,0.2263
30,TDG,2021-01-14,05:26PM,"TransDigm Group Prices Offering of $1,200 Million of Senior Subordinated Notes",0.0,1.0,0.0,0.0
31,TDG,2021-01-14,10:53AM,TransDigm Inc. -- Moody's assigns B3 ratings to TransDigm's new senior subordinated notes; B1 CFR unchanged,0.0,1.0,0.0,0.0
32,TDG,2021-01-14,08:44AM,TransDigm Group Announces Proposed Private Offering to Refinance Senior Subordinated Notes,0.0,1.0,0.0,0.0
33,TDG,2021-01-07,08:43AM,"Defense Stock Roundup: LMT, BA Win Big Contracts, TDY to Buy FLIR for $8B",0.0,0.694,0.306,0.6486
34,TDG,2021-01-06,09:01AM,TransDigm (TDG) Acquires Cobham Aero Connectivity for $965M,0.0,1.0,0.0,0.0
35,TDG,2021-01-05,08:30AM,TransDigm Completes Acquisition of Cobham Aero Connectivity,0.0,1.0,0.0,0.0
36,TDG,2021-01-02,05:45PM,Billionaire David Abrams Top 10 Stock Picks,0.0,0.769,0.231,0.2023
37,TDG,2020-12-12,11:30AM,Why Is TransDigm (TDG) Up 8.1% Since Last Earnings Report?,0.0,1.0,0.0,0.0
38,TDG,2020-12-08,12:54PM,Is TDG A Good Stock To Buy Now?,0.0,0.674,0.326,0.4404
39,TDG,2020-12-08,10:37AM,"Investing Strategies: Top Tech Trends For 2021, China EV Stock Frenzy, Holding Long-Term Leaders",0.143,0.745,0.112,-0.128
40,TDG,2020-12-08,01:03AM,Warren Buffett Investing Lesson For Growth Traders,0.0,0.698,0.302,0.3818
41,TDG,2020-12-02,09:16AM,"Defense Stock Roundup: NOC, HII Win Big Contracts, TDG Inks Acquisition Deal",0.0,0.654,0.346,0.6486
42,TDG,2020-12-01,09:40AM,"AI Convoy (Luxembourg) S.a.r.l. -- Moody's : Cobham's sale of Cobham Aero Connectivity (""CAC"") to TransDigm is credit positive for both companies",0.0,0.754,0.246,0.7351
43,TDG,2020-11-27,08:00AM,Here's Why TransDigm Stock Can Keep Flying Higher,0.0,1.0,0.0,0.0
44,TDG,2020-11-25,09:11AM,TransDigm (TDG) to Acquire Cobham Aero Connectivity for $965M,0.0,1.0,0.0,0.0
45,TDG,2020-11-24,09:15AM,TransDigm Announces Acquisition of Cobham Aero Connectivity and Provides Update on Potential Divestitures of Former Esterline Operating Units,0.0,1.0,0.0,0.0
46,TDG,2020-11-19,11:43AM,Insider Sells TransDigm Stock,0.0,1.0,0.0,0.0
47,TDG,2020-11-12,11:31PM,TransDigm Group (TDG) Q4 2020 Earnings Call Transcript,0.0,1.0,0.0,0.0
48,TDG,2020-11-12,10:22AM,"TransDigm (TDG) Q4 Earnings Beat Estimates, Sales Fall Y/Y",0.0,1.0,0.0,0.0
49,TDG,2020-11-12,10:21AM,Price Over Earnings Overview: TransDigm,0.0,1.0,0.0,0.0
50,TDG,2020-11-12,09:15AM,"TransDigm Group, Inc. to Host Earnings Call",0.0,1.0,0.0,0.0
51,TDG,2020-11-12,08:35AM,TransDigm Group (TDG) Q4 Earnings and Revenues Top Estimates,0.0,0.816,0.184,0.2023
52,TDG,2020-11-12,07:37AM,TransDigm: Q4 Earnings Insights,0.0,1.0,0.0,0.0
53,TDG,2020-11-12,07:15AM,TransDigm Group Reports Fiscal 2020 Fourth Quarter Results,0.0,1.0,0.0,0.0
54,TDG,2020-11-10,10:27AM,TransDigm Group (TDG) to Report Q4 Earnings: What's in Store?,0.0,1.0,0.0,0.0
55,TDG,2020-11-10,08:54AM,TransDigm Is Said to Compete With Buyout Firms for Cobham Unit,0.0,1.0,0.0,0.0
56,TDG,2020-11-09,11:18AM,Why Shares of Boeing and Its Suppliers Are Up Today,0.0,0.804,0.196,0.296
57,TDG,2020-11-05,01:05PM,TransDigm Group (NYSE:TDG) Has Gifted Shareholders With A Fantastic 197% Total Return On Their Investment,0.0,0.783,0.217,0.5574
58,TDG,2020-11-05,12:30PM,Analysts Estimate TransDigm Group (TDG) to Report a Decline in Earnings: What to Look Out for,0.0,1.0,0.0,0.0
59,TDG,2020-11-03,10:35AM,"Transdigm Shows Rising Relative Strength, Earns An IBD Rating Upgrade",0.0,0.738,0.262,0.4939
60,TDG,2020-10-27,11:10AM,Is TransDigm Stock a Buy?,0.0,1.0,0.0,0.0
61,TDG,2020-10-27,08:20AM,How Heard Capital Has Been Trading Its High Conviction Stock Picks,0.0,1.0,0.0,0.0
62,TDG,2020-10-26,08:00AM,"TransDigm Fourth Quarter Earnings Report and Conference Call Set for Thursday, November 12, 2020",0.0,1.0,0.0,0.0
63,TDG,2020-10-21,01:31PM,Were Hedge Funds Right About Piling Into TransDigm Group Incorporated (TDG)?,0.0,1.0,0.0,0.0
64,TDG,2020-10-01,03:13PM,Why Shares of Triumph Group Are Soaring Today,0.0,0.531,0.469,0.6486
65,TDG,2020-09-26,10:40AM,"Forget Boeing Stock, TransDigm Is a Better Buy Right Now",0.161,0.593,0.246,0.25
66,TDG,2020-09-24,08:44AM,4 Defense Equipment Stocks Worth a Look Amid Coronavirus Woes,0.257,0.442,0.301,-0.128
67,TDG,2020-09-19,03:26PM,Top Insider Buys Highlight for the Week of Sept. 18,0.0,0.656,0.344,0.4939
68,TDG,2020-09-16,04:25PM,Morgan Stanley Bets on These 3 Stocks; Sees Over 40% Upside,0.0,1.0,0.0,0.0
69,TDG,2020-09-16,12:30PM,IBD Rating Upgrades: Transdigm Flashes Improved Technical Strength,0.0,0.488,0.512,0.743
70,TDG,2020-09-03,11:31AM,TransDigm (TDG) Up 7.1% Since Last Earnings Report: Can It Continue?,0.0,1.0,0.0,0.0
71,TDG,2020-08-31,01:34PM,Should I Buy TransDigm Group Incorporated (TDG)?,0.0,1.0,0.0,0.0
72,TDG,2020-08-29,08:19AM,Why TransDigm Group (TDG) Stock is a Compelling Investment Case,0.0,0.808,0.192,0.2263
73,TDG,2020-08-12,09:29AM,"Defense Stock Roundup: HII, TGI, ERJ Miss on Earnings, FLIR, TDG Beat",0.122,0.763,0.115,-0.0258
74,TDG,2020-08-07,12:45PM,TransDigm Holdings UK plc -- Moody's confirms TransDigm Inc.'s B1 CFR; outlook changed to negative,0.209,0.791,0.0,-0.5719
75,TDG,2020-08-04,11:01PM,TransDigm Group (TDG) Q3 2020 Earnings Call Transcript,0.0,1.0,0.0,0.0
76,TDG,2020-08-04,11:47AM,"TransDigm (TDG) Q3 Earnings Beat Estimates, Sales Fall Y/Y",0.0,1.0,0.0,0.0
77,TDG,2020-08-04,08:35AM,TransDigm Group (TDG) Beats Q3 Earnings and Revenue Estimates,0.0,1.0,0.0,0.0
78,TDG,2020-08-04,07:15AM,TransDigm Group Reports Fiscal 2020 Third Quarter Results,0.0,1.0,0.0,0.0
79,TDG,2020-08-03,10:37AM,"Defense Stock Earnings Roster for Aug 4: TDG, KTOS & More",0.0,0.857,0.143,0.128
80,TDG,2020-08-03,08:01AM,TransDigm Group (TDG) to Report Q3 Earnings: What's in Store?,0.0,1.0,0.0,0.0
81,TDG,2020-07-28,12:33PM,Analysts Estimate TransDigm Group (TDG) to Report a Decline in Earnings: What to Look Out for,0.0,1.0,0.0,0.0
82,TDG,2020-07-27,08:00AM,"TransDigm Third Quarter Earnings Report and Conference Call Set for Tuesday, August 4, 2020",0.0,1.0,0.0,0.0
83,TDG,2020-07-22,04:20PM,David Abrams Cuts Camping World Holdings,0.306,0.694,0.0,-0.296
84,TDG,2020-07-12,11:33AM,Is TransDigm Stock a Buy?,0.0,1.0,0.0,0.0
85,TDG,2020-07-08,03:19PM,Were Hedge Funds Right About Piling Into TransDigm Group Incorporated (TDG)?,0.0,1.0,0.0,0.0
86,TDG,2020-06-11,05:52PM,Why Shares of Aerospace Companies Fell Today,0.0,0.732,0.268,0.296
87,TDG,2020-06-09,10:28AM,"The Zacks Analyst Blog Highlights: Raytheon Technologies, Triumph Group, Transdigm Group and The Boeing Company",0.0,0.819,0.181,0.4767
88,TDG,2020-06-09,10:09AM,These 22 buy-rated stocks have gotten as much as 36% ahead of Wall Streets price targets. Something has got to give,0.0,1.0,0.0,0.0
89,TDG,2020-06-08,10:28AM,4 Aerospace Stocks to Gain as U.S. Air Travel Increases,0.0,0.702,0.298,0.5267
90,TDG,2020-06-05,03:26PM,Why Shares of Boeing and Its Suppliers Are Climbing Today,0.0,0.804,0.196,0.296
91,TDG,2020-06-04,01:38PM,TransDigm Holdings UK plc -- Moody's announces completion of a periodic review of ratings of TransDigm Inc.,0.0,1.0,0.0,0.0
92,TDG,2020-06-04,11:31AM,Why Is TransDigm (TDG) Up 47.1% Since Last Earnings Report?,0.0,1.0,0.0,0.0
93,TDG,2020-06-03,08:02PM,Why Shares of Boeing and Its Suppliers Are Rallying Today,0.0,0.804,0.196,0.296
94,TDG,2020-06-03,06:14PM,Why Shares of TransDigm Gained 17% in May,0.0,0.556,0.444,0.5859
95,TDG,2020-05-28,01:18PM,"Lone Pine Capital Exits Salesforce, Union Pacific",0.259,0.741,0.0,-0.2732
96,TDG,2020-05-26,03:53PM,Hedge Funds Started Cashing Out Of TransDigm Group (TDG) During The Crash,0.197,0.803,0.0,-0.4019
97,TDG,2020-05-26,03:24AM,Edited Transcript of TDG earnings conference call or presentation 5-May-20 3:00pm GMT,0.0,1.0,0.0,0.0
98,TDG,2020-05-24,11:14AM,Top Insider Buys Highlight for the Week of May 22,0.0,0.656,0.344,0.4939
99,TDG,2020-05-22,04:08PM,"David Abrams Sells O'Reilly Automotive, Buys TransDigm and Energy Transfer",0.0,0.811,0.189,0.2732
