,ticker,date,time,headline,neg,neu,pos,compound
0,TRIP,2021-04-07,09:51AM,Vaccine passports will revive international travel: Booking Holdings CEO,0.0,0.769,0.231,0.34
1,TRIP,2021-03-30,08:02AM,"Estimating The Intrinsic Value Of TripAdvisor, Inc. (NASDAQ:TRIP)",0.0,0.745,0.255,0.34
2,TRIP,2021-03-29,03:43PM,Is Tripadvisor (TRIP) Stock A Buy or Sell?,0.0,1.0,0.0,0.0
3,TRIP,2021-03-25,08:27AM,TripAdvisor Gains On Hope for a Surge In Travel,0.0,0.531,0.469,0.6486
4,TRIP,2021-03-24,07:00AM,"Tripadvisor and Reckitt, the makers of Lysol, Partner to Restore Traveler Confidence",0.0,0.645,0.355,0.6705
5,TRIP,2021-03-23,08:00AM,Tripadvisor Announces Pricing of $300 Million Convertible Notes Offering,0.0,1.0,0.0,0.0
6,TRIP,2021-03-22,09:56AM,"Tripadvisor, Inc. -- Moody's says Tripadvisor's proposed convertible notes would be credit neutral if most net proceeds are used to repay existing senior notes due 2025",0.0,0.906,0.094,0.3818
7,TRIP,2021-03-22,09:50AM,Moody's says Tripadvisor's proposed convertible notes would be credit neutral if most net proceeds are used to repay existing senior notes due 2025,0.0,0.894,0.106,0.3818
8,TRIP,2021-03-22,06:50AM,"JetBlue, TripAdvisor Fall After Revealing Convertible Debt Sales",0.263,0.737,0.0,-0.3612
9,TRIP,2021-03-22,06:46AM,Tripadvisor Announces $300 Million Convertible Notes Offering,0.0,1.0,0.0,0.0
10,TRIP,2021-03-20,11:30AM,TripAdvisor (TRIP) Up 56.1% Since Last Earnings Report: Can It Continue?,0.0,1.0,0.0,0.0
11,TRIP,2021-03-19,08:00AM,TripAdvisor Stock Soars 100% This Year To Lead Top Online Play Near Buy Point,0.0,0.741,0.259,0.4939
12,TRIP,2021-03-16,07:00AM,Spring Travel in Full Swing: Half of Americans Planning a Trip This Season,0.0,1.0,0.0,0.0
13,TRIP,2021-03-15,05:05PM,Could TripAdvisors New Subscription Program Help Save Hotels?,0.0,0.504,0.496,0.7096
14,TRIP,2021-03-15,03:25PM,Trip.com Group Ltd Adr Getting Closer To Key Technical Measure,0.0,1.0,0.0,0.0
15,TRIP,2021-03-08,07:00AM,Why Tripadvisors Controlling Shareholder Cant Enjoy All the Gains in the Stock,0.175,0.665,0.16,-0.0588
16,TRIP,2021-03-08,07:00AM,A New Way to Reach Travelers: Tripadvisor Enables Hotels to Participate Directly in Travel Membership Program for First Time,0.0,0.939,0.061,0.0258
17,TRIP,2021-03-03,03:53AM,TripAdvisor (TRIP) Stock Jumps 6.7%: Will It Continue to Soar?,0.0,1.0,0.0,0.0
18,TRIP,2021-03-02,01:50PM,Why TripAdvisor Stock Rallied as Much as 10% Today,0.0,1.0,0.0,0.0
19,TRIP,2021-03-02,01:24PM,TripAdvisor Stock Is Soaring. A New Subscription Model Wins a Fan on Wall Street.,0.0,0.625,0.375,0.7184
20,TRIP,2021-03-02,06:20AM,Tripadvisor Upgraded as Citi Calls Plus Plan a 'Thesis Changer',0.0,1.0,0.0,0.0
21,TRIP,2021-02-26,08:49AM,"Zacks Value Trader Highlights: Playa Hotels & Resorts, Hersha Hospitality Trust, Expedia, TripAdvisor and Royal Caribbean Group",0.0,0.711,0.289,0.6908
22,TRIP,2021-02-24,08:00AM,Tripadvisor Chief Financial Officer to Speak at Upcoming Investor Events,0.0,1.0,0.0,0.0
23,TRIP,2021-02-23,07:00AM,The World's Best Beaches for 2021 -- Revealed!,0.0,0.609,0.391,0.6696
24,TRIP,2021-02-23,04:00AM,Tripadvisor and TheFork Announce Leadership Management Transition as Bertrand Jelensperger Moves into Advisory Board Leadership Role and Almir Ambeskovic is Appointed as CEO for TheFork,0.0,1.0,0.0,0.0
25,TRIP,2021-02-22,04:59PM,Travel Firm Sabre's RS Rating Jumps To 80,0.0,1.0,0.0,0.0
26,TRIP,2021-02-22,10:00AM,Tripadvisor Targets Raised on Outlook for Plus Subscription Service,0.0,1.0,0.0,0.0
27,TRIP,2021-02-19,03:00PM,TripAdvisor Inc (TRIP) Q4 2020 Earnings Call Transcript,0.0,1.0,0.0,0.0
28,TRIP,2021-02-19,06:30AM,"TripAdvisor, Inc. to Host Earnings Call",0.0,1.0,0.0,0.0
29,TRIP,2021-02-18,04:30PM,Recap: TripAdvisor Q4 Earnings,0.0,1.0,0.0,0.0
30,TRIP,2021-02-18,04:13PM,"Tripadvisor, Inc. Earnings Press Release Available on Company's Investor Relations Site",0.0,1.0,0.0,0.0
31,TRIP,2021-02-17,10:25AM,Earnings Outlook For TripAdvisor,0.0,1.0,0.0,0.0
32,TRIP,2021-02-08,09:10AM,Are TripAdvisor (TRIP) and Yelp (YELP) Overpriced?,0.0,1.0,0.0,0.0
33,TRIP,2021-02-05,12:37PM,IAC Stock Rally Continues. The Vimeo Show Picks Up More Fans.,0.0,1.0,0.0,0.0
34,TRIP,2021-02-03,11:15AM,Tripadvisor's Global Headquarters to Serve as COVID-19 Community Vaccination Center for Newton-Wellesley Hospital/Mass General Brigham Patients,0.0,1.0,0.0,0.0
35,TRIP,2021-01-29,04:01PM,"Tripadvisor to Host Fourth Quarter and Full Year 2020 Conference Call on February 19, 2021",0.0,1.0,0.0,0.0
36,TRIP,2021-01-29,05:29AM,TripAdvisor (NASDAQ:TRIP) Share Prices Have Dropped 48% In The Last Five Years,0.0,0.833,0.167,0.296
37,TRIP,2021-01-26,07:00AM,Trending Destinations for Travel-Starved Americans Revealed: Tripadvisor Announces 2021 Travelers' Choice Best of the Best Awards,0.0,0.533,0.467,0.9081
38,TRIP,2021-01-23,03:55AM,Is Guild Holdings Company (NYSE:GHLD) Popular Amongst Insiders?,0.0,0.714,0.286,0.4215
39,TRIP,2021-01-21,07:00AM,"5 Travel Trends to Watch in 2021, According to Tripadvisor",0.0,1.0,0.0,0.0
40,TRIP,2021-01-19,12:23PM,A Valuable Lesson Learned from TripAdvisor (TRIP),0.0,0.617,0.383,0.4767
41,TRIP,2021-01-15,10:50AM,"Sabre Reaches 80-Plus RS Rating, Anticipating A Travel Uptick?",0.0,0.854,0.146,0.0516
42,TRIP,2021-01-08,04:29PM,Why TripAdvisor Stock Jumped 11.5% Today,0.0,1.0,0.0,0.0
43,TRIP,2021-01-08,04:25PM,"TripAdvisor, Acacia, WD-40: 5 Top Stock Gainers for Friday",0.0,0.795,0.205,0.2023
44,TRIP,2021-01-08,03:04PM,TripAdvisor Climbs Following Bullish Deutsche Bank Note,0.0,1.0,0.0,0.0
45,TRIP,2021-01-08,05:59AM,Post-Vaccine Travel to Boost TripAdvisor: Deutsche,0.0,0.649,0.351,0.4019
46,TRIP,2020-12-28,09:43AM,Travel Space Holds Upside Potential for 2021: 3 Stocks in Focus,0.0,1.0,0.0,0.0
47,TRIP,2020-12-28,07:28AM,Yelp Adapted to the Pandemic. Now Its Stock Is Poised to Rebound.,0.0,0.846,0.154,0.25
48,TRIP,2020-12-22,11:28AM,IAC Stock Is Soaring on Its Plans to Spin Out Vimeo,0.0,1.0,0.0,0.0
49,TRIP,2020-12-17,04:56PM,Google Antitrust Actions May Have Hit a Tipping Point,0.0,1.0,0.0,0.0
50,TRIP,2020-12-17,01:09PM,"Google hit with yet another antitrust suit, this one focused on core search engine",0.0,0.833,0.167,0.3818
51,TRIP,2020-12-15,03:38AM,How Much Is TripAdvisor's (NASDAQ:TRIP) CEO Getting Paid?,0.0,1.0,0.0,0.0
52,TRIP,2020-12-11,02:16PM,Airbnb Valuation Reaches $100 Billion in Trading Debut Surge,0.0,0.87,0.13,0.0516
53,TRIP,2020-12-10,09:14AM,The Airbnb IPO: Should You Buy ABNB?,0.0,1.0,0.0,0.0
54,TRIP,2020-12-09,01:56AM,Tripadvisor shares drop following China app ban,0.479,0.336,0.185,-0.5423
55,TRIP,2020-12-08,04:36PM,Why TripAdvisor Soared 37% in November,0.0,1.0,0.0,0.0
56,TRIP,2020-12-08,11:15AM,Insider Sells TripAdvisor's Shares,0.0,0.577,0.423,0.296
57,TRIP,2020-12-08,07:00AM,Introducing Reco from Tripadvisor: New platform matches travelers with a personal Trip Designer to simplify vacation planning,0.0,1.0,0.0,0.0
58,TRIP,2020-12-07,11:48PM,"China removes TripAdvisor, 104 other apps from stores under cleansing campaign",0.0,1.0,0.0,0.0
59,TRIP,2020-12-07,05:02PM,"Tripadvisor to Present at the Barclays Global Technology, Media and Communications Conference",0.0,1.0,0.0,0.0
60,TRIP,2020-12-07,04:08AM,UBS Says These 4 Pandemic-Thrashed Stocks Have Become Cheap Relative To Their Earnings,0.0,1.0,0.0,0.0
61,TRIP,2020-12-05,11:32AM,Why Is TripAdvisor (TRIP) Up 50.6% Since Last Earnings Report?,0.0,1.0,0.0,0.0
62,TRIP,2020-12-04,10:30AM,TripAdvisor Earns IBD Rating Upgrade As Summer Vacation Planning Begins,0.0,1.0,0.0,0.0
63,TRIP,2020-12-02,04:05PM,Guild Holdings Company Reports Third Quarter 2020 Results,0.0,1.0,0.0,0.0
64,TRIP,2020-12-01,12:17PM,Online Travel Agencies Have Problems Beyond Covid. One Stock to Buy and One to Sell.,0.162,0.838,0.0,-0.4019
65,TRIP,2020-11-25,08:00AM,Guild Holdings Company Announces Third Quarter 2020 Earnings Webcast Details,0.0,1.0,0.0,0.0
66,TRIP,2020-11-24,12:51PM,Business travel may never return to pre-pandemic levels: Trivago CEO,0.0,1.0,0.0,0.0
67,TRIP,2020-11-23,08:05AM,3 Stocks to Avoid This Week,0.355,0.645,0.0,-0.296
68,TRIP,2020-11-18,12:00PM,New Research by Tripadvisor and Phocuswright reveals latest traveler trends and top recovering destinations,0.0,0.878,0.122,0.2023
69,TRIP,2020-11-16,10:43AM,TripAdvisor (TRIP) Looks Good: Stock Adds 8.3% in Session,0.0,0.734,0.266,0.4404
70,TRIP,2020-11-16,07:06AM,3 Stocks to Avoid This Week,0.355,0.645,0.0,-0.296
71,TRIP,2020-11-13,05:42AM,Google is being targeted by these tech companies urging regulators to take action against its clear abuse of dominance,0.171,0.65,0.179,-0.2023
72,TRIP,2020-11-09,02:49PM,"Why Booking Holdings, TripAdvisor, and Trivago Stocks Skyrocketed Today",0.0,1.0,0.0,0.0
73,TRIP,2020-11-09,11:05AM,Travel service stocks get a big boost from good news on potential COVID-19 vaccine,0.0,0.663,0.337,0.6808
74,TRIP,2020-11-09,11:03AM,"Analyst Estimates: Here's What Brokers Think Of TripAdvisor, Inc. (NASDAQ:TRIP) After Its Third-Quarter Report",0.0,1.0,0.0,0.0
75,TRIP,2020-11-09,07:00AM,Tripadvisor Reveals 2020 Thanksgiving Travel Index: Over Half (56%) of Americans Still Traveling,0.0,1.0,0.0,0.0
76,TRIP,2020-11-06,02:31PM,TripAdvisor Inc (TRIP) Q3 2020 Earnings Call Transcript,0.0,1.0,0.0,0.0
77,TRIP,2020-11-06,08:33AM,"TripAdvisor (TRIP) Q3 Loss Narrower Than Expected, Sales Top",0.207,0.631,0.162,-0.128
78,TRIP,2020-11-06,06:30AM,"TripAdvisor, Inc. to Host Earnings Call",0.0,1.0,0.0,0.0
79,TRIP,2020-11-05,05:55PM,"TripAdvisor (TRIP) Reports Q3 Loss, Tops Revenue Estimates",0.198,0.517,0.284,0.25
80,TRIP,2020-11-05,04:12PM,"Tripadvisor, Inc. Earnings Press Release Available on Company's Investor Relations Site",0.0,1.0,0.0,0.0
81,TRIP,2020-11-05,04:05PM,"IAC Raises $150 Million for Vimeo Unit, Plans Spinoff",0.0,1.0,0.0,0.0
82,TRIP,2020-11-04,06:22PM,Expedia Earnings Beat Estimates on Uptick in Summer Travel,0.0,1.0,0.0,0.0
83,TRIP,2020-11-03,07:34AM,What's in the Offing for TripAdvisor's (TRIP) Q3 Earnings?,0.0,1.0,0.0,0.0
84,TRIP,2020-11-02,08:36AM,3 Stocks That Need More Than a Vaccine to Bounce Back in 2021,0.0,1.0,0.0,0.0
85,TRIP,2020-11-01,01:00PM,TripAdvisor Earnings: What to Watch,0.0,1.0,0.0,0.0
86,TRIP,2020-10-29,12:35PM,Earnings Preview: TripAdvisor (TRIP) Q3 Earnings Expected to Decline,0.0,1.0,0.0,0.0
87,TRIP,2020-10-27,08:58AM,Tripadvisor Ramps Up Support for Hotels With Launch of Two New Technology Solutions,0.0,0.714,0.286,0.5267
88,TRIP,2020-10-26,04:45PM,Guild Holdings Company Announces Closing of Initial Public Offering,0.0,1.0,0.0,0.0
89,TRIP,2020-10-23,01:52PM,'I may be contributing to the growing inequality: Venture capitalist on the conundrum of Silicon Valley,0.0,0.898,0.102,0.1779
90,TRIP,2020-10-21,12:55PM,"At US$19.65, Is It Time To Put TripAdvisor, Inc. (NASDAQ:TRIP) On Your Watch List?",0.0,1.0,0.0,0.0
91,TRIP,2020-10-13,07:00AM,America's Best Road Trips,0.0,0.417,0.583,0.6369
92,TRIP,2020-10-09,07:30AM,"TripAdvisor Unveils Menu Connect, Boosts Restaurant Offerings",0.0,0.723,0.277,0.3182
93,TRIP,2020-10-08,03:36PM,Tripadvisor Launches Menu Management Platform For Restaurants,0.0,1.0,0.0,0.0
94,TRIP,2020-10-07,07:00AM,Tripadvisor Launches Menu Connect for Restaurants to Manage Their Complete Online Presence,0.0,1.0,0.0,0.0
95,TRIP,2020-10-06,07:49PM,Big Tech Under Attack: Key Allegations in House Antitrust Report,0.256,0.744,0.0,-0.4767
96,TRIP,2020-09-28,08:44PM,Hedge Funds Are Selling Tripadvisor Inc (TRIP),0.0,1.0,0.0,0.0
97,TRIP,2020-09-23,06:00AM,DoubleTree by Hilton Hotel Orlando Airport Wins 2020 TripAdvisor Travelers Choice Award for Best of the Best,0.0,0.455,0.545,0.9485
98,TRIP,2020-09-15,03:04PM,"Are Insiders Buying TripAdvisor, Inc. (NASDAQ:TRIP) Stock?",0.0,1.0,0.0,0.0
99,TRIP,2020-09-15,07:00AM,"Utilizing Tripadvisor's New Proprietary First-Party Data Platform, Tripadvisor Navigator, Abu Dhabi (DCT Abu Dhabi) Partners With Tripadvisor in Launching New Campaign to Drive Traveler Inspiration and High Return on Advertising Spend ",0.0,0.898,0.102,0.5267
